Exported by,ExportComments.com,,,,,,,
149,,@michaelkahn8744,11/04/24 04:29:15,0,no,no,"Alternative Explanation of Dark Matter and Dark Energy

Einstein’s theory of General Relativity states that spacetime is curved by the presence of mass. This curvature influences the motion other objects with mass and gives rise to gravitation. Thus, gravity is a result of geometric features in spacetime.

However, we also observe gravitational effects – curvature of spacetime – in areas without any detectable mass. This has given rise to the concept of dark matter, which is matter that does not interact in any detectable way with normal matter, except through gravity. So, there is some large quantity of dark matter scattered throughout the universe, which curves spacetime and causes gravitational effects just like normal matter, but we cannot see or detect it with any known method.

An alternative theory to the identity of dark matter is proposed – it is not matter at all, but rather an intrinsic curvature of spacetime. In other words, spacetime is not naturally flat. Even in the absence of matter, we observe some inherent curvature of spacetime.

So, the question is now – why is spacetime naturally curved? Why is it not flat in the absence of mass?

The universe is 4-dimensional, with 3 spatial dimensions and one dimension in time. Rather than consider time as a linear dimension, we can consider it as a radial one. Therefore, rather than describing the universe with a Cartesian coordinate system, we describe it with a 4-dimensional spherical coordinate system – 3 angular coordinates, ?1,  ?2,  ?3, and one radial coordinate in time, t. We live on the 3-dimensional surface of a 4-dimensional bubble which is expanding radially in time. Thus, the Big Bang represents t=0, the beginning of time.

The crucial point is that the expansion of the universe is not homogeneous in all directions. The expansion rate at one point on the bubble’s surface may differ slightly from another point near it. The universe is only roughly spherical in 4 dimensions, the same way that the Earth is only roughly spherical in 3 dimensions. The same way we observe local mountains and valleys on the surface of Earth, we observe local “mountains” and “valleys” on the surface of the universe bubble. The inhomogeneity of the expansion of the universe has given rise to natural curvature of spacetime. This natural curvature causes the phenomenon of “dark matter”.

“Valleys” in spacetime pull matter in, similarly to the warping of spacetime of massive objects. So “dark matter” is really “valleys” in spacetime that are expanding slower than the regions surrounding it. These valleys tend to pull matter in and create planets, stars, and galaxies – regions of space with higher-than-average densities of mass. Conversely, “mountains” in spacetime will repel matter away, an “anti-gravitational” effect, which gives rise to cosmic voids in space where we observe no matter.

Each point on the surface of the universe bubble traces out a time arrow in 4-dimensional space, perpendicular to the surface. These time arrows are not parallel to each other since the universe is not flat. This causes points to have nonzero relative velocity away from each other. It is generally accepted that the universe is expanding faster than observable energy can explain, and this is expansion is believe to be still accelerating. The “missing” energy required to explain these observations has given rise to the theory of dark energy. The time dilation caused by non-parallel time arrows can be proposed as an explanation for dark energy. Alternatively, dark energy is real energy coming from potential energy gradients caused by non-parallel time arrows.

As a sanity check, we can calculate the expansion rate of the universe based on the universe bubble model. Since the radius of the universe bubble is expanding at the speed of light in the time direction, it increases at 1 light second per second. Therefore, the “circumference” of the 3-dimensional surface increases by 2? light seconds per second, or about 1.88*10^6 km/s. This expansion is distributed equally across the 3-dimensional surface, so the actual observed expansion rate is proportional to the distance from the observer. At present, the age of the universe is estimated to be 13.8 billion years, so the radius of the universe bubble is 13.8 billion light years, or about 4233 megaparsecs (3.26 million light years to 1 Mpc). Thus, we can calculate the expansion rate of the universe, per megaparsec from the observer, as:

Expansion rate = ((d(circumference))/dt)/radiusofuniverse=(1.88*?10?^6  km?s)/(2?*4233Mpc)=(1.88*?10?^6  km?s)/26598Mpc=70.82(km?s)/Mpc

The popularly accepted empirical expansion rate is 73.5 + 2.5 km/s/Mpc, so our calculated value is close. There may be some additional source of expansion (or observed red shift) to make up for the discrepancy. For example, if two adjacent points have some gravitational gradient due to non-parallel time arrows, then light passing through these points will be red-shifted. – Cited from https://www.academia.edu/82481487/Title_Alternative_Explanation_of_Dark_Matter_and_Dark_Energy",view comment
150,,@SamarArons,11/04/24 10:59:30,0,no,no,"The phenomena dark matter always makes me think of ""this source is called darkness"", a line in the first verse of the Dao De Djing, or Tao Te Ching, written down before 300 BC. What Brian Cox explains here about dark matter resonates wonderfully with this ancient text: 

Tao Te Ching – Verse 1

The tao that can be told
is not the eternal Tao
The name that can be named
is not the eternal Name.

The unnamable is the eternally real.
Naming is the origin of all particular things.
Free from desire, you realize the mystery.
Caught in desire, you see only the manifestations.

Yet mystery and manifestations
arise from the same source.
This source is called darkness.

Darkness within darkness.
The gateway to all understanding.

(translation by Stephen Mitchell, 1995)",view comment
151,,@mikeflannery7905,11/04/24 11:36:34,0,no,no,"Perhaps there is no dark matter, perhaps they just have wrong models?",view comment
152,,@JDRied,11/04/24 17:38:07,0,no,no,It is only matter that is outside of our visual perception. There is more to the spectrum of “light” than we can visually see.,view comment
153,,@timmyers4988,11/04/24 18:51:39,0,no,no,"Dark Matter is a THEORY, made up by barely sentient, hairless apes to make our limited intelligence and comprehension of things seem superior to that of amoeba’s!",view comment
154,,@penguinista,11/04/24 19:33:29,0,no,no,I like to think it is matter in a 'nearby' parallel universe (or universes) and the distortion in spacetime caused by its mass bleeds over to our universe.,view comment
155,,@matthewglaser1812,12/04/24 01:04:40,0,no,no,Could it be a lot of smallish black holes?,view comment
156,,@embracelove7502,12/04/24 02:06:47,0,no,no,Dark Matter is the gaps in modern Math,view comment
157,,@iRossco,12/04/24 05:41:31,0,no,no,Dark matter...dark gravity...sounds a lot like black holes out there!,view comment
158,,@PawpiChoolo,12/04/24 08:04:47,0,no,no,5:1? More like almost infinity to 1.,view comment
159,,@sentgrace5188,12/04/24 12:27:08,0,no,no,"Hello Brian!
I enjoy your way of sharing your thoughts & experiences very much.
Questions about Dark matter?

It is the Love Matter.
The Matter which invisibly
binds US, one to another.
??????????
We can heal.",view comment
160,,@user-sc6rp3pu2y,12/04/24 15:22:08,0,no,no,Dark matterS,view comment
161,,@DS-fo4ed,12/04/24 19:23:26,0,no,no,He needs to get his upper  lateral incisors and canines bleached to match the two central incisor veneers / crowns that he already has,view comment
162,,@MrIseOled,12/04/24 21:03:36,0,no,no,"Dark matter is something shadow is for light, it´s just something that isn´t.",view comment
163,,@Parssel,13/04/24 00:09:50,0,no,no,Why do they call it dark matter and not invisible matter or unlike matter matter or non-matter or angelic matter  or spirit or god web or unidentified variable?,view comment
164,,@winterphilosophy3900,13/04/24 04:41:20,0,no,no,It's cloaking technology : D,view comment
165,,@user-xv2cr2pr5g,13/04/24 07:47:09,0,no,no,Black Matter... is mata. The origin of all.,view comment
166,,@TurboShred13,13/04/24 18:33:56,0,no,no,Dark matter isnt real,view comment
167,,@alkelly1591,13/04/24 23:23:12,0,no,no,I’m not buying the dark matter theory. Feels like something made up that just allows formulas to balance. Love Brian though. Watch all his shows. Very interesting,view comment
168,,@johnphillips2479,14/04/24 05:16:12,0,no,no,"How do you know!!! If something you, can't detect, is incapable of clumping?",view comment
169,,@pirga19,14/04/24 09:57:31,0,no,no,if you need more stuff to satisfy your equation it might be that you need new equation not more stuff,view comment
170,,@danmartens8855,14/04/24 13:27:05,0,no,no,"Dark Matter is the Phlogiston of our time.

It is an ""undetectable substance"" that only exists in our equations.",view comment
171,,@KirenKK-te7pb,14/04/24 17:51:32,0,no,no,Wave forms.,view comment
172,,@xgentis,14/04/24 20:47:53,0,no,no,"He could have say ""We don't know what dark matter is"" .",view comment
173,,@lambeefbiryani08,14/04/24 21:54:20,0,no,no,It's like voidd??,view comment
174,,@user-oh2zx6kk2u,14/04/24 23:00:00,0,no,no,"Listen ti all this bullshit. Just answer the damn question. “I don’t know”. “Know one knows”, “hell we can’t even prove it exist”.",view comment
175,,@grativy,15/04/24 02:45:03,0,no,no,it is light that hasn't interacted with anything,view comment
176,,@Supernaturalcloak,15/04/24 05:58:58,0,no,no,Ether... that's it.,view comment
177,,@cultureal9544,15/04/24 07:07:07,0,no,no,The Fabric is made of Dark Matter  period,view comment
178,,@zarkojovic1634,15/04/24 11:12:37,0,no,no,It's not a particle. It's a placeholder. Like a screen's pixel. Which enables translation. And depending what kind of energy it hold it enables it's properties and becomes a particle... That's why you don't see it Colider...,view comment
179,,@kingsman428,15/04/24 16:26:20,0,no,no,"Reminds me of when someone asked Richard Feynman ""what's going on with magnets?"" ??",view comment
180,,@dzonibravo7867,15/04/24 21:37:32,0,no,no,"World we can't see, feel or measure : 5
World we can see, feel or measure : 1
And modern science is like 300 years old? We know nothing.",view comment
181,,@mrreemann3739,15/04/24 21:50:40,1,no,no,"Dark matter and dark energy fudge the math to make accepted scientific theories work. There isn't enough visible matter to cause the universe to expand, yet stay together, and behave the way it does using Newtonian physics. Dark matter and dark energy were invented as placeholders for something we, as of yet, do not understand.

See Rupert Sheldrake: 'Science Set Free', and  'The Science Delusion'",view comment
182,,@accountbc914,15/04/24 22:03:24,0,no,no,"Dark matter and energy is equivalent with: Don't know matter and don't know energy. When something doesn't align with the preferred theory, they come up with a cute name ""Dark"". If scientist were honest and had less vanity, they would acknowledge their shortcomings by naming things with more precise names. Dark energy basically is a filler for the contradictory behavior of the acceleration of the universe. They don't know why, so they call it dark, instead of the more precise ""don't know why"". Since Einstein we got worst scientist with a lot bigger egos. Old scientist used to make fun of themselves on how the more they knew, the less understanding they realized they had...",view comment
183,,@baldrianpill,15/04/24 22:49:34,0,no,no,Is he gaÿ?,view comment
184,,@user-wd8cw5uh1u,16/04/24 01:08:57,0,no,no,Antyfoton,view comment
185,,@jontheman3527,16/04/24 06:15:28,0,no,no,The Lord said let there be light,view comment
186,,@xxACIDVIRUSxx,16/04/24 07:05:31,0,no,no,"“Some sort of matter, but if we can’t see it, then it really doesn’t matter” pun intended!",view comment
187,,@Iamjulez27,16/04/24 15:40:21,0,no,no,An invention by dweeblets who think they can diminish and even destroy all logic and reason because of a humungous ignorant fold of sheep.,view comment
188,,@interiorinsightsbyraj,16/04/24 18:26:45,0,no,no,Research the word Tattva,view comment
189,,@frederickwilt5541,16/04/24 23:35:07,0,no,no,Just plain old gravel.,view comment
190,,@dustinspillman6700,17/04/24 00:30:39,0,no,no,This guy needs to be friends with Elon!,view comment
191,,@jordang7971,18/04/24 07:57:01,0,no,no,Hasn’t this since changed and they’ve found a particle or so they think but haven’t named it knows how it work etc yet properly but called it the dark matter thing,view comment
192,,@m1galla,18/04/24 11:59:54,0,no,no,Great explanation,view comment
193,,@alexcraziy,18/04/24 16:48:45,0,no,no,His such a beautiful boy ??,view comment
194,,@markkar4663,18/04/24 18:47:48,1,no,no,"Dark matter is a load of bs created by mathemagicians. Cox, you'd be better off starting another glam rock band since you'd actually produce something real.",view comment
195,,@asifkaleem3908,18/04/24 23:01:39,0,no,no,I am a physician MD but wish could have been a physicist if had found him as a teacher earlier,view comment
,,,,,,,,
