Exported by,ExportComments.com,,,,,,,,
Source URL,https://www.reddit.com/r/spaceporn/comments/zizuaq/dark_matter_in_a_simulated_universe/,,,,,,,,
Timezone,,,,,,,,,
Summary,Author: MorningStar_imangi | Score: 8749 | Votes UP: 8749 (Ratio 98%) | Votes DOWN: 0,,,,,,,,
Some Comments may not appear here because of their privacy settings,,,,,,,,,
,,,,,,,,,
,,Author,Date,Votes UP,Votes Down,Score,Message,isPremium,(view source)
1,,MorningStar_imangi,11/12/22,8749,,8749,Dark Matter in a Simulated Universe,no,view comment
2,,MorningStar_imangi,11/12/22,297,,297,"The gravity of unseen dark matter is the leading explanation for why galaxies rotate so fast, why galaxies orbit clusters so fast, why gravitational lenses so strongly deflect light, and why visible matter is distributed as it is both in the local universe and on the cosmic microwave background. The featured image from the American Museum of Natural History's Hayden Planetarium Space Show Dark Universe highlights one example of how pervasive dark matter might haunt our universe. In this frame from a detailed computer simulation, complex filaments of dark matter, shown in black, are strewn about the universe like spider webs, while the relatively rare clumps of familiar baryonic matter are colored orange. These simulations are good statistical matches to astronomical observations.

[Source](https://physics.yale.edu/event/physics-club-frank-van-den-bosch-yale-university-new-insights-cosmology-and-galaxy-halo)

Illustration Credit & Copyright : Tom Abel & Ralf Kaehler (KIPAC, SLAC), AMNH",no,view comment
3,,1DebbieJayne,11/12/22,718,,718,Looks like brain synapses. ??,no,view comment
4,,SqueezeMeh,11/12/22,,,0,Tf,no,view comment
5,,ChristianRaphiel,11/12/22,62,,62,So we know for a fact that Dark Matter actually exists right?,yes,view comment
6,,jlopez77502,11/12/22,17,,17,i wish i had the brain capacity to even begin to understand this image,no,view comment
7,,MysteriousHawk2480,11/12/22,-13,,-13,Yeah,no,view comment
8,,MysteriousHawk2480,11/12/22,-13,,-13,Its is a theory ofc like all good thing scienctific,no,view comment
9,,TheMurku,11/12/22,115,,115,"Dark Matter. Dark Energy. Dark Flow. Dark Fluid.

Dark is the word used to replace unknown but theorized.",no,view comment
10,,Sea_Contact_3403,11/12/22,-15,,-15,![gif](emote|free_emotes_pack|facepalm)![gif](emote|free_emotes_pack|sunglasses),no,view comment
11,,nivlark,11/12/22,145,,145,As well as anything can be known in science: it is the explanation that best fits the available data.,no,view comment
12,,[deleted],11/12/22,28,,28,Always had a fictional idea dark matter would be visually a more liquid-like venom from spider man visual.,no,view comment
13,,Bennybub,11/12/22,104,,104,are we just bacteria in a brain?,no,view comment
14,,cheeznbeansontoast,11/12/22,19,,19,Stuff of nightmares,no,view comment
15,,4channeling,11/12/22,471,,471,We're living in the brain the universe thinks with,no,view comment
16,,St0nemason,11/12/22,108,,108,"No, we're even more insignificant.",no,view comment
17,,ZamanYolcusuJ,11/12/22,-15,,-15,"Yes, %100



People who downvote should explain what bends the light from a galaxy that has nothing between with us",no,view comment
18,,ToBeatOrNotToBeat-,11/12/22,3,,3,I play cod so you already know what im thinking lmao,no,view comment
19,,mekopa,11/12/22,,,0,This is what I see when I close my eyes,no,view comment
20,,Zaphod_Biblebrox,11/12/22,5,,5,It’s so beautiful,no,view comment
21,,ShotBRAKER,11/12/22,11,,11,It’s all theory.,no,view comment
22,,[deleted],11/12/22,32,,32,So we live in between brain neural pathways? I love this,no,view comment
23,,[deleted],11/12/22,4,,4,"Now I want to know, what are you talking about?",no,view comment
24,,ToBeatOrNotToBeat-,11/12/22,2,,2,[Call Of Duty Dark Matter Camo](https://callofduty.fandom.com/wiki/Dark_Matter_Camouflage),no,view comment
25,,United-Student-1607,11/12/22,2,,2,"Is dark matter a real thing, or a ? Of something that should be there based on equations to make sense?",no,view comment
26,,Successful_Cicada336,11/12/22,,,0,Looks like many hair stuck in wool and wool being tied by a hair,no,view comment
27,,404_GravitasNotFound,11/12/22,1,,1,"If Baryonic matter is the orange stuff, and dark matter surrounds it like shown, what is the ""White stuff"" in-between the dark matter... I would guess the void between galactic clusters to be... well. black...",no,view comment
28,,CoraxTechnica,11/12/22,224,,224,"A greater intelligence than we could hope to understand. 
The average human brain has 86 billion synapse. There are more stars than that in the Milky Way",no,view comment
29,,Solid-Version,11/12/22,21,,21,"I read somewhere that the human brain, space and the internet are all structured in very similar ways. It always amazes me how the universe zoomed out looks so much like braincell structures. 

I used to think as a kid that the universe is just the inside of someone’s brain and that we lived in a  Russian doll like simulation or something.",no,view comment
30,,[deleted],11/12/22,38,,38,You're my new wallpaper. I don't have any awards to give but I'll always cherish the time we've had together,no,view comment
31,,Austy6969,11/12/22,11,,11,Goddamn it I hate feeling so insignificant hahah,no,view comment
32,,garysaidwhat,11/12/22,4,,4,"'s wut I've been sayin: Dust bunnies. Whole goddamned universe.

I have a scale model in my guest bedroom.",no,view comment
33,,PaulitoTuGato,11/12/22,,,0,Map of the underworld?,no,view comment
34,,[deleted],11/12/22,31,,31,you mean neural networks? synapses are just the gap between a post and pre synaptic neurons,no,view comment
35,,Pointwelltaken1,11/12/22,34,,34,"We are a virus, per Mr. Smith.",no,view comment
36,,gs722,11/12/22,1,,1,"Out of curiosity, if one was travelling toward a distant star and passed through one of these dark matter regions, what would happen then?",no,view comment
37,,GodOfThunder101,11/12/22,6,,6,blackholes are a possible explanation.,no,view comment
38,,ZamanYolcusuJ,11/12/22,,,0,You know a lot of them are so small to bend a whole galaxy's light. And it is pretty impossible it get that big in middle of nothing,no,view comment
39,,GodOfThunder101,11/12/22,4,,4,there are theories that dark matter consist of primordial black holes. Which were formed in the formation of our universe.,no,view comment
40,,Reble77,11/12/22,2,,2,Close up of the shower plug hole,no,view comment
41,,LysergiclyInclined,11/12/22,21,,21,It looks like a giant..BRAIN ??,no,view comment
42,,immersemeinnature,11/12/22,62,,62,"""how pervasive dark matter might haunt our universe""
I love it",no,view comment
43,,immersemeinnature,11/12/22,6,,6,Hidden?,no,view comment
44,,whiplash808,11/12/22,-3,,-3,"Yes. It’s indirectly measurable gravity that’s not explained when you add up the forces of all known matter (including black holes).

It’s more correct to refer to dark matter as dark gravity. They are synonymous.",no,view comment
45,,[deleted],11/12/22,7,,7,Yeah i was gonna same thing. Reminds me of neurones,no,view comment
46,,[deleted],11/12/22,41,,41,"More like unknown.  Or not properly defined, but there are indication it 'exists'. 
Here there be dragons. Lol",no,view comment
47,,[deleted],11/12/22,2,,2,"The white areas are just where the dark matter ""threads"" are less dense. Basically the emptiest parts of the universe. In reality they'd be black too but then you wouldn't see the structure of dark matter here.",no,view comment
48,,Agent117th,11/12/22,7,,7,This gives me the assumption that black holes are just highways. Looks like a twisted game of chutes and ladders,no,view comment
49,,Dry_Contest_7126,11/12/22,,,0,My theory? We live in a cosmic brain and the neurons  are the filaments we perceive as galaxies....,no,view comment
50,,Dry_Contest_7126,11/12/22,7,,7,My theory? We live in a cosmic brain and the neurons  are the filaments we perceive as galaxies....,no,view comment
51,,immersemeinnature,11/12/22,4,,4,I love it ??,no,view comment
52,,EXTRA-THOT-SAUCE,11/12/22,18,,18,I’m of the belief that this is not a coincidence,no,view comment
53,,Consistent_Video5154,11/12/22,1,,1,"Has anyone studied the effects of dark matter in the vicinity if black holes? I think I read somewhere that d.m. is classified as a w.i.m.p.  But even in light of the ""weakly "" part, I think I've only heard of d.m. affecting baryonic matter and not the other way around. Does ""our"" matter effect d.m. at all? Say like in areas of intense gravity such as that a black hole cold provide? If so, could d.m. exhibit unusual properties if a lot of it gets crammed together? (Think of a lot of U-235 and what it can do). So many questions about dark matter.",no,view comment
54,,Astro_gamer_caver,11/12/22,123,,123,"https://www.universetoday.com/148966/one-of-these-pictures-is-the-brain-the-other-is-the-universe-can-you-tell-which-is-which/  
One of These Pictures Is the Brain, the Other is the Universe. Can You Tell Which is Which?

Fascinating stuff.",no,view comment
55,,WozzaTheWaIrus,11/12/22,14,,14,"Yes, but it’s scientific theory. Much more credible",no,view comment
56,,SupaFlyslammajammazz,11/12/22,5,,5,Dark Matter is the scaffolding of galaxies.,no,view comment
57,,The_Xivili,12/12/22,2,,2,"Elden Beast, anyone?",no,view comment
58,,deelowe,12/12/22,8,,8,Dark matter has never been directly observed. We don’t know what it is exactly.,no,view comment
59,,[deleted],12/12/22,5,,5,Shower drain clog,no,view comment
60,,Amon7777,12/12/22,1,,1,(Shrugs) who knows. We know dark matter has an effect but we don't know what it is in it of itself.,no,view comment
61,,Beachcoma,12/12/22,3,,3,"Why does it look like how the sky looks when one is on LSD?, so I've heard",no,view comment
62,,SamAxesChin,12/12/22,-24,,-24,"And we are an all consuming cancer that with the moon landing and rovers, is attempting to metastasize.",no,view comment
63,,thejustducky1,12/12/22,26,,26,"""The Universe"" is just the brain of a guppy swimming little meaningless circles just offshore of another ocean.",no,view comment
64,,destructor_rph,12/12/22,93,,93,It's the same patterns being repeated on all scales,no,view comment
65,,SirBaronGaming25,12/12/22,1,,1,Looks like my entire nervous system.,no,view comment
66,,nathaneltitane,12/12/22,4,,4,"as above so below, as within so without.",no,view comment
67,,OllieNotAPotato,12/12/22,5,,5,"Second option - scientists see the effects (due to gravity) of a load of stuff in space they can't see. Things like galaxies moving faster than they should and so on. Not an expert but if I remember rightly some of the leading theories are that dark matter is undiscovered massive weakly/non interacting particles , or small black holes. There's some other theories eg. That gravity behaves differently at incredibly large distances but dark matter is the most widely accepted one",no,view comment
68,,[deleted],12/12/22,,,0,[deleted],no,view comment
69,,maineac,12/12/22,10,,10,Looks like neurons and gray matter.,no,view comment
70,,tupacshakyle,12/12/22,12,,12,"We're actually living as part of a super computer which will take 10 million years to give us the answer. [The answer to life, universe, and everything.](https://www.youtube.com/watch?v=aboZctrHfK8&ab_channel=riktw)",no,view comment
71,,Midgetooni,12/12/22,1,,1,When you rub your eyes too hard,no,view comment
72,,PoopDig,12/12/22,29,,29,Mandelbrot has entered the chat,no,view comment
73,,EyeH8uxinfiniteplus1,12/12/22,12,,12,"Why was I having this thought last night and now I'm seeing this same exact thought within 18 hours? That's TOO much, man!",no,view comment
74,,guymcool,12/12/22,19,,19,No. all we know is that galaxy’s cannot behave the way they do with our current model. We have no clue what phenomenon causes these discrepancy’s if it is even matter at all. Our model of physics might be fundamentally wrong.,no,view comment
75,,TheMurku,12/12/22,17,,17,That guy just likes the sound of his own voice.,no,view comment
76,,[deleted],12/12/22,1,,1,Respectfully this looks like a yugioh field spell,no,view comment
77,,[deleted],12/12/22,20,,20,"As above, so below.

-The Kybalion",no,view comment
78,,guymcool,12/12/22,3,,3,Theories can be proven. Then it’s a fact like all good things scientific.,no,view comment
79,,lvspacefan,12/12/22,1,,1,Looks like a haunted forest and we're in it,no,view comment
80,,8005T34,12/12/22,2,,2,"Soooo, what is it ?",no,view comment
81,,UncleDevil666,12/12/22,24,,24,We are the protons and neutrons inside that brain,no,view comment
82,,I_make_things,12/12/22,17,,17,Both of them.,no,view comment
83,,meandering_minds,12/12/22,1,,1,I was thinking the exact same thing!,no,view comment
84,,M8ge_KLLER_99,12/12/22,1,,1,Looks like a mutated nervous system.,no,view comment
85,,anachronist214,12/12/22,1,,1,Dormammu...,no,view comment
86,,kjc1983,12/12/22,20,,20,"Man I have been contemplating this exact kind of thing ever since I was a kid, I swear to god. What always got me is that it’s just so fucking plausible, isn’t it.",no,view comment
87,,LordBeautiful,12/12/22,,,0,You see we’re all living in gods sperm..,no,view comment
88,,Agitated_Wasabi_2671,12/12/22,,,0,I consider the dark matter is God and the dark energy is God’s power.,no,view comment
89,,jonpolis,12/12/22,1,,1,"Repeat after me, ""ontogeny does not recapitulate phylogeny""",no,view comment
90,,Fragrant_Wedding_452,12/12/22,-8,,-8,We are just a figment of God's imagination![gif](emote|free_emotes_pack|dizzy_face),no,view comment
91,,Fragrant_Wedding_452,12/12/22,1,,1,We are just figments of Gods imagination.,no,view comment
92,,Tugendwaechter,12/12/22,15,,15,"The universe is full of self similarity. It’s a very old observation. As above, so below.",no,view comment
93,,Y0U_CAN_CALL_ME_AL,12/12/22,1,,1,Would you care to elaborate? Genuinely just curious what you mean by that,no,view comment
94,,Necothefreeko,12/12/22,1,,1,"The darkness is spreading everybody!! 

~Charlie Murphy",no,view comment
95,,Comprehensive-Kick14,12/12/22,1,,1,Reminds me of the upside down,no,view comment
96,,ProbablyOnLSD69,12/12/22,75,,75,"It’s all fractal as fuck and it’s pretty wild. Like this is all so, soooo weird. Feel like we don’t really talk about just how strange all this is often enough.",no,view comment
97,,paeancapital,12/12/22,2,,2,Not original to new age bullshit.,no,view comment
98,,Rindan,12/12/22,5,,5,"Sure, the thing that explains the motion of the galaxies and what bends light the way it does is... we definitely don't know.

Dark matter is literally an unconfirmed theory that is currently one mathematical solution of many. There are in fact competing theories that also partially explain reality, with MOND being the most famous. 

Dark matter might be the answer, but we literally do not know that yet. There is no experiment that has detected dark matter. 

Just because a theory is in vogue, popular, and getting a pile of funding doesn't mean it is true. The only thing we can say for sure is that we definitely do not know why the universe is the way it is. We are, without any doubt in the world, missing something in cosmology.",no,view comment
99,,LetterheadDramatic37,12/12/22,1,,1,Way up high in a rolly polleeeeeey sky,no,view comment
100,,Borisof007,12/12/22,21,,21,"I always thought about that. How the universe is just a series of repeating patterns.

Black holes act like elementary particles in a lot of ways. Mass, Charge, and Spin - same things that define basic particles.",no,view comment
101,,microdosingrn,12/12/22,5,,5,And mycelium.  And tree/plant roots.,no,view comment
102,,Zagriz,12/12/22,1,,1,"Our consciousnesses are the ""cells"" of a greater whole.",no,view comment
103,,BigTastey2,12/12/22,6,,6,"Even this simplified comment was over my head. I like space stuff. I feel small. I doubt very strongly that this all came from what most think it did, or at least how it came to be. And I also listen to Brian Greene and Brian Cox a lot. But still feel like Forrest Gump here, Jenny.",no,view comment
104,,sudiptaarkadas,12/12/22,1,,1,Are there creatures made of dark matter?,no,view comment
105,,_mick_s,12/12/22,1,,1,Its used to mean we can't see it.,no,view comment
106,,teneggomelet,12/12/22,2,,2,"Or mushrooms.   So I'm , uh, told.",no,view comment
107,,kpidhayny,12/12/22,8,,8,You spelled “42” wrong,no,view comment
108,,Malkiot,12/12/22,3,,3,"Yes, the observations do not match what we should theoretically be observing, unless there is another source of mass/gravity. However we do not seem to be able to observe this matter. We can see the apparent effect, but not the source.

This ""dark"" matter is called that because, if it does exist, it quite literally does not seem to interact with EM radiation as far as we can tell and thus cannot be observed by conventional means, thus being ""dark"".

It's also entirely possible that the observed phenomenon has either a wholly or at least partially different explanation.",no,view comment
109,,tpx187,12/12/22,2,,2,All about that efficiency,no,view comment
110,,tpx187,12/12/22,1,,1,Cause everything is connected.,no,view comment
111,,dnuohxof-1,12/12/22,1,,1,Kinda looks like neurons in a brain,no,view comment
112,,CovidScurred,12/12/22,-14,,-14,Yup and humans are cancer. It’s why we are so eager to spread out. Hopefully we don’t kill this universe,no,view comment
113,,45Hz,12/12/22,6,,6,We haven't unlocked it yet,no,view comment
114,,Kurtman68,12/12/22,1,,1,What Will saw in the upside down.,no,view comment
115,,CaptainMurphy1908,12/12/22,5,,5,"Above and beyond, I imagine; push the envelope. Watch it bend.",no,view comment
116,,The_Mootz_Pallucci,12/12/22,3,,3,universe looks like a massive vascular system around a placenta,no,view comment
117,,SoLongSidekick,12/12/22,5,,5,Yeah I was about to ask which one haha.,no,view comment
118,,jkconno,12/12/22,3,,3,"And beyond, I imagine",no,view comment
119,,DoublefartJackson,12/12/22,19,,19,Crazy to think of the endless darkness beyond the stars.,no,view comment
120,,Apptubrutae,12/12/22,4,,4,"I feel like Degrasse Tyson *literally* likes the way he sounds since he has such a dramatic affect.

Whereas Joe Rogan I feel like is more of a type who really really likes what he’s saying and the voice itself is a bit secondary.",yes,view comment
121,,SnooMacaroons2295,12/12/22,5,,5,"Perhaps we are tiny parasites in an intergalactic brain.

OR, perhaps we are the thoughts in an intergalactic dark matter brain",no,view comment
122,,Apptubrutae,12/12/22,4,,4,"I wouldn’t say that, precisely.

There’s *something* that is making the universe behave in such a way that cannot be explained by non-dark matter alone.  What that is, whether it’s dark matter in a more literal sense, dark energy, or some other force…well that’s the million dollar question.

Dark matter isn’t a thing so much as it is a theoretical construct for an explanation.

What we know for a fact is that the universe as it is has many properties that cannot be explained by visible matter and energy alone as we know it.  That’s the fact.  Dark matter is simple a way to frame whatever it is that we can’t see that is having some sort of effect.  Roughly.",yes,view comment
123,,SecretRefrigerator4,12/12/22,1,,1,What is this universe from the highest macro level possible? Did anyone think about it?,no,view comment
124,,FuckardyJesus,12/12/22,8,,8,"One dark matter theory is that it’s predominantly composed of primordial black holes. These are really tiny (some possibly measured in micrometers) remnants of the Big Bang when matter clumped together asymmetrically. They’d be too small for us to ever likely detect one with current telescopic means, but like any black hole, they pack a ridiculous amount of mass into a tiny space. 

So, that’s *one* way dark matter could be ”hidden”",no,view comment
125,,No-Potential-6,12/12/22,1,,1,Ohh ok. I thought it's hairy stomach part. My mistake.,no,view comment
126,,moaiii,12/12/22,11,,11,"Oh, thanks, I have no more questions now; that explains everything.",no,view comment
127,,MarvinPardroid,12/12/22,1,,1,So what is the white stuff?,no,view comment
128,,SlickNasty519,12/12/22,,,0,"All I read was ""in this frame from a detailed computer simulation"" this is not a real image. Cool looking. Makes you think hard.",no,view comment
129,,skatsnobrd,12/12/22,11,,11,42 is the answer but what we are searching for is the question,no,view comment
130,,destructor_rph,12/12/22,5,,5,I think about this a lot too. Wish i could find some more developed reading on the idea.,no,view comment
131,,destructor_rph,12/12/22,11,,11,"Agreed, i feel like i see these repeating patterns everywhere in life",no,view comment
132,,squirrelhut,12/12/22,1,,1,Absolutely wild,no,view comment
133,,ZamanYolcusuJ,12/12/22,1,,1,We don't know what is it but we know it is there,no,view comment
134,,StudChud,12/12/22,3,,3,Both huffing their own farts,no,view comment
135,,Wonderful-Frosting17,12/12/22,3,,3,we are all just living inside someone’s head...,no,view comment
136,,Wonderful-Frosting17,12/12/22,2,,2,We are definitely in a brain,no,view comment
137,,lookeyloowho,12/12/22,2,,2,I dreamt space felt like chopped up jello,no,view comment
138,,tupacshakyle,12/12/22,2,,2,[FOR SOMEBODY TO LOOOOOOOOOOVE!](https://www.youtube.com/watch?v=SOI4OF7iIr4&ab_channel=JustinBieberVEVO),no,view comment
139,,muchasgaseous,12/12/22,9,,9,"My brain is telling me this image is terrifying, and I have no idea why. The concept is fascinating.",no,view comment
140,,deelowe,12/12/22,3,,3,All we know is that there’s extra gravity that we didn’t predict to be there. It could be anything.,no,view comment
141,,Prior_Produce_3712,12/12/22,5,,5,"And thats all it is. An explanation, much like the explanation of apples falling from trees because 
"" they wanted to""  

""Dark matter"" is just error in the current mathetical formulas we use to understand the structure of the universe.",no,view comment
142,,Pyroluminous,12/12/22,1,,1,"Looks like the gunk between my toes. Sounds like it, too.",no,view comment
143,,cheeznbeansontoast,12/12/22,4,,4,It's amazing amd terrifying. Like something out of war of the worlds but it's made of shower hair,no,view comment
144,,Solid-Version,12/12/22,9,,9,Is that you Agent Smith?,no,view comment
145,,Flashleyredneck,12/12/22,2,,2,Looks like the neural network of a brain.,no,view comment
146,,bonestuart,12/12/22,1,,1,Are you sure? Cause it looks like my new iPhone wallpaper.,no,view comment
147,,Kind_Vanilla7593,12/12/22,1,,1,Looks like my new wallpaper,no,view comment
148,,leon_nerd,12/12/22,2,,2,Can you explain a bit more?,no,view comment
149,,TotallyRealDev,12/12/22,18,,18,Surprisingly there is no beyond the stars as far as we can tell. It might just go on and on forever,no,view comment
150,,fruitsteak_mother,12/12/22,2,,2,your thoughts are the thoughts of the universe,no,view comment
151,,eni91,12/12/22,1,,1,Where can i find a high res of this?,no,view comment
152,,AppleJewsy,12/12/22,1,,1,"How can that, which is essentially the entropy(?) to mass/gravity, be unreactive to EM radiation?",no,view comment
153,,Malkiot,12/12/22,2,,2,"One candidate for dark matter are primordial black holes. In the case of PBHs the EM radiation simply wouldn't be able to leave it's schwarzschildradius hence making it ""dark"" to our observations.

>Since it has never been observed except by its gravity, it does seem most likely that dark matter has no direct or even indirect connection to the standard model of strong and electroweak interactions in particle theory, including the extensions thereof aimed at ameliorating problems with naturalness existing therein with respect to the Higgs boson and the strong CP problem.

>The three clues we mentioned in the Introduction, i.e., the dominance of black holes in the entropy inventory, the CMB spectrum and the holographic entropy maximum all hint at PBHs as the dark matter constituents.

>One ambiguity is whether the maximum entropy limit suggested by holography should be saturated, in which case the mass function for the PEMBHs must be extended to high values.

https://www.ncbi.nlm.nih.gov/pmc/articles/PMC9407584/",no,view comment
154,,chuco915niners,12/12/22,1,,1,Do all galaxies come from black holes?,no,view comment
155,,thephotoshopnerd,12/12/22,3,,3,as a med students that's the first thing I thought as well,no,view comment
156,,Rydorion,12/12/22,1,,1,"Why is it so stringy if visible matter clumps together into blobs?

Or is visible matter also stringy outside of galaxies, but because of lower density it doesn’t glow and we don’t detect it?",no,view comment
157,,Twijasosm,12/12/22,1,,1,I feel like I’m looking at a spiderweb in Australia.,no,view comment
158,,[deleted],12/12/22,12,,12,"Interestingly enough if time went on forever the stars and planets are slowly separating from another which will lead to the heat-death or big freeze of the universe. 

[https://en.wikipedia.org/wiki/Big\_Rip](https://en.wikipedia.org/wiki/Big_Rip)

If this is going to happen in the future, then logically speaking it would have surely happened in some form or sense of the past. Meaning somewhere, far out beyond the stars and that blistering eternal darkness, are traces of more dead universes just like ours.",no,view comment
