Exported by,ExportComments.com,,,,,,,,
140,,cjbest,03/10/18,11,,11,"Read Hawking's last paper. He outlined a model for a smooth exit from inflation which would preclude any multiverse nonsense happening. It now sits more comfortably with our current physics. 

https://arxiv.org/abs/1707.07702
From the paper :

*""... the exit from eternal inflation does not produce an infinite fractal-like multiverse, but is finite and reasonably smooth.""*",no,view comment
141,,[deleted],03/10/18,15,,15,I’d LOVE to be your Euchre partner. ,no,view comment
142,,wobligh,03/10/18,79,,79,"It does the opposite for me. We live in the most exciting times to ever exist. We have a whole shiny new universe to experiment in. Life will go on for an incomprehensible amount of time, long enough to do everything, see everything, experience everything that one could imagine and so much more. Even if we don't find a way to survive through this, having civilizations that span what amounts to eternity and then passing away isn't that bad.

It's even soothing. A blackness that treats everyone and everything equal? Passing peacefull into whatever comes afterwards? I think a universe that's defying all of that, being static forever would be much stranger. Who knows what was before us or comes after us, but things are still progressing.",no,view comment
143,,InAFakeBritishAccent,03/10/18,6,,6,What if instead it's gravity leaking over from slightly adjacent ~~universes~~ space in a folded topology? Kinda like marker bleed-through on an accordion stack of paper.,no,view comment
144,,Hidalgo321,03/10/18,22,,22,"The tossing sea of matter that has been restlessly crashing about for millennia will one day return to stillness, to glass, to void. This doesn’t seem all bad. I take solace in a quote by Carlo-

“The silver thread is snapped, the golden lantern breaks, the pitcher crashes beside the well, the song fades, and the earth returns to dust. And it is fine this way. We can close our eyes, lie our heads down, and rest. This all seems fair, and beautiful to me. This is time.” -Carlo Rovelli ",no,view comment
145,,SUP3RGR33N,03/10/18,12,,12,Damn it. Now I have a cool new perspective to keep me up at night. ,no,view comment
146,,clatterore,03/10/18,-4,,-4,"> Dark matter is one of astronomy’s most embarrassing conundrums: despite comprising 84.5 percent of the matter in the universe, no one can find it.

I would say Dark matter doesnt exist if they cant find it. Its just vacuum, there's nothing there.",no,view comment
147,,readit_later,03/10/18,-4,,-4,Have we ever thought that maybe the math is wrong and dark matter doesn't exist?,no,view comment
148,,[deleted],03/10/18,-2,,-2,"Or may be the omniscient, beneficent creator of all that is.

But no pressure. ",no,view comment
149,,i_am_archimedes,03/10/18,2,,2,"nobody likes to think that maybe its just that the models are wrong

galaxies are spinning faster than what you would predict via newton 

maybe the gravitational force transitions from 1/r^2 to 1/r. if we are in a simulation, calculating r^2 at large distances might not fit into the registers, so the universe lops it off. ",no,view comment
150,,cjbest,03/10/18,3,,3,"Found Elon Musk's account! 

Actually, I think that having 85 percent of the universe left as a quandary points to a non- simulated universe. The Designers would have been more subtle than to leave so much mass unaccounted for. We were bound to notice that problem pretty darn soon after the invention of the telescope. That took us less than three hundred years, after all. (From Hans Lippershey's telescope in 1608 to Jacobus Kapteyn's suggestion of dark matter in 1922.)",no,view comment
151,,ILoveWildlife,03/10/18,46,,46,no more beer when there's no more stars.,no,view comment
152,,hreggram,03/10/18,4,,4,"This is a slight tangent, but I think people should be aware there's some big name people that dispute conclusions reached regarding the expansion rate of the Universe (and thus, I imagine, the roles of dark matter and dark energy). Subir Sarkar is one of the them, from Oxford, I saw him talk there in 2017. The link is a recent Arxiv paper from Sarkar et al.. I'm not an astrophysicist, just a condensed matter guy.
 https://arxiv.org/abs/1808.04597",no,view comment
153,,coltonmusic15,03/10/18,2,,2,"I've often imagined what it would be like if our universe was a single cell in an infinitely and unimaginably large body. Maybe the other universe sized cells gravity interacts with ours like you are saying? Maybe a worm hole isn't transportation from one spot in our universe to another but instead a puncture or merging point of our universe cell with another? 

The amount of energy that it would take to break the wall of the cell would have to be equally tremendous to the energy found within our own universe. ",no,view comment
154,,Farewellsavannah,03/10/18,3,,3,"Is it possible that dark matter is some form of energy/""matter"" in a parallel universe that is directly adjacent to ours?",no,view comment
155,,YassTrapQueen,03/10/18,10,,10,"I feel this 100%. I haven’t come to peace with having finite time yet, tho. ",no,view comment
156,,[deleted],03/10/18,17,,17,[deleted],no,view comment
157,,arefx,03/10/18,59,,59,im too stoned for all of this right now. jesus christ im going to have a heart attack rn lol,no,view comment
158,,wadss,03/10/18,1,,1,there is nothing relevant in astronomy or cosmology thats moving fast enough to have to make  rest mass a distinction.  it's only applicable in particle physics and particle colliders.,no,view comment
159,,[deleted],03/10/18,3,,3,"I can guarantee you that's the first thing everyone checked. Dark matter is looking pretty solid, though.",no,view comment
160,,[deleted],03/10/18,6,,6,Except we can see its gravitational effects. Something has to be responsible.,no,view comment
161,,Int_Brigader,03/10/18,,,0,Dark energy is just unexplored areas of the map. ,no,view comment
162,,[deleted],03/10/18,2,,2,"That's dark energy. Dark matter is completely different, only related in that we don't know what either is, hence the ""dark"" title. Dark matter is matter that accounts for much of every galaxy's mass, but doesn't interact with light.",no,view comment
163,,alienfigure,03/10/18,18,,18,Yeah but you learn martial arts that whole time,no,view comment
164,,bufarreti,03/10/18,1,,1,"Oh shit i think i got this backwards, I thought that because we are missing dark matter black holes can’t exist, but what they mean is that black holes doesn’t explain why we are missing dark matter right?",no,view comment
165,,[deleted],03/10/18,2,,2,What? What does extra-dimensional travel have to do with this?,no,view comment
166,,AngelusALetum,03/10/18,50,,50,Hey! Don’t say that! I’m sure there’s some sort of restaurant at the end of the universe we can chill and trade stories over a beer and burger,no,view comment
167,,[deleted],03/10/18,2,,2,"The stars we see simply cannot account for all the dark matter mass observed. That's why we're looking for something else, that's going back to the drawing board.",no,view comment
168,,Failninjaninja,03/10/18,29,,29,"It really shouldn’t though.  Two possibilities exist. 

1.  Once your dead, your done.  You cease to exist completely.  If this is true the universe dying in the far flung future is meaningless. 

2.  Some other metaphysical reality exists (hey religion and shit).  In this case your consciousness continues through a process that is outside of the physical construct.  If this is true the heat death of the physical universe is not the end and is therefore meaningless. 

",no,view comment
169,,Angel_Tsio,03/10/18,17,,17,"Simply: Galaxies would not stay together

If it were almost anything else, and they didn't have that *something* holding them together, then galaxies would not exist. They would fling out their materials because of their spin

And gravity strength is inversely proportional to distance (divided by distance^2 )

There's not enough visible matter in the universe to hold something hundreds of thousands of light years across together, let alone billions/trillion(maybe more) galaxies

 ",no,view comment
170,,That_1_Dud-e,03/10/18,222,,222,"I recommend a podcast called stuff you should know! Its ELi5 on a huge variety of topics with some great characters. They recently did a dark matter episode that was great, check it out

https://itunes.apple.com/us/podcast/stuff-you-should-know/id278981407?mt=2&i=1000420574174",no,view comment
171,,BlazeOrangeDeer,03/10/18,14,,14," I would add that the gravitational wave detections are direct detections of black holes, in the same way that seeing something is a direct detection with electromagnetic waves. ",no,view comment
172,,blackbeardpremium,03/10/18,1,,1,"From the article:

 what exactly is the dark matter made of? Black holes and objects just a little too small to be stars (so they can't produce light of their own) make up some of it. But all of that adds up to less than one-fifth the total amount of dark matter that must be out there. We believe most of the dark matter is composed of new particles smaller than atoms that are different from anything scientists have ever detected and studied. It seems that the very essence of most of the matter in the universe is different from what you and I and rocks and trees and Earth and the Sun are made of",no,view comment
173,,CrimsonLyrium,03/10/18,38,,38,Not dickish at all. Quite correct. There's a few cosmology textbooks I've worked through as an undergrad that have homework questions that illustrate the very absurdity.,no,view comment
174,,aberneth,03/10/18,18,,18,"You're forgetting about axions! My impression is that the cosmology community is generally about 50/50 on WIMP vs. axion, and I have not met a cosmologist who puts forth MACHOs as a strong candidate. 

(Disclaimer: I'm not a cosmologist, but am a physicist in academia and know and talk with a number of cosmologists)",no,view comment
175,,Mr_November112,03/10/18,5,,5,"African American Matter/Energy

/s",no,view comment
176,,o11c,03/10/18,4,,4,"One thing I've never been able to understand is ""how do we know dark matter isn't simply Hydrogen gas?"", since always there's a lot of Hydrogen in the *foreground* whenever we look at any distant object, so we can't really measure distant Hydrogen.",no,view comment
177,,apocalypsebuddy,03/10/18,1,,1,"That's how I think of it sometimes, but I try not to imagine ""large"" and ""small"". It could be that physical size, or even the concept of physical, only exists in our universe, and there are a number of other layers that together all make up something we can't even imagine. ",no,view comment
178,,imapassenger1,03/10/18,1,,1,I'm guessing we'd detect their gravitational effects but I'm no expert.,no,view comment
179,,elkazay,03/10/18,1,,1,A quick blurb on why we haven’t found dark matter yet: all of our observational equipment operates in relation to the electromagnetic force. The weak and strong nuclear forces have no equipment to measure them yet. ,no,view comment
180,,bboom32,03/10/18,5,,5,That's not what a black hole is,no,view comment
181,,mrmasturbate,03/10/18,1,,1,how the fuck do they even know something's missing??,no,view comment
182,,[deleted],03/10/18,-5,,-5,"Dark matter is like ""god of the gaps."" Totally unscientific shit invented by some f----- scientist.",no,view comment
183,,[deleted],03/10/18,1,,1,[deleted],no,view comment
184,,apocalypsebuddy,03/10/18,44,,44,"For the math to be wrong, it would mean that so many other equations, e=mc^2 for example, would also be wrong. 

It's much more likely that we just aren't currently able to identify what's there. ",no,view comment
185,,bboom32,03/10/18,1,,1,Could've just named it pipe,no,view comment
186,,I_talk,03/10/18,-2,,-2,"The answer to the dark matter dark energy problem comes from a misunderstanding of gravity, or more specifically, the interaction of matter with spacetime. 

Our assumptions in measuring the mass of distant galaxies and stars stems from the constant C and various methods of observation to calculate movement, orbital period, and relative brightness. What is missing is the effects of the ""void"" of space. The void isn't a void, it is permeating with fields that while weakly interact with visible matter, are grand enough to account for the missing mass of the universe. 

The phrase, before the big bang, doesn't make sense in the classical model, however there was existence before the big bang in a universe where these fields created particles and after the big bang, these fields did not stop creating particles. They are just not dense enough for us to measure but they are energetic enough to explain the repulsion forces of the void spaces against galaxies, aiding in the force of gravity by being a sort of pushing force to keep the matter grouped up in clusters vs evenly distributed through space as we see in nature with diffusion.

We are closer to proving and discovering all of these fields and moving into the next phase of research of the cosmos. ",no,view comment
187,,jubmille2000,03/10/18,1,,1,"Dark Mater

http://imgur.com/jwJTnQg",no,view comment
188,,bboom32,03/10/18,5,,5,No because dark matter also includes the fact that distant objects like clusters of galaxies being more attracted to other clusters of galaxies than they should otherwise,no,view comment
189,,[deleted],03/10/18,1,,1,"Usually to do that they have to be orbiting a star... which wobbles.  

If they are rogue... there's no star to make wobble.  We'd have to look for other emissions.  I know Jupiter is noisy... But that might be a challenge.  Like finding a whisper in a crowded room of loud people.    ",no,view comment
190,,bboom32,03/10/18,4,,4,Lol math is the first thing everyone triples checks before telling someone who tells them to triple check everything again,no,view comment
191,,bboom32,03/10/18,1,,1,Yes. And no it didn't work out,no,view comment
192,,antiqua_lumina,03/10/18,1,,1,Could dark matter be explained by variance in the progression of time? ,no,view comment
193,,blahfunk,03/10/18,-1,,-1,Wasn't this proven years ago already mathematically? I thought I saw a video talking about this already?,no,view comment
194,,kevroy314,03/10/18,1,,1,"Looks like this rules out massive black holes but not micro black holes, right? I get that once they're small enough, they decay quickly enough to be ruled out that way, but is there a window in the middle still or no?",no,view comment
195,,bboom32,03/10/18,1,,1,There's a gravity well everywhere dark matter is observed. It would clump up,no,view comment
196,,bboom32,03/10/18,2,,2,Honestly i think your claim that you read the article is a load of bologna and if you did then you did not understand much of it,no,view comment
197,,antiqua_lumina,03/10/18,2,,2,"My armchair nonphysicist intuition is that time moves faster in macroregions of space with less gravity. So the outside of the galaxy appears to rotate faster than the middle because time is actually lapsing much faster on the permiter. Inbetween galaxies the effect is even more pronounced which creates an illusion of accelerating expansion. In reality, the space between galaxies is just like a trillion years post-big bang whereas places like Earth halfway into galaxies are only 13 billion years post bang. 

The idea is probably wrong for a bunch of reasons I don't know, but intuitively that is the best sense I have been able to make of the situation.",no,view comment
198,,Tavarde,03/10/18,1,,1,"Well, all matter exerts gravity upon all surrounding matter so yes, there's little gravity wells everywhere there's matter.  I'm saying stars have a sort of sweeping effect that perhaps isn't found in interstellar space.  Look at early solar systems, it's a star (or stars) surrounded by an accretion disk of material that, over tens of millions of years, coalesce and clump into larger stellar bodies that orbit that star or stars.  Sure there's lots of matter left over in our own solar system but nothing like when it was first born.  I believe it is possible that the space between stars is filled with such rocky material that is found in the accretion disks of young stars, only there's no stars for them to orbit and form planets around.",no,view comment
199,,[deleted],03/10/18,-1,,-1,[deleted],no,view comment
200,,Vodkacannon,03/10/18,2,,2,Everybody also knows that you're a genius,no,view comment
201,,bboom32,03/10/18,1,,1,"It's called a Nebula and it would be visible.

It would also form into solar systems",no,view comment
202,,grimchemical,03/10/18,21,,21,It's always fun when you're getting ready to go to bed and find something you're excited about reading before you fall asleep. ,no,view comment
203,,UpintheWolfTrap,03/10/18,-2,,-2,Everybody also know that you’ve clearly not read The Three Body Trilogy by Liu Cixin ,no,view comment
204,,Tavarde,03/10/18,1,,1,"Nebula are visible, sure, but not everything out there is visible.  Considering we have no actual idea what dark matter is I believe my proposal is at least possible.  Anything at all is possible out there.",no,view comment
205,,[deleted],03/10/18,-5,,-5,[removed],no,view comment
206,,[deleted],03/10/18,36,,36,"I am not a smart man, but I know what love is. ",no,view comment
207,,Wacktive,03/10/18,,,0,"Is it possible that gravity itself is the ""Dark matter"" could it be that we are looking for something that has always been there?",no,view comment
208,,[deleted],03/10/18,,,0,I’m not a scientist so this may sound crazy or amateurish and using the wrong terms but what if it’s not matter in the traditional sense but energy thats “out of phase” some how in a manner we haven’t quite figured out how to measure or detect. Like that point of state of matter that ice gets to between just above freezing and just below liquid state if that makes any sense. It could then have properties of both but missing properties of both. Not quite frozen not quite flowing.,no,view comment
209,,[deleted],03/10/18,3,,3,Well you’re in science. Do you have a better explanation? Probably not. ,no,view comment
210,,bboom32,03/10/18,2,,2,Not everything is actually possible unfortunately,no,view comment
211,,kingofchaos0,03/10/18,29,,29,"[Relevant xkcd](https://www.xkcd.com/1758/)

But to answer your question, yes, there are alternative theories of gravity out there: https://en.m.wikipedia.org/wiki/Modified_Newtonian_dynamics

However, these theories are not without flaws and have their own problems (including most of them still having some missing mass to account for, albeit significantly less than with regular newtonian mechanics).",no,view comment
212,,Tavarde,03/10/18,-2,,-2,"Sure it is.  the universe is big enough that absolutely anything you or I can imagine can exist.  A planet made of cheese.  A neutron star the size of a Buick.  Sentient plants.  Space amoebae.  I'm not really sure why you're being even the least bit combative about this.  This is a sub about space, not politics.  Are you a cosmologist?  An astrophysicist?  ",no,view comment
213,,atwistedvine,03/10/18,42,,42,"Just listened to their Dark Matter ep yesterday, actually!  Favorite podcast, for sure. ",no,view comment
214,,512165381,03/10/18,1,,1,Possibly. We need to texplain dark matter AND dark energy.,no,view comment
215,,bboom32,03/10/18,2,,2,"This is a sub about space, not childhood fantasies. You're the one being defensive and my profession has no relevance",no,view comment
216,,QCA_Tommy,03/10/18,7,,7,"Nope, you’re the first person to ever suggest it. ",no,view comment
217,,[deleted],03/10/18,8,,8,Woah woah woah. This is all moving way too fast for me. Can't we just take it slow and fuck instead?,no,view comment
218,,technocraticTemplar,03/10/18,1,,1,"There's a lot of problems other than that.  We also see gravitational lensing from this stuff, and there have been particular cases where the lensing wasn't coming right from where the galaxy was - the galaxy had recently undergone a collision, and it was as though the halo of stuff had continued on without it for a bit, exactly as we'd expect to see if dark matter were physical stuff.  Explaining the widescale structure of the universe requires this stuff, and changing how gravity falls off definitely wouldn't be able to solve both of those at once.

People don't think the models are wrong because in the ~80 years that we've known about it, no other model has been able to explain what dark matter does as well as there just being some stuff with mass that we can't see.  If you add in a bunch of stuff that we can't see, then a wide array of problems just vanish, and all of these problems require the exact same amount of stuff.",no,view comment
219,,morriartie,03/10/18,27,,27,"Complementing:

And we know our current math/phys are right because we can infer on things using them

and things made with those predictions works. ",no,view comment
220,,[deleted],03/10/18,5,,5,[removed],no,view comment
221,,hijomaffections,03/10/18,4,,4,I'm sure no one else has ever thought of that before you did,no,view comment
222,,[deleted],03/10/18,-2,,-2,[removed],no,view comment
223,,hijomaffections,03/10/18,1,,1,We've been long able to observe and identify hydrogen gas actually,no,view comment
224,,hijomaffections,03/10/18,5,,5,The same way if you see a giant shadow creep up on you then you know there's something you can't see yet but you can see its effect on your surroundings,no,view comment
225,,DeyySeeMeTrollin,03/10/18,56,,56,"The first thing you would do after getting results that don't seem right is to check the math. The fundamental equations and principles of physics do a good enough job of explaining many aspects of the world around us. So simply put, the likelihood that dark matter exists is higher than the likelihood that the calculations/principles are wrong.",no,view comment
226,,hijomaffections,03/10/18,1,,1,The universe seems to be spread out in a web-like pattern though,no,view comment
227,,[deleted],03/10/18,2,,2,[removed],no,view comment
228,,hijomaffections,03/10/18,1,,1,You might be thinking of something like the gravitron particle,no,view comment
229,,hijomaffections,03/10/18,1,,1,Infinite parallel universes means infinite gravity,no,view comment
230,,[deleted],03/10/18,-2,,-2,">So basically you make your assumptions first, then try to wrap science around it.

>That's not how science works. 

You’re the one making assumptions, Robert Boyle. You don’t know shit about me. I was simply lifting a counter hypothesis. Which is exactly how science works, Schroedingus. ",no,view comment
231,,hijomaffections,03/10/18,4,,4,You didn't. It'd be nice if you had something substantial to add though,no,view comment
232,,Rtry-pwr,03/10/18,5,,5,"Motherfuckers couldn't even find mh37, how would they know where the hell the dark matter in the universe is? ",no,view comment
233,,Decronym,03/10/18,1,,1,"Acronyms, initialisms, abbreviations, contractions, and other phrases which expand to something larger, that I've seen in this thread:

|Fewer Letters|More Letters|
|-------|---------|---|
|[DARPA](/r/Space/comments/9kur6b/stub/e72kp1y ""Last usage"")|(Defense) Advanced Research Projects Agency, DoD|
|DoD|US Department of Defense|
|[LIGO](/r/Space/comments/9kur6b/stub/e73i1e9 ""Last usage"")|Laser Interferometer Gravitational-wave Observatory|

----------------
^(2 acronyms in this thread; )[^the ^most ^compressed ^thread ^commented ^on ^today](/r/Space/comments/9irfvo)^( has 16 acronyms.)  
^([Thread #3043 for this sub, first seen 3rd Oct 2018, 04:35]) 
[^\[FAQ\]](http://decronym.xyz/) [^\[Full ^list\]](http://decronym.xyz/acronyms/Space) [^\[Contact\]](https://reddit.com/message/compose?to=OrangeredStilton&subject=Hey,+your+acronym+bot+sucks) [^\[Source ^code\]](https://gistdotgithubdotcom/Two9A/1d976f9b7441694162c8)",no,view comment
234,,o11c,03/10/18,1,,1,"In general, sure, but how do we know *where* it has what density?",no,view comment
235,,Zohren,03/10/18,19,,19,The thing that terrifies me is that I don’t believe there’s anything that comes afterwards.,no,view comment
236,,jayro08,03/10/18,1,,1,"If you can turn light into matter then it should have mass right. If light is simply just another state of matter then the velocity is what makes it seem like it doesn't have a mass. If you slow photons down they turn into matter. So maybe instead of looking for more matter, we should also incorporate all of the light energy in the universe as a mass less state of matter. In other words if you converted all the existing light into matter, how much mass would that account for?",no,view comment
237,,wsr3ster,03/10/18,1,,1,my guess is dark matter has something to do with obscuring my keys from view whenever i am looking for them.,no,view comment
238,,[deleted],03/10/18,1,,1,[removed],no,view comment
239,,PrivateShitbag,03/10/18,1,,1,Question:  where does this fit into the argument we might all be living in a simulation?,no,view comment
240,,812many,03/10/18,16,,16,"Think of our own solar system as example: with huge gas giants and a handful of smaller planets, dwarf planets, and asteroid belt, the sun still makes up over 99.8 percent of the mass in the solar system. If there were that many cold rocks out there they would just coalesce into a bright object. ",no,view comment
241,,I_talk,03/10/18,,,0,Yes. That is basically exactly correct. ,no,view comment
242,,[deleted],03/10/18,-1,,-1,I do. I'm gonna call it brown matter.,no,view comment
243,,cleverlasagna,03/10/18,40,,40,non english native speaker here. does ruled out means removed as an option?,no,view comment
244,,westrox11,03/10/18,1,,1,Is there a leading theory on what dark matter might actually be? ,no,view comment
245,,-BroncosForever-,03/10/18,37,,37,Yeah that’s exactly what it means. ,no,view comment
