Exported by,ExportComments.com,,,,,,,,
Source URL,https://www.reddit.com/r/space/comments/9kur6b/black_holes_ruled_out_as_universes_missing_dark/,,,,,,,,
Timezone,,,,,,,,,
Summary,Author: MaryADraper | Score: 28661 | Votes UP: 28661 (Ratio 94%) | Votes DOWN: 0,,,,,,,,
Some Comments may not appear here because of their privacy settings,,,,,,,,,
,,,,,,,,,
,,Author,Date,Votes UP,Votes Down,Score,Message,isPremium,(view source)
1,,MaryADraper,02/10/18,28661,,28661,Black holes ruled out as universe’s missing dark matter,no,view comment
2,,RussiaNeverLies,02/10/18,697,,697,I don’t understand any of this but the thumbnail looked cool so I clicked ,no,view comment
3,,Drowsy-CS,02/10/18,54,,54,"I understand only the barest minimum of this and I came looking for someone who might explain it in better detail, but all the comments were ridiculous 'memes'.",no,view comment
4,,[deleted],02/10/18,3,,3,[removed],no,view comment
5,,clayt6,02/10/18,-1,,-1,"Having not read the article yet, and having gained nothing from the comments so far, I, too, decided to say words.

Edit: Wait, what the hell?

>The researchers concluded that primordial black holes can make up no more than about **40 percent of the dark matter in the universe.**

>...

>The results suggest that **none of the universe’s dark matter** consists of heavy black holes, or any similar object, including massive compact halo objects, so-called MACHOs.

>“I can imagine it being two types of black holes, very heavy and very light ones, or black holes and new particles. But in that case one of the components is orders of magnitude heavier than the other, and they need to be produced in comparable abundance. We would be going from something astrophysical to something that is truly microscopic, perhaps even the lightest thing in the universe, and that would be very difficult to explain,” said lead author Miguel Zumalacárregui, a Marie Curie Global Fellow at the Berkeley Center for Cosmological Physics.

I could be wrong, but I think the author's logic is: If invisible heavy objects (like black holes) make up a significant chunk of dark matter, they better account for it all, or they don't account for anything? ",no,view comment
6,,GanksOP,02/10/18,4064,,4064,"Tldr: Dark matter and black holes are mysterious, but a different and unique kind of mysterious.",no,view comment
7,,[deleted],02/10/18,23,,23,[removed],no,view comment
8,,heinzbumbeans,02/10/18,129,,129,"There is a lot of missing mass in the universe, that somehow cant be seen. We know this because stars in other galaxies (and the galaxys themselves) don't move like they should - but they do move like they would if there was a shitload more mass out there. The leading theory is that its made up of dark matter - an unknown and so far unobserved form of matter that doesn't interact with the rest of the universe in the normal way, but still has an effect on the rest of the universe through gravity.       
Now, if this mass was in black holes made of dark matter, we should be able to see gravitational lensing (stars behind the black hole would look different due to intense gravity warping spacetime) of stars without seeing a normal black hole, but we dont. So they can conclude that wherever the matter is its not in the form of dark matter black holes.",no,view comment
9,,platoprime,02/10/18,2386,,2386,[Here is NASA's ELI5 on Dark matter](https://spaceplace.nasa.gov/review/dr-marc-space/dark-matter.html),no,view comment
10,,braydizzy,02/10/18,2,,2,Sometimes in life you will be faced with concepts you cannot grasp. And here i sit not understanding that which can not be understood,no,view comment
11,,[deleted],02/10/18,-8,,-8,"I read the article. Still pretty confused specially since I thought black matter and energy do not interact with regular matter/energy. If they did a black hole is not where I’d look. 

In all honesty I think this research is a load of bologna. Some “scientists” looking to fund a mortgage. Intentional obfuscation is common amongst these types. 

",no,view comment
12,,Rakonat,02/10/18,264,,264,"The short answer is some 84% of the predicted mass of our universe cannot be observed or found. We don't know where it is, but by studying the movement and gravitational effects of our galaxy and beyond we know that it's there somewhere, influencing what we can see. We just haven't been able to point to how or where all this extra matter is.

Basically scientists looked at hundreds of recorded supernovas and other significant and easy to observe events and found no evidence of a black hole between them and us (a black hole create a sort of optical illusion as light could travel around it or bend to create a magnification effect), meaning the most obvious answer of all the extra matter just packed into black holes we couldn't observe being unlikely.

There is a small chance that that some if not most of this matter is in black holes at the bleeding edge of our expanding universe, though that seems unlikely given they would have been formed and expelled from the big bang faster than the less dense galaxies. Though, if this were the case, it would explain why galaxies seem to be accelerating towards the expanding edge.",no,view comment
13,,reinhardtmain,02/10/18,27,,27,"i understood this!

Thank you heinzbumbeans, very cool",no,view comment
14,,shadowninja2_0,02/10/18,10,,10,"I'm not an expert on any of this but I'll try to sum up what the article says:

First, it says that dark matter comprises about 85% of the universe, but nobody actually knows what it is. A suggestion was made that perhaps the dark consisted of a bunch of unseen, primordial black holes. Primordial meaning they came into existence basically at the beginning of the universe. 

However, this new research says that's not the case and thus we still don't actually know what dark matter is. They say that all these unseen black holes should be causing bending of light by their gravity, but statistical analysis of a bunch of supernovas whose light *would* be bent if this was the case show no such gravitational bending.

That's the best my non-scientist self can do.

If a scientist does show up, a question I have would be, how do we know that 85% of the universe is dark matter if we don't even know what it is? (not disputing the assertion, I'd just like to know the reasoning behind it, since I'm sure there is some)",no,view comment
15,,western_shipps,02/10/18,2,,2,Dark matter does interact with regular matter through its gravity. I think. A scientist^tm could confirm. I don't remember how dark energy interacts/doesn't interact with regular matter/energy. ,no,view comment
16,,[deleted],02/10/18,6,,6,[deleted],no,view comment
17,,iamthe42,02/10/18,245,,245,"So there are two major theories about what dark matter is made up of, WIMPs and MACHOs. WIMPs are Weakly Interacting Massive Particles which means that they are particles of high mass that don't interact electromagnetically. MACHOs are Massive compact Halo Object which would be objects like brown dwarves or stellar mass black holes. Both of these theories give an explanation about why we can observe the effects of dark matter but cannot directly observe it. We can't observe WIMPs because they do not emit any wavelength of light and MACHOs because they emit almost no light. 

What this article is saying that that MACHOs cannot be more than 40% of the Dark Matter in the universe. How this was concluded was that Black Holes would be massive enough to bend the light from super nova which would increase the brightness of the light reaching us. I am not sure about their analysis of the brightness and distance of the super nova used so I can't say anything in that regard but I hope this helps explain the article a little bit.

Edit: some other theories about Dark Matter that I didn't mention is axions and MOND (modified Newtonian dynamics) I don't know to much about these but u/EvilMortyMaster explained MOND in the comments and this is the Wikipedia for axions: https://en.m.wikipedia.org/wiki/Axion",no,view comment
18,,elizaofhousestark,02/10/18,1875,,1875,"Well, that’s an oversimplification.

Dark matter is virtually undetectable. We have not invented the technology to detect its particles, if it has any at all. But the math strongly supports its existence. For our current observations and measurements of the universe to make sense, the prediction of dark matter needs to be true. It has also been indirectly [proven](https://www.forbes.com/sites/startswithabang/2018/10/01/the-most-important-x-ray-image-ever-taken-proved-the-existence-of-dark-matter/#439acf5f69f7) to exist. 

Meanwhile, there is plenty of evidence, despite being indirect observations, on the existence of black holes. For example, a supermassive blackhole existing at the heart of our galaxy (and every other galaxy in conclusion) is the only working explanation on how fast the stars near the center are moving. Nothing else can have the energy and gravitational pull to fling massive stars around like that. [Here’s](https://www.google.com.ph/amp/s/www.vox.com/platform/amp/science-and-health/2018/1/8/16822272/black-hole-looks-like-what)
 a cool article on that.

**What exactly is Dark Matter?**

The gravitational effects of blackholes and stars and galaxies on each other aren’t strong enough to hold them in place. At the rate that the universe is expanding, mathematical calculations predict that they should be tearing apart because of dark energy. Dark Matter is therefore like a glue that holds galaxies in place.

Meanwhile, Dark Energy, also virtually undetectable, is the force that is tearing apart galaxies. It is why the rate of expansion of our universe has accelerated in relatively recent history. There is a big probability that our universe will end in a Big Rip or a Big Freeze where galaxies will be cold and lonely outposts in the vast expanse of space and our night sky will no longer be dotted with stars. Even atoms will be ripped apart eventually. 

The composition of our universe is predicted to be as follows:

- Heavy elements 0.03%
- Neutrinos 0.3%
- Stars 0.5%
- Hydrogen and Helium 4%
- Dark Matter 25%
- Dark Energy 70 %

[NASA supports this](https://wmap.gsfc.nasa.gov/universe/uni_matter.html) statistic


I hope this helps!

Edit: I am not an expert on any of this. I learned all this and more through self-study. It’s like a hobby to me. So I hope your curiosities and fascinations on the cosmos can inspire you to learn about it!",no,view comment
19,,PhDinGent,02/10/18,4,,4,"Some other comments have explained why dark matter is inferred to exist: basically that the movement/rotation of galaxies suggests that there are a lot more matter in them than what can be seen/accounted for. Thus there must be some other forms of matter that cannot be seen lurking there. People have suggested that they might be black holes, but this study suggested that they are not. ",no,view comment
20,,sometimes_interested,02/10/18,42,,42,"This is probably a dumb question but how do we know that the missing mass isn't just other celestial bodies that don't emit light, such as extensive planet systems for visible stars and other stars that we don't see like brown dwarfs and so on? ",no,view comment
21,,Tommytriangle,02/10/18,464,,464,"> Even atoms will be ripped apart eventually.

I do wonder what this is all about. What's the end game? Does the universe eventually go into a cycle of expansion and eventual contraction? I sorta want that to be true. but ""big rip"" sorta implies the opposite: just a one time expansion, then it all just turns into nothing. 
",no,view comment
22,,[deleted],02/10/18,11,,11,"ELI5:

You want to know if any of the 100 houses on your block have a red roof. It's kind of tiring to check every single roof, so you decide to only check 60 of them. None of them have red roofs. Your observations suggest that none of the houses have red roofs because what are the odds? But you can't rule out that the remaining 40% that you didn't check have red roofs. So, 'Red roofs make up no more than 40% of the neighbourhood houses, and we suggest that none have red roofs.'",no,view comment
23,,playdohnt,02/10/18,413,,413,"Just gonna leave [this](https://youtu.be/MBRqu0YOH14) here

Edit: Fair warning - if you haven't seen any of the rest of their videos maybe try and pace yourself, pretty easy to binge yourself into an existential crisis",no,view comment
24,,synysterlemming,02/10/18,23,,23,"I’ll restate some of what /u/heinzbumbeans said in another comment.

In the last few decades, the field of extragalactic astronomy has grown as we are able to view galaxies at further and further distances away, and on more astronomical scales.

When looking at the behavior of these galaxies and galaxy clusters, astronomers noticed some strange behaviors that couldn’t be explained at first. Essentially what we’ve seen is that there is an abundance of “matter” in the universe which gravitationally binds galaxies and galaxy clusters together. We have modern day observations that actually show that the distributions of galaxy clusters makes a sort of [web](https://youtu.be/74IsySs3RGU?t=30s) throughout the universe. People began calculating at we’ve come to a pretty standard consensus that roughly 5/6 of the matter content in the universe is “dark matter”.

The name dark matter (or dark anything is astronomy) is called so because it can’t be observed through light; it emits to electromagnetic radiation, like normal matter (and antimatter) do. Because of this we also believe the dark matter to be “cold” because things with temperatures emit E-M radiation.

As lightly mentioned in the article, the theories for these dark matter particles are extensive and span many orders of magnitude. Many experiments have been imagined and searched for these particles, and nothing has been verified yet.

One thing I will change from /u/heinzbumbeans comment is that Cold Dark Matter has been observed! Check out the [Bullet Cluster](https://en.wikipedia.org/wiki/Bullet_Cluster)!",no,view comment
25,,rising_mountain_,02/10/18,3,,3,"I always imagined the missing link was actually the vibrations of the whole universe itself acting as the ""glue"". If there was a big bang, the vibration from the expansion alone would have caused the matter to ""shape"" or ""organize"" kind of how sand becomes different shapes over a speaker during different frequencies and pitches. Im not even close to being an academic but my peasant brain can imagine out on the fringes of our universe's edge the shockwave from the initial big bang is out there still expanding and causing what we observe as order in the universe. Black holes being a void in the fabric of space time similar to holes in a sponge (the sponge being space-time and the hole outside of space-time). This is just my out of the box thinking. So dark matter to me is the negative pressure created from the actual expansion of the universe, ",no,view comment
26,,abbieadeva,02/10/18,16,,16,"You are the first person to explain dark matter in a way I understand.
I have no scientific knowledge outside what I learnt in secondary school but I do fine space and the universe fascinating. Thank you for shedding some light onto this for me.  ",no,view comment
27,,burl_haggard,02/10/18,245,,245,"I always pictured it as a firework going off. Instead of taking seconds to dissipate, it takes billions of years ",no,view comment
28,,randys_creme_fraiche,02/10/18,102,,102,"An over simplification, like a tl:dr?",no,view comment
29,,Singing_Sea_Shanties,02/10/18,17,,17,"Trillions, for red dwarf stars at least. After that, unimaginably long. ",no,view comment
30,,dcnairb,02/10/18,60,,60,"That’s different because the exploded pieces go at constant velocity (ideal case) or slow down (from air drag)

the expansion of the universe is itself accelerating. this would be like a firework that blew up and then each piece of shrapnel has a rocket motor that also kicks on afterward... or so",no,view comment
31,,otcconan,02/10/18,-8,,-8,"They call it dark matter because the math says the universe has more mass than can be observed.  So they had to name it.  They could have called it anything, but ""dark matter"" sounds cooler than ""God.""",no,view comment
32,,[deleted],02/10/18,116,,116,[deleted],no,view comment
33,,Tavarde,02/10/18,-3,,-3,Hasn't anyone just given thought to the idea that dark matter is just all the small clumps of rock we can't see between the stars?  ,no,view comment
34,,KingAlidad,02/10/18,26,,26,"One possibility is that the universe keeps expanding infinitely, but if the vacuum of our universe is a metastable string theory vacuum, then little pieces of our universe may randomly decay into new low energy “pocket universes” with different vacuum states. This process of expansion/inflation and vacuum decay would occur infinitely. It’s a theoretically similar process to the conditions that lead to the Big Bang.

This is just my recollection from a 2011(?) inflationary cosmology lecture by Allen Guth, which is I think still available on MIT open courseware. I highly recommend Guth’s lectures for anybody interested in this stuff. ",no,view comment
35,,synysterlemming,02/10/18,7,,7,"Really interesting comment!

&#x200B;

So there are currently experiments out there running which are looking for a similar shock wave to what you're talking about, which is the gravitational waves from the inflationary period.  I also think it's really interesting that you use the term ""negative pressure"" to describe dark matter with respect to expansion. The solution to the Einstein field equations do actually yield an extra **positive** pressure term which is what we call the cosmological constant ? (as in the ?CDM model) which is the extra dark energy that drives the expansion of the universe. 

&#x200B;

However, a few things. Dark matter doesn't stop the expansion of the universe. Space still continues to expand, it's just that the objects moving through this spacetime are attracted to dark matter. This appears to be a gravitational effect, so stars/dust/gas/galaxies are draw towards dark matter in the same way they are to regular matter (but exclusively gravitationally). The other thing is that this ""shockwave"" you talk about, at least the way you describe, is moving from space into something else. Space doesn't expand into something (as far as we have observed). For a shockwave to exist there has to be something for this wave to propogate through. Expansion doesn't just happen at the edge of the universe either! All of space is expanding with respect to itself. For everywhere in space, as time goes on, there is more space per unit space (imagine piece of stretchy graph paper being pulled in all directions equally)!",no,view comment
36,,Alucard_the_sinner,03/10/18,33,,33,"Beautiful. I've seen it more than once, love their channel. Thanks for the reminder.",no,view comment
37,,Lildyo,03/10/18,79,,79,"Dark matter makes up too much mass for it to be as simple as celestial objects not emitting light. We'd likely be able to detect those objects through other means, such as infrared, spectral analysis or simply due to the parallax of said bodies. It'd be like having an elephant that emits no light (like vantablack) in a small room. Just because you can't see the elephant doesn't mean you can't tell it's there

Then again, I'm not an expert and that's just my limited understanding of this from some basic university astronomy courses",no,view comment
38,,Qriist,03/10/18,-2,,-2,"I understand. Wanting to be part of the trendy clique, however, I enjoy the thumbnail.",no,view comment
39,,[deleted],03/10/18,66,,66,[removed],no,view comment
40,,Cocomorph,03/10/18,34,,34,"No matter how many times I see [this](https://cdn.vox-cdn.com/uploads/chorus_asset/file/9984865/stars_orbit.gif) (stars orbiting Sagittarius A*), I never get tired of it.",no,view comment
41,,synysterlemming,03/10/18,2,,2,"You're correct about the dark matter. Dark matter doesn't emit any light (why we call it dark).  Dark energy doesn't really interact with matter, it's just what the energy that would be required for the universe to expand while still keeping it flat.",no,view comment
42,,mahajohn1975,03/10/18,4,,4,"It's also a very literal description that connotes our lack of knowledge about its nature and qualities, beyond the fact that the mass must exist. ""God"" is not a very appropriate placeholder because it connotes an unknowable discarnate intelligence that may only be the product of the fevered imagination of an ape. ",no,view comment
43,,western_shipps,03/10/18,1,,1,">You're correct about the dark matter.

Well, whaddya know? *Astrophysics for People in a Hurry* paid off. Thanks, NDT!",no,view comment
44,,ayyeeeeeelmao,03/10/18,47,,47,"It's true that the endgame is ultimately a ""turn into nothing"" scenario, but that doesn't necessarily have to be the absolute end of existence. The same kind of quantum fluctuations that could give rise to a [Boltzmann Brain](https://en.wikipedia.org/wiki/Boltzmann_brain) could also give rise to a new universe. Sure, it would take an unimaginable amount of time, unimaginably longer than the lifespan of our universe, but an empty universe has nothing but time.",no,view comment
45,,[deleted],03/10/18,6,,6,That’s pretty much impossible though. You would need that clump of rocks to make up like 70% of the mass of the universe.,no,view comment
46,,mahajohn1975,03/10/18,4,,4,"In the basement of the building where I work is a team using the moniker PIPER, for the Primordial Inflation Polarization ExploreR. They are trying to find evidence for the gravitational wave that thrust through the early Universe during its very first few moments of inflationary expansion. When I say ""early Universe,"" I'm talking about when it's roughly the scale of what we think of as an orange or a baseball. So, your peasant take on it isn't too far off, but for the fact that this light polarization they're looking for won't equate to mass in any meaningful way. ",no,view comment
47,,Ericaonelove,03/10/18,9,,9,Thanks. I’ve never seen that!,no,view comment
48,,SlippidySlappity,03/10/18,33,,33,Thanks for that.  Could both theories be valid?  Like if the MACHOs make up 40% and the WIMPs made up the difference? ,no,view comment
49,,mahajohn1975,03/10/18,2,,2,"Also, by our current reckoning, black holes are precisely the opposite of a void. ",no,view comment
50,,artmaximum99,03/10/18,-1,,-1,It was nice of us to humour Stephen Hawking all those years.,no,view comment
51,,RaY0n,03/10/18,1,,1,"I never understood this « expanding universe » concept, I mean, what is in place BEFORE the universe expansion? 

Not sure if I’m clear here, when something expands like a firework for example the sky is here before the firework explosion, but what is the sky in the universe case? Nothing?",no,view comment
52,,Zenblend,03/10/18,85,,85,Meanwhile you might die on your way home tomorrow. ,no,view comment
53,,iamthe42,03/10/18,28,,28,That definitely could be the case but personally I think that WIMPs make up more than 60% of the dark matter.,no,view comment
54,,Backdoor_Inspector,03/10/18,-1,,-1,"Does that mean that the universe swallow it's contents to drive growth? The final state would be an enormous sphere without anything in it???

Happy nightmares.... ",no,view comment
55,,existential_american,03/10/18,12,,12,Haven't black holes been ruled out a long time ago?,no,view comment
56,,temperedreason,03/10/18,2,,2,"When I try to wrap my head around dark energy I start to wonder if maybe we are mistakenly thinking about the expansion of the universe and It’s acceleration as an invisible force that is all around us when actually it could be external force pulling, stretching and/or inflating the universe from the outside— Undetectable beyond the boundaries of the observable universe.

Imagine that the universe is like pizza dough.  It starts out dense and tough as a ball, but it becomes easier to stretch as it expands— our hands being the external force pulling it.  As you pull dough apart, the resistance lessens generating what seems to be an acceleration.  If that were true then the Big Bang is actually a big tear right from the start.

That’s not to say that I believe there are actually an invisible pair of hands pulling our universe apart from all sides, but maybe it’s something to think about.",no,view comment
57,,Tavarde,03/10/18,1,,1,"And think of how much empty space there is between stars.  So very, very much.  I know it's a simplistic answer but I mean wouldn't it be possible?  What if the space between stars is just jam packed with stuff that we can't see because there's no light to reflect off it?  Around stars there's a gravity well to draw matter in to either form planets, or moons or asteroid belts or fall into the star and burn up but between the stars no such mechanism exists to clear out the debris.  ",no,view comment
58,,OddSensation,03/10/18,11,,11,I'm having one right now from the first comment. I dont regret it though.. it's an eye opener.,no,view comment
59,,Tavarde,03/10/18,,,0,"And think of how much empty space there is between stars.  So very, very much.  I know it's a simplistic answer but I mean wouldn't it be possible?  What if the space between stars is just jam packed with stuff that we can't see because there's no light to reflect off it?  Around stars there's a gravity well to draw matter in to either form planets, or moons or asteroid belts or fall into the star and burn up but between the stars no such mechanism exists to clear out the debris.  ",no,view comment
