Exported by,ExportComments.com,,,,,,,,
246,,Mishtle,03/10/18,1,,1,"
>>The researchers concluded that **primordial black holes** can make up no more than about 40 percent of the dark matter in the universe.

>>...

>>The results suggest that none of the universe’s dark matter consists of **heavy black holes**, or any similar object, including massive compact halo objects, so-called MACHOs.

>>**“I can imagine it being two types of black holes, very heavy and very light ones, or black holes and new particles.** 

There are two types of black holes being discussed.

Primordial black holes are black holes thought to formed in the early stages of the universe, when matter was just forming. They can be much less massive than the younger black holes formed by stellar collapse.

The quoted text is saying that the results suggest no more than 40% of dark matter is composed of lighter, primordial black holes, and that none of it is composed of heavier, stellar black holes.",no,view comment
247,,JMcMufin,03/10/18,3,,3,How do we know what black holes do? Like how do we know shit gets sucked into it,no,view comment
248,,narium,03/10/18,2,,2,Dust interacts with light. At the very minimum we will be able to see it occlude light.,no,view comment
249,,[deleted],03/10/18,1,,1,[deleted],no,view comment
250,,damonsoon,03/10/18,2,,2,"""let's just fuck with them"" - creators of the simulation",no,view comment
251,,ofmichanst,03/10/18,,,0,you are a cell fatter or thinner.,no,view comment
252,,MrKelraen,03/10/18,1,,1,"It has been observed to happen.
Now I don’t want to spread my mouth further than what I know, but essentially we know they are extremely massive, so their gravitational pull is so huge even light can’t escape it. So they just pull anything that gets close enough and crush it.",no,view comment
253,,MrKelraen,03/10/18,1,,1,I guess r/theoreticalphysics would be your best shot on reddit,no,view comment
254,,maheshkhati,03/10/18,-2,,-2,I already say this in my paper & give solution to problem of dark matter [http://vixra.org/abs/1611.0096](http://vixra.org/abs/1611.0096) & [http://vixra.org/abs/1703.0045](http://vixra.org/abs/1703.0045),no,view comment
255,,AllAboutTheKitteh,03/10/18,2,,2,"I feel like this is trivial and clickbaity. It's like saying, the sun has been ruled out as to why its bright in my room at night. ",no,view comment
256,,ChemiCalChems,03/10/18,3,,3,"Einstein's theory of General Relativity hypothesized the existence of such objects, but before we actually had telescopes powerful enough to look into the skies, we couldn't get evidence. It was just a hypothesis for some time, just like white holes are nowadays, predicted by an extremely successful theory, never observed to date.

The thing with black holes is they emit no significant amount of radiation (Hawking radiation is an extremely weak process of losing mass-energy, if it even happens). Thus, you can't simply look for black holes like you look for stars, because not only does it not emit light, light doesn't bounce off of it because it sucks it all in forever. 

Thus, you have to make indirect observations. You can't see the black hole itself, you can however see objects in its vicinity acting ""weird"" (all orbiting erractically or orbiting a single big mass that one somehow can't see). 

Multiple instances of these systems were found, and were succesfully explained by General Relativity, thus, what we are looking at is a black hole.",no,view comment
257,,ShakaZuluYourMom,03/10/18,19,,19,"I want to know what love is. 

I want you to show me. ",no,view comment
258,,[deleted],03/10/18,9,,9,"yes! I second this comment. Great episode, great podcast. ",no,view comment
259,,wadss,03/10/18,3,,3,"we can detect hydrogen via the 21cm emission line.  the brighter the emission, the denser the hydrogen is.  it's not hydrogen because when we look at other galaxies, the brightness of the specific spectral lines isn't high enough for there to be enough hydrogen to be acting as dark matter.

for extra-galactic hydrogen (on the scale of clusters), we use the spectra from thermal bremstrahlung in the form of x-rays instead to detect where and how dense the hydrogen is.  again, from the spectra, we know there isn't enough hydrogen or other gasses for it to be dark matter.",no,view comment
260,,wadss,03/10/18,3,,3,"the expansion of space due to dark energy is by far the weakest force out of all the forces we know of.  therefore where there are a stronger force, like nuclear forces, or electromagnetic forces, and gravity, they will negate the expansion of space completely.

think about if you swung a baseball bat, and you had someone try to stop your swing by fanning their hands.  it's never going to stop your swing.

the expansion of space is only important where even gravitational forces are too weak because things are already so far apart.  this happens between clusters of galaxies, which are the largest gravitationally bound objects in the universe.",no,view comment
261,,Tarthbane,03/10/18,2,,2,"I’m currently getting my doctorate in a scientific field. That’s not how science works, and what you claimed is not what happened earlier in this comment chain. ",no,view comment
262,,questionthatdrivesus,03/10/18,1,,1,How weird is it that we don't have the ability to observe or detect the majority of stuff around us?,no,view comment
263,,Tarthbane,03/10/18,1,,1,"Pretty much. I do a lot of math in my field, and even if I know an equation is right, I still check it an uncountable number of times afterward. It’s a sickness, really, but you can never be too sure. But because of this, I trust the people who have checked the math behind dark matter.  These are very smart people. We still don’t understand what this kind of matter is, of course, but we think with a high degree of certainty that it’s there. ",no,view comment
264,,Dj0sh,03/10/18,,,0,"The answer is simple. This is a simulation and our creators laws are Dark Matter. Rules are not physical... They exist to keep the universe together.

Also I don’t know what I’m talking about but the mystery of Dark Matter must be solved before I die!",no,view comment
265,,chewdog23,03/10/18,1,,1,"Why can’t we just say we don’t understand how gravity works on a large scale? Just like we believed we knew everything about mechanics but Einstein came along and changed that. It seems like, from the article at least, gravity’s doing something we don’t expect it to and we’re just saying that something else is there so it does have to behave like we expect it to.",no,view comment
266,,[deleted],03/10/18,15,,15,"But what if our equations work because they coincide with the bigger picture, but haven’t grasped it fully ? ",no,view comment
267,,[deleted],03/10/18,-3,,-3,[deleted],no,view comment
268,,geocitiesatrocities,03/10/18,,,0,"Taking a wild stab at this, but I have a theory that dark matter is gravity. It's just on another side of the universe. It interacts with matter like a sticky fluid....like a magnet in ferro fluid. I also suspect this is how quantum entanglement happens... Again not sure if this even makes sense, but maybe the entangled particles are interacting with dark matter the way sound travels through air. I'm sure this is a dumb idea, but helpe refine it. ",no,view comment
269,,[deleted],03/10/18,1,,1,"> Anything at all is possible out there.

If that’s your main argument then you dont really have one unfortunately.",no,view comment
270,,[deleted],03/10/18,2,,2,"I still say dark matter can be explained by emerging type 3 civilizations.

The TLDR is that a type 3 civilization harnesses all the energy in their galaxy. 

All energy used means none radiated out into the universe. This means the systems not captured yet appear to orbit galactic center with insufficiant mass to keep them in place and follow the orbital paths that they do.

*x- files theme*",no,view comment
271,,i-Was-A-Teenage-Tuna,03/10/18,1,,1,"80% more effort?
No thanks.",no,view comment
272,,jaredjeya,03/10/18,1,,1,"I’m talking about black holes as being an explanation for dark matter. Of course we’ve seen them, but there’s no evidence they make up a huge proportion of the universe’s mass unless they were an explanation for dark matter.",no,view comment
273,,alordk,03/10/18,-1,,-1,It is believed that the universe is expanding due to black holes. Who thinks otherwise?,no,view comment
274,,[deleted],03/10/18,1,,1,[removed],no,view comment
275,,jayro08,03/10/18,1,,1,"Sweet learned something today. Baryonic matter makes up less than 5% of the total mass, that's also kind of crazy. ",no,view comment
276,,[deleted],03/10/18,1,,1,Is this related to the time cube??? O.o,no,view comment
277,,mohutmamodi,03/10/18,1,,1,"""Primordial black holes could only have been created within the first milliseconds of the Big Bang as regions of the universe with a concentrated mass tens or hundreds of times that of the sun collapsed into objects a hundred kilometers across.""

Could someone please explain this portion of the article?",no,view comment
278,,epote,03/10/18,1,,1,"It really doesn’t:p

I mean we can see dark by it’s gravitational effects. So it’s something that creates gravity. ",no,view comment
279,,whatwouldjimbodo,03/10/18,1,,1,"So is this “extra” gravity just in specific spots around galaxies? I always thought it was everywhere.  Ive been under the assumption that we’re like fish in an ocean and that this dark matter is much like the water.  Everything is just floating around in this medium that is dark matter, but we don’t know what it is",no,view comment
280,,Xanexx,03/10/18,1,,1,What about the distance between electrons and the nucleus. What is that??,no,view comment
281,,DonRobo,03/10/18,1,,1,"If dark matter was absolutely every where we wouldn't know funnily enough. Its gravity would uniform in every direction and would cancel out.

Dark matter is also influenced by gravity, that's why it mostly appears in galaxies. ",no,view comment
282,,[deleted],03/10/18,-2,,-2,"it's simple. Like interactions of atoms are different from planetary interaction, the interstellar interactions are different from planetary, and intergalactic interactions are different from interstellar. There are other forces of universe that are so weak on our small scale (like gravity), that we can't measure or observe it in our world, but are far reaching (farther than gravity). It's like being an atom and trying to measure gravity, while only feeling the electromagnetic forces that are 137 times stronger. 

if there is something 137 times weaker than gravity on our scale, that would be so freaking weak we would not be able to measure it. Gravitational interactions between a fork and a knife are so damn weak already that they don't noticeably interact with each other, imagine the thing being 137 times weaker.

THERE IS NO DARK MATTER, MORONS",no,view comment
283,,hawkwings,03/10/18,1,,1,"Is dark matter something that would be sucked into stars?  If so, the sun's composition may be different than we think it is.  Is it sucked into planets?  If so, we should find some on Earth.  Maybe you need a large planet like Jupiter.

Could dark matter consist of planets and asteroids that orbit the galaxy, but not individual stars?  The mechanisms that created planets in our solar system may also work on a galaxy wide scale.",no,view comment
284,,nivlark,03/10/18,1,,1,"There are a lot of reasons why this wouldn't work. Probably the most serious is that to make planets, you need stars, both to produce heavy/rocky elements and to generate the right conditions for planet formation.

But to make stars, you need dark matter from right after the Big Bang, as it's due to dark matter that normal matter clusters together to make galaxies.

And just for fun, you would need there to be about 16 million Earth-sized planets for every Sun-sized star, all of which have to have somehow become rogue.",no,view comment
285,,nivlark,03/10/18,2,,2,"This would be dark energy, not dark matter.",no,view comment
286,,nivlark,03/10/18,1,,1,"Well, we can detect distant hydrogen, because its emission/absorption lines are redshifted by the expansion of the universe, so they don't overlap.

But a stronger constraint is that we can determine how much ""normal"" matter was produced at the Big Bang. And while this number is larger than what we infer from observations, meaning there *is* 'missing' normal matter, and there's lots of ongoing research going into looking for this. But there's nowhere near enough wiggle room to fit dark matter in as well.",no,view comment
287,,nivlark,03/10/18,1,,1,"We don't observe the amount of dark matter to be increasing with time.

Also, stars can only form because of dark matter - in the very early Universe, it's what causes matter to begin clumping together to eventually form galaxies.",no,view comment
288,,selfmadeelf,03/10/18,1,,1,"But what if you had a bowl of water and that bowl just expanded all the time. Then the molecules in the water would put force on each other and move accordingly to the expansion. However, a bowl of water, represented on earth would have a gravitational pull, so we would have to think about this bowl having a geometry that encapsulates the water inside and this bowl not being a bowl anymore. Now, if it expands in various directions in all the possible directions the water would not be pulled by the gravitational force, since the gravitation doesn't exist in the equation of understanding ""dark matter"". Instead, the outer rim of the geometry - it can look like anything - just expands randomly and drags the ""light matter"", in this case the body of water, which makes the water less dense. At this point the universe has expanded and the low density of the water is now so dense that the space in between is more than the actual water, but the water is sticking to each other because of the forces in the molecules according the laws of physics.

&#x200B;

This is how I picture it, but I have no idea. If you don't understand what I am trying to explain, don't worry, I don't understand it either...",no,view comment
289,,[deleted],03/10/18,4,,4,Black Holes propaganda. I heard black holes are very good at keeping information secret.,no,view comment
290,,epote,03/10/18,1,,1,"ELI5: a bathtub is full of murky water. At one place there is a whirlpool of water. What do you assume?  

If you are pedantic enough could you via the size and velocity of the whirlpool the characteristics of the sinkhole?  

Same thing with black holes. We can see their effects. ",no,view comment
291,,nolan1971,03/10/18,2,,2,"Substitute ""wrong"" with ""incomplete"", though.",no,view comment
292,,epote,03/10/18,1,,1,Do you know what happens at the end of Minecraft world? Far lands they called it?,no,view comment
293,,OldNedder,03/10/18,1,,1,I wonder if it will one day be possible to use non-baryonic matter to build materials with strange properties.,no,view comment
294,,forgtn,03/10/18,2,,2,"Perhaps this is the wrong thread to ask this on, but I'll do it anyway. It may be a silly question but hopefully someone can answer!

When someone says ""the universe"", does this mean everything we know all the way to the farthest reaching matter? Or does the space that everything exists inside of keep going infinitely and the light and matter just keep going indefinitely? I guess what I am asking is, is there an ""edge"" or ""end"" to space itself?",no,view comment
295,,EqualMastodon7,03/10/18,1,,1,Thankyou for this. I hope i read more articles about this. :D ,no,view comment
296,,Thomas132456,03/10/18,1,,1,"could someone point out if I am wrong, but is it possible that virtual particles be a candidate of the solution to the dark matter problem?",no,view comment
297,,Jakisuaki,03/10/18,1,,1,So do black holes that are composed entirely of dark matter exist?,no,view comment
298,,blove1150r,03/10/18,1,,1,"Tyson said call it non descriptive terms, I think so people don’t get hung up on it. Many in Reddit post like  DM/DE are backed by strong theories and that is not true. Scientists still can’t identify what thy are. ",no,view comment
299,,morriartie,03/10/18,2,,2,"I think thats what happens most of the time (always?)

It means that we are near the truth

And its a very hard level of coincidence to model a circuit using quantum physics theories and it successfully adjust a signal to the deformation of spacetime (GPS satellites) just by luck. 

Or predict the existence of a planet and years later, when you have enough engineering to actually see it, prove that it was where you predicted.

In the last example one could say its survivor bias, but there weren't enough tries for it to be consistent.

One thing that could happen is our math/ physics being right and we interpret it wrong. ",no,view comment
300,,Barneyk,03/10/18,18,,18,"One of the biggest argument against our math being wrong as I see it is that the math would have to work differently from galaxy to galaxy our math to be wrong.

If you look at a galaxy and how it behaves and then you tune the math to describe it, that math doesn't work for other galaxies. No matter how much they have tried tuning and fiddling and making the math more and more advanced and adaptable it all just breaks down anyway and is just inaccurate in to many measurements. 

Our current math on the other hand works perfectly everywhere across the entire universe as long as you have dark matter as a variable.

So while people are working on different kinds of math to explain whats going on, every single observation and experiment tells us that our current math is correct but there is a hidden variable which we call black matter.

Another huge argument for dark matter is gravitational lensing. We can observe galaxies that are behind a extra dense cluster of dark matter and the mass from the dark matter bends the light as a lens when we observe it. And so far every observation of this phenomena has been consistent with our prediction of the distribution of dark matter.

There is something there that we can't see that bends the light. That would also have to be explained by some other phenomena if it is just our math that is wrong and dark matter doesn't exist.

Another argument that I use to myself when I feel skeptical about science, if I am skeptical, so where and are a lot of scientist and they have been working for decades trying to come up with a simpler explanation but so far every attempt has just made the probability of dark matter being real go up. (I mostly have to tell this to myself about quantum physics)",no,view comment
301,,Milleuros,03/10/18,7,,7,"That was the first explanation given historically. Some people suggested quite early some missing mass, but it was dismissed as measurement errors or calculation errors. 

Then the evidence started to pile-up. Year after year. It was obviously not a measurement error because everyone was observing the same thing. So it could have been a theory error?

But then, theory showed that it is able to predict phenomena. The maths say that a new phenomena we never observed actually exists, so we build an experiment to test that prediction and surprise, we do find it.  So we know the theory is pretty solid, as it not only describes things we see, but it also describes thing we had never seen. 

What's more puzzling is that all these measurements that are ""off"" would _all_ be correct if there was this missing dark matter, and all experiments point towards the same behaviour of that missing mass and the same quantity with respect to regular matter.  A single hypothesis fixes a whole range of phenomena: stellar orbits in clusters, galaxy rotation, gravitational lensing, galactic orbits in clusters, collisions between galaxies, web-like cosmic structure, and the cosmic microwave background.   When they are all explained with the very same model, that model becomes very interesting. ",no,view comment
302,,[deleted],03/10/18,5,,5,This is my pondering too. Our current physics applies to what we know about the universe. Having something as massive as dark matter out there and not knowing what it is means our science accounts for what...4-5% of the universe? I could throw someone new into a game of checkers and have them guess a higher percentage of the rules. ,no,view comment
303,,hreggram,03/10/18,,,0,"I knew it must be one or the other but I couldn't recall at the time, thanks for the clarification ",no,view comment
304,,[deleted],03/10/18,-2,,-2,"Well in one sense, seeing other dimensions is impossible from our perspective, like a 2D 'Flatlander' trying to see ""up"".

A look at an image of a hypercube should confuse us into cognitive dissonance...

..if not then we can understand the wealth of 'Reality' that exists all around us that we 'can't find' which may turn out to be the dark matter we seek, after all.

Or its just dust between stars and Galaxies and or the trapped matter hidden in stars and singularities. We can't see inside stars either, like looking into the Grand Canyon at night , we have no idea, really.

Now go all science and tell me how certain our projections of mind are.",no,view comment
305,,[deleted],03/10/18,11,,11,I'm guessing your inbox is full of dick pics now?,no,view comment
306,,tarnos12,03/10/18,1,,1,afaik we are unable to answer that with 100% certainty.,no,view comment
307,,[deleted],03/10/18,1,,1,"Sure. It's not the way the reserch was done. But that wasn't the point of my explanation. My point is how you can get a result that both suggests there is nothing, but only rules out a specific fraction.",no,view comment
308,,TDLight,03/10/18,1,,1,This comment might be of interest in addition to the other replies: https://www.reddit.com/r/space/comments/9kur6b/black_holes_ruled_out_as_universes_missing_dark/e72iac4/,no,view comment
309,,[deleted],03/10/18,1,,1,"We already knew that dark matter was not black holes.  

Source:

https://www.startalkradio.net/show/cosmic-queries-dark-matter-and-dark-energy/",no,view comment
310,,Tenacious_Dad,03/10/18,1,,1,"Right, we are finding equations that fit our observations, but our known science doesn't correlate with all that exists.  I love that there is something mystical about our universe.  ",no,view comment
311,,WasteVictory,03/10/18,2,,2,"That's my theory. We use equations that work on earth, and assume these equations are universal. Same with the ""expanding universe"" theory. I don't buy it, because we've never seen the edge of the universe. We just see things moving, and assume the universe is expanding. We see things behaving against our mathematics and attribute 90% of it to another thing we cant observe or prove. 

It just seems like a stretch we make in order to preserve our current equations ",no,view comment
312,,[deleted],03/10/18,,,0,"This dark matter business is going to be viewed later as a colossal botch. 

I'm pretty confident it's going to turn out to be a consequence of spacetime torsion. Ripples in the bedsheet, as it were.",no,view comment
313,,Tavarde,03/10/18,1,,1,Really?  You're going to also come at me?  On a god damned space subreddit?  What is wrong with you people?,no,view comment
314,,4esop,03/10/18,2,,2,"How do we calculate the effects of huge black holes on time in the space around them?  If a gravity wave moves at the speed of light,  does time dilation effect the spread of the black hole's influence?  ",no,view comment
315,,[deleted],03/10/18,1,,1,"It being a space subreddit is irrelevant. By your logic I could make a thread about how there’s a planet that’s literally a hamburger and you can only get there by walking on a literal giant straw that’s shot up from black holes. 

It’s SPACE so I guess I can get away with it. After all it’s the space subreddit so everybody should just pat me on the back for my efforts.",no,view comment
316,,Shadowfita,03/10/18,1,,1,"If there are roughly one hundred billion galaxies in the known universe then wouldn't the ejection of a ""mere"" 16 million earth-sized planets still be plausible? ",no,view comment
317,,Sneemaster,03/10/18,1,,1,"All we can tell is what we have observed,  and we haven't observed an end, even in the farthest (and oldest) objects.",no,view comment
318,,Bowerz101,03/10/18,-1,,-1,We can’t explain the movement of the stars via Newtonian physics so let’s make up something invisible and call it dark matter! Maybe our understanding of physics in space just doesn’t fit in a Newtonian box? Maybe it’s....dare I say....wrong?,no,view comment
319,,Sneemaster,03/10/18,1,,1,Dark matter seems to exist in clumps. It doesnt seem to interact with anything but gravity.,no,view comment
320,,Sneemaster,03/10/18,1,,1,"Maybe like a shadow universe (or more than one) that we can only observe from its gravitational effects. Maybe there are tons of universes stacked next to each other,  each slightly different, exerting a slight force on each other. Their mass shadow is dark matter but their combined presence pushes on space-time causing it to expand in what we see as dark energy? Maybe.",no,view comment
321,,nivlark,03/10/18,2,,2,"16 million *per star*, not in total.",no,view comment
322,,mahajohn1975,03/10/18,1,,1,"EXTREMELY unlikely. The more we know about the nature of Spacetime, a dynamical natural system obeying natural laws, its own preconditions, the less sense a God-like entity makes, and the less relevant. Heck, just a brief contemplation of the scale we might be talking about, our Universe being just a single iteration of a cycle of order and entropy among an endless series of cycles stretching backwards and forwards in both directions, eternally, makes the concept of a ""God"" seem pretty quaint and hopelessly limited. Something that has always existed needs no creator. ",no,view comment
