Exported by,ExportComments.com,,,,,,,,
159,,WikiSummarizerBot,12/12/22,5,,5,"**[Big Rip](https://en.wikipedia.org/wiki/Big_Rip)** 
 
 >In physical cosmology, the Big Rip is a hypothetical cosmological model concerning the ultimate fate of the universe, in which the matter of the universe, from stars and galaxies to atoms and subatomic particles, and even spacetime itself, is progressively torn apart by the expansion of the universe at a certain time in the future, until distances between particles will become infinite. According to the standard model of cosmology, the scale factor of the universe is accelerating, and, in the future era of cosmological constant dominance, will increase exponentially.
 
^([ )[^(F.A.Q)](https://www.reddit.com/r/WikiSummarizer/wiki/index#wiki_f.a.q)^( | )[^(Opt Out)](https://reddit.com/message/compose?to=WikiSummarizerBot&message=OptOut&subject=OptOut)^( | )[^(Opt Out Of Subreddit)](https://np.reddit.com/r/spaceporn/about/banned)^( | )[^(GitHub)](https://github.com/Sujal-7/WikiSummarizerBot)^( ] Downvote to remove | v1.5)",no,view comment
160,,PartyStruggle2483,12/12/22,1,,1,That looks really satisfying.,no,view comment
161,,FemmeFunn,12/12/22,1,,1,This gives me Wednesday vibes from The Adams Family.,no,view comment
162,,immersemeinnature,12/12/22,1,,1,"Are they everywhere? If they're ""out there""  couldn't they theoretically be next to us, within us?
I'm so intrigued.",no,view comment
163,,sora_ongaku,12/12/22,1,,1,"At first glance, I thought it was a microscopic slide of our brain.",no,view comment
164,,professorpeaky,12/12/22,1,,1,yo you got a high-res image for a wallpaper? looks AMAZING!,no,view comment
165,,YooTone,12/12/22,13,,13,I always wondered what it might be like to be traveling faster than how fast the universe is expanding. Like there has to be something happening on that other end right?,no,view comment
166,,FuckardyJesus,12/12/22,2,,2,"Well, if they exist, then like literally everything else in the universe, they would present in some uniformly distributed manner, as suggested (and borne out by evidence) by the cosmological constant — which in simple terms means that the universe looks pretty much the same in all directions. But because space is so unimaginably vast, the odds that we’d encounter one that detect through conventional means could still be astronomically low. 

That said, even a primordial black hole on the order of micrometers would still pack as much matter as Mt Everest, so if was next to you, yes, you would notice it. You might not see it, but that change in local gravity would definitely be noticeable.",no,view comment
167,,immersemeinnature,12/12/22,2,,2,So interesting. Thank you. I don't want to be next to one,no,view comment
168,,ZamanYolcusuJ,12/12/22,1,,1,"I also didn't say what dark matter is. It is ""dark""",no,view comment
169,,TheDarkWayne,12/12/22,3,,3,When I did Shrooms I saw things as “fractal” it was pretty wild..,no,view comment
170,,elessar2358,12/12/22,9,,9,Used to trip me up as a kid when I tried to understand the big bang and the entire concept of expanding space-time. Always thought there has to be at least something beyond what we call the boundary of the universe. Now I realise conventional logic sometimes just fails and we cannot understand these concepts with that logic.,no,view comment
171,,sukikano,12/12/22,1,,1,Theory based on math. If the math showed something we’d need to come with another unknown. Endless cycle,no,view comment
172,,While_Ok,12/12/22,1,,1,looks like brain tissue or flesh of a greater entity,no,view comment
173,,Nergith_2207,12/12/22,1,,1,I can’t be the only one who sees a face in that,no,view comment
174,,Sufficient_Score_824,12/12/22,1,,1,Looks like it would be a design for a YA fantasy romance novel,no,view comment
175,,[deleted],12/12/22,1,,1,"Yes, yes we are.",no,view comment
176,,[deleted],12/12/22,2,,2,What’s even crazier is that it can’t end. Ever. There is no fake sky wall like in the Truman Show where it all ends. Or is there ? ?? who lives outside our walls ?,no,view comment
177,,[deleted],12/12/22,1,,1,"It probably goes in reverse at some point , all gathers slowly back together with new life as it forms back into a singularity and ?? BOOM. Another bing bang starts is all over again. Like a ballon filling with air , losing the air over and over",no,view comment
178,,TotallyRealDev,12/12/22,3,,3,"So from my understanding (Which almost definetly is wrong) is that there are two real possibilites.

A) The Universe is a infinate 'flat' plane that goes on forever

B) Is 'curved' and it would be like traversing around the surface of a sphere.

Currently we have no way of knowing but our limited measurments lean closer to a flat plane than curved space time.

The next thing to consider is that what are currently seeing around us is but an infinitesimal small snippit of the universe as a whole. That's why we always refere to it as the observable universe.

Now when we are viewing the edge of the universe we are also looking back in time. If you were to somehow instantly teleport to the furthest possible point that we could see then you would be in a sense also time traveling 14.5 billion years.

With our current understanding of physics we predict that things would look more or less the same as they do here in our local cluster. It then wouldn't be too much of a strech to assume that things would look the same beyond that barrier that is the observable universe.

Also things start to get really weird when it comes to causality and multi-billion lightyears of seperating.

# Once again I am not a scientist and take everything I say with a truck load of salt",no,view comment
179,,whiplash808,13/12/22,1,,1,This is literally how it’s indirectly measured! Yet you have double digit downvotes. Wtf has the world come to that we’re downvoting accurate information?,no,view comment
180,,lokistar09,13/12/22,1,,1,"I think we should change ""dark matter"" to ""ghost matter""",no,view comment
181,,thejustducky1,13/12/22,4,,4,"Just as plausible to be that way going down in size too.  We see atoms as spheres, but that very well could be another entire universe over again and we just can't measure it.  

Our perspective is just a single rung on a ladder that goes above us and below us both ways to Infinity.",no,view comment
182,,YrPrblmsArntMyPrblms,15/12/22,1,,1,"Beat me to it, by 3 days",no,view comment
183,,YrPrblmsArntMyPrblms,15/12/22,2,,2,Think of all the patterns your senses can't even sense,no,view comment
184,,Hungry_Guidance5103,15/12/22,1,,1,"Trees, leaves, veins, lightening, natural formations of similar appearance on celestial bodies, nerves... Synapses.... This pattern and similar appearances of it are everywhere in our observable universe. At every single level. From microscopes to telescopes. Idk if anyone has taken hallucinogens, but ya, fractal. Everything. Like a Greek stone mosaic all together connecting everything you look at.

Idc how all of this got here. At this point, I would just like to know where in the actual fuck all of this takes place. ""***Why?""*** doesn't even burn in my mind anymore. That has been accepted in myself as random is random and whatever, we are just another form of the consequences of the dawn of the universe. That's fine.

Afterlife / mankind's version of religion? - Ya, no, not gonna spend an eternity on my knee's for  an all powerful supreme being who can't take responsibility for its failure. I'll take the consignment to not be present for that shit show after party that should have been the creation in the first place lol...

 ANYWAYS

Idc why.  I need to know if we are expanding into anything and wtf was happening like an hour or less before whatever occurred at the dawn of all things.

I NEED TO KNOW DAMNIT",no,view comment
185,,destructor_rph,15/12/22,2,,2,Hurts my head to even try to think about lol,no,view comment
186,,patrickeg,16/12/22,2,,2,Its turtles all the way down.,no,view comment
187,,EXTRA-THOT-SAUCE,25/12/22,1,,1,It’s hard to explain. I just can’t help but wonder if our consciousness and the energy holding the universe together are deeply linked to each other. I know this is more spiritual than anything else and this is a scientific subreddit so I won’t go too deep into my own personal beliefs about it.,no,view comment
188,,Positive_Fun3770,07/01/24,1,,1,For more details on dark matter https://purvigarg2004.wixsite.com/astropedia/blog,no,view comment
,,,,,,,,,
