Exported by,ExportComments.com,,,,,,,,
60,,Karjalan,03/10/18,18,,18,"I guess, in a longer TL;DR, this result is saying that the extra invisible mass (which we call dark matter) isn't black holes we haven't detected yet (as they're hard to detect due to no light emission/reflection), based on attempted gravitational lensing showing that there aren't swarms of secret blackholes warping the light from distant supernovas?

I always thought/assumed the ""black holes are the (maybe) cause of dark matter"" argument was that there was a possible incomplete understanding as to how black holes effect the space around themselves? I.E. we treat their immediate body mass and interactions with nearby matter as if they obey GR like all other matter. But maybe black holes produce gravity differently and have a stronger gravitational influence further out than say a star or a planet.

I'm no astro-physicist and maybe this has already been ruled out, but because (based on my personal understanding) our physics break down once you enter a black hole, could the unknowns around what goes on inside a blackhole not be something to do with the 'invisible gravity' caused by 'dark matter'? As in, it's causing stronger gravitational interactions at further distances, or even getting stronger after a certain point instead (like a sine wave?).",no,view comment
61,,[deleted],03/10/18,63,,63,[removed],no,view comment
62,,Tavarde,03/10/18,,,0,"And think of how much empty space there is between stars.  So very, very much.  I know it's a simplistic answer but I mean wouldn't it be possible?  What if the space between stars is just jam packed with stuff that we can't see because there's no light to reflect off it?  Around stars there's a gravity well to draw matter in to either form planets, or moons or asteroid belts or fall into the star and burn up but between the stars no such mechanism exists to clear out the debris.  ",no,view comment
63,,ReshKayden,03/10/18,47,,47,"A \*lot\* of people very badly wanted to find that it would be a cycle of expansion, slowing, reversal, and then re-collapse.  Because it would be a very tidy way for the universe to be cyclical and go on forever.  


Alas, as much as we may want it, the current measurements of dark energy show an end game where everything rips itself apart into nothingness.  Which itself happens after several hundred trillion years of cold, empty darkness after the last white dwarfs smolder out, and the last black holes evaporate.",yes,view comment
64,,whydoidoittomyself,03/10/18,1,,1,The thought that I'll die before this shit is figured out causes me such anxiety that I can't enjoy my life.,no,view comment
65,,Le_Jacob,03/10/18,-5,,-5,"A black hole is just a star that has built up so much mass, the gravity begins to effect the light. It stops losing energy and starts snowballing into a clump of mass. I really don’t think there’s any magic or fourth dimension to it.",no,view comment
66,,mrpoopistan,03/10/18,86,,86,"Not meaning to be a dick . . . but . . .

I thought they had been ruled out a while ago already. My understanding is that the movement of galaxies would be very different if black holes were the answer. Also, some types of galaxies that do exist wouldn't.",no,view comment
67,,jaredjeya,03/10/18,2,,2,"Well, if we’re going to have to introduce a new particle to explain dark matter fully, why on earth would we need black holes too? You’d be introducing two phenomena for which we have no direct evidence to explain this one observation when one phenomenon would suffice. It’s far less likely that both phenomena would be present in are universe so we can eliminate the unnecessary complexity (Occam’s Razor is generally a good principle in science).",no,view comment
68,,[deleted],03/10/18,16,,16,[deleted],no,view comment
69,,Masta0nion,03/10/18,8,,8,"So we (believe we) understand 5% of the universe. That’s a pretty incomplete picture. I wonder how much of the 5% of what we “know” will be completely turned on its head once we discover what dark energy and dark matter are. I’m assuming they’re not just 2 things, but many different types of matter and energy that we just can’t identify or differentiate yet. ",no,view comment
70,,[deleted],03/10/18,8,,8,Beautiful! Really enlightening video I enjoyed that a lot,no,view comment
71,,2high4anal,03/10/18,7,,7,The black holes as dark matter is typically regarding smaller mass black holes than the typical super massive black holes that live at the center of big galaxies. ,no,view comment
72,,abelabelabel,03/10/18,-7,,-7,"This sounds like another one of those 11th hour, political hit jobs by the well funded Democrats to make the process of understanding our universe a total sham. Also, Jupiter doesn’t have a drinking problem. Do you?",no,view comment
73,,2high4anal,03/10/18,3,,3,It ain't much better even if you get a degree in it.,no,view comment
74,,grafxguy1,03/10/18,-2,,-2,"Just putting it out there, has anyone proposed that dark matter is related to anti-matter? ",no,view comment
75,,2high4anal,03/10/18,2,,2,"That's not really how it's done. In your example, just 80% more effort could get you to  full knowledge of the right answer, but with the black hole fraction its a hard estimation since by definition you can't really see the dark matter",no,view comment
76,,SNIPES0009,03/10/18,19,,19,"Can't it just be that our foundation is incorrect, instead of trying to fit dark matter into why it has to make sense?",no,view comment
77,,The1MrBP,03/10/18,14,,14," I’m surprised you haven’t heard of the Bullet Cluster!  Arguably the best piece of evidence (although *indirect*) we have of the existence of dark matter occurred during the collision of two galaxy clusters.  The two clouds of interstellar gas medium riding along with the clusters slowed down and remained relatively centralized while the galaxies themselves passed through in both directions.  Observations of the visible matter there would tell you most of the mass should be in the cloud, but in fact in turns out most of the mass is still riding along with the galaxies despite the galaxies themselves not containing the sufficient visible matter.  It is better evidence than the Galaxy Rotation Problem because it also shows that dark matter is weakly interacting with normal matter because it wasn’t slowed by the cloud. ",no,view comment
78,,LamboDiabloSVTT,03/10/18,13,,13,I thought this was already known? Every talk / video I see about Dark Matter / Dark Energy mentions that those two make up everything ELSE in the universe. That means it's implied that black holes are grouped into the normal Baryonic matter section.,no,view comment
79,,FewerPunishment,03/10/18,7,,7,[Check out PBS Space Time on the end of the universe](https://www.youtube.com/watch?v=Qg4vb-KH5F4&index=8&list=PLsPUh22kYmND79ksPNrzpAS9yzxgdImsn) \- they're awesome!,no,view comment
80,,Avery4Prez,03/10/18,27,,27,Honestly I appreciate this video more than you know. The topics that this video discussed are the thoughts that have been keeping me up at night. This video put some things into a different perspective that I had never thought of before.,no,view comment
81,,Pandybear10,03/10/18,-4,,-4,Dark matter is comprised of hydrinos; case closed. ,no,view comment
82,,coltonmusic15,03/10/18,3,,3,I still think dark matter is the simulation creators hint to us sentient beings that our universe is not naturally created.,no,view comment
83,,mfb-,03/10/18,103,,103,"Something like half of that is wrong.

> We have not invented the technology to detect it in any way possible.

That depends on what it is. If it would have been black holes this study would have found it (or one of the many previous ones setting more specialized limits). If it is WIMPs with suitable cross section one of the xenon experiments might find it in the next years. If it is axions with suitable cross section one of the axion experiments might find it in the next years. And so on. Sure, there are possible types of dark matter we cannot detect yet, but there are also many where it is possible.

> The gravitational effects of blackholes and stars and galaxies on each other aren’t strong enough to hold them in place.

That statement is about galaxies only.

> At the rate that the universe is expanding, mathematical calculations predict that they should be tearing apart at this point.

The expansion of the universe has nothing to do with galaxies. Galaxies don't even participate in the expansion.

> Meanwhile, Dark Energy, also virtually undetectable, is the force that is tearing apart galaxies and even matter itself.

No it doesn't tear galaxies apart, it is too weak for that. It is only relevant between galaxy clusters.

> There is a big probability that our universe will end in a Big Rip

There is no indication that dark energy would get stronger, something required for a Big Rip. A constant energy density is an easier scenario and wouldn't lead to a Big Rip.

> The composition of our universe is predicted to be as follows:

A misleading list as the stars are mainly hydrogen and helium as well. The star estimate looks too high.",no,view comment
84,,CantStopMeNowTranjan,03/10/18,4,,4,"Is there a theory/hypothesis that posits that dark matter is sort of like oil to visible matter's water?  Like, what I mean is that dark matter sort of envelops our universe and pushes it together, in the case of things like solar systems, but pushes it apart when the breadth between two objects gets so large (like in the case of entire galaxies, or the space between galaxies)?  Basically this would be like an anti-gravity force, or something that has what can be called ""negative mass"" (IE instead of creating a well in space time, which draws objects in, it creates a hill in spacetime that pushes objects away).  

 ",no,view comment
85,,blove1150r,03/10/18,2,,2,"This article reinforces DM/DE as just place holders for gaps in our understanding. I’m hopeful we’ll find the answer someday. 

I agree with Tyson that these were bad names chosen for unknown celestial mechanisms.",no,view comment
86,,VoradorTV,03/10/18,2,,2,Maybe dark matter is from early universe black holes that have expanded with the universe and no longer behave as we expect black holes to,no,view comment
87,,tulburg,03/10/18,-5,,-5,"Here is a theory: black holes are tears in the universe fabric. Since the universe is a vacuum, it must also exist as an object in a bigger vacuum. So a black hole is a tear in that fabric, causing a sucking swirl we refer to as black hole. This not only account for the swirl or sucking but also the lifecycle of a black hole and why it takes so long for the tear to heal.",no,view comment
88,,[deleted],03/10/18,-6,,-6,"Pffft. Thats like guessing how many homes are in the world without ever having gone outside.

The missing matter is most assuredly in the stars, dust, galaxies and their centers, visible and not. Where else is it going to be? If it doesn't 'add up' go back to the drawing board.",no,view comment
89,,[deleted],03/10/18,5,,5,"The universe refers to everything that exists. There isn't an answer to the question ""what came before the universe?"" The concept of 'nothing' is still something, time is also part of the universe, even empty place is still something. Until the moment of the big bang there was no time, no space, no anything. Basically your question cannot be answered in a way that human can conceptualize.
",no,view comment
90,,[deleted],03/10/18,1,,1,"It's possible that no matter when you lived or how long you lived, some shit will just never get figured out, because there are limits imposed on humanity that it may simply never be able to surpass, or characteristics of the universe it will never be able to perceive or understand.  Maybe our lives are all incredibly significant, and maybe they are worth less than nothing, but honestly either way just enjoy it, whatever ""it"" is and for however long you have it.  ",no,view comment
91,,Xuvial,03/10/18,22,,22,"Bit more on the ""movement"" part. Our current laws of gravity predict that when objects orbit something, they closer they are, the faster they move. We can see this in our solar system - planets closer to the sun (Mercury, Venus, etc) are moving much faster  than planets further away (Saturn, Neptune, etc). Newton and Einstein's laws can be used to calculate orbital speeds accurately.

So the exact same principle should apply on the scale of galaxies - stars close to the galactic center should move really fast, and stars on the outer edges should move extremely slowly. But this is NOT what we see. For some inexplicable reason, we're seeing all the stars on the middle/outer edges of galaxies are racing around at speeds that shouldn't be possible. In fact stars are orbiting so fast that everything in the galaxy should be flying away (leaving just the core stars). 

This means that ""something"" must be keeping galaxies gravitational bound together. That ""something"" must be completely invisible, and contain approximately 5x more mass than everything that we *can* see. It's also something that only seems to become noticeable at exceptionally large scales (galaxies), and becomes irrelevant at smaller scales (e.g. planets/moons). So far we have no idea what that ""something"" is. Dark Matter is the placeholder name.

In the latest research paper, Back Holes have been ruled out as the source of all that extra gravity. It's something else.

Also the movement of stars isn't our only clue. There is also light. [When light travels around very massive objects, it becomes curved/bent](http://www.roe.ac.uk/~heymans/website_images/Gravitational-lensing-galaxyApril12_2010-1024x768.jpg) on it's way towards us. We can observe this bending effect and calculate exactly how much distant objects *should* be bending light. Turns out that galaxies are bending the light WAY more than they should be. The ""lensing"" effect is far too severe to just be caused by the visible mass of the galaxy. Only something with significantly more mass can cause the light to bend so much - but what is it? ",no,view comment
92,,pyrof7,03/10/18,18,,18,Reading stuff like this makes me a little sad that I missed my calling in astronomy....,no,view comment
93,,RaY0n,03/10/18,2,,2,"Well, thanks for this answer. That is indeed pretty hard to conceptualize but it’s fascinating!",no,view comment
94,,[deleted],03/10/18,2,,2,My pleasure! I'm very interested in space and physics. ,no,view comment
95,,Pletterpet,03/10/18,16,,16,I still have no idea what a boltzmann brain is. They just appear out of nothing? Human heads? ,no,view comment
96,,Dumbthumb12,03/10/18,851,,851,"I was expecting after reading this article that I would need a more simplified explanation (I am not a smart man), but that was a really helpful description. Thanks for the link!",no,view comment
97,,DiceMorgansGhost,03/10/18,1,,1,I still don’t trust these guys.   Taking our stars and planets...,no,view comment
98,,UpintheWolfTrap,03/10/18,-2,,-2,Everybody already knows that dark matter is just the universe dropping back down to two dimensions.,no,view comment
99,,[deleted],03/10/18,1,,1,"How does invariant mass interact with gravity? I may be mangling the terminology, but I am assuming what astronomers are tallying is rest mass? Does the fact that much of the universe is moving with some appreciable momentum and possesses higher invariant mass potentially affect the tally, and perhaps explain one of the manifestations of ""dark matter"" that the rotational velocity of many galaxies are uniform? I am a novice with this, but would be interested to understand these things.",no,view comment
100,,ayyeeeeeelmao,03/10/18,38,,38,">They just appear out of nothing? Human heads?

Yep, that's more or less it. Similarly, a universe could do the same. In fact, it's possible that the universe as we know it was created just a few moments ago by this process, but our memories were created along with it which makes it seem, to us, that the universe has existed for much longer.",no,view comment
101,,cunzlow,03/10/18,17,,17,"'The last question' by Isaac Asimov is a good short story about the universe ending.  

http://www.multivax.com/last_question.html",no,view comment
102,,SamL214,03/10/18,-1,,-1,What if dark matter is beyond the scope. We can’t see it because it’s pulling everything from the other side? ,no,view comment
103,,thedentonproject,03/10/18,3,,3,A black hole is a supermassive tiny point whose gravity is so strong not even light can escape it. We know this from the Schwarzschild radius.,no,view comment
104,,[deleted],03/10/18,19,,19,[deleted],no,view comment
105,,Riot87,03/10/18,11,,11,I really get sad at the thought that we will just never know some of these things. Like what exactly is out there and how it all works. Why it all works. I just want to know.,no,view comment
106,,Pletterpet,03/10/18,29,,29,Ah that's the existential crisis I needed today,no,view comment
107,,TheGuyWithTwoFaces,03/10/18,68,,68,"Well, everything *will* be forgotten at some point untold trillions of years from now at the heat death of the universe.

So, the idea is to make do with the time you have and don't squander it.

So do you want to, er, ya know...?",no,view comment
108,,TheHammer987,03/10/18,1,,1,We have measured black holes though. They aren't theoretical in the way dark matter is. ,no,view comment
109,,[deleted],03/10/18,323,,323,"> billions of years

When it comes to the current models about the Heat Death of the Universe, we're actually talking about something like 10^100 years (that's 10 with 99 extra zeros in front of it). That's around when most black holes will have evaporated, and all that's left are photons and leptons (i.e. electons, muons, tau particles, and their neutrinos) that will almost never interact with each other. At this point, there's really no useful energy left in the Universe (i.e. ""no more entropy"" aka ""heat death"").

For perspective, the universe is on the order of tens of billions, or 10^10 , years old today (specifically, about 13.8 billion years as far as we can tell). Now note that this doesn't mean that we're 10% of the way through the life of the Universe. 

The way exponents work, it actually means we're 10^-88 % , or 0.00...1 with 88 0's percent, of the way through the Universe.

It's a truly incomprehensible amount of time. I did my undergrad in physics and there's just so much that you really can't get your head around, especially when it comes to the largest and smallest scales of existence. I spent over half a decade thinking about this stuff and it's almost all just as ridiculous to me now as it was on my first day in class.",no,view comment
110,,Ok-Cappy,03/10/18,8,,8,"There are so many possibilities of what is happening now and what could happen in the future that all of our discussions on the matter
 almost seems childish.  Though I have to applaud all all those very smart people for helping us understand what we can so far.",no,view comment
111,,alex_snp,03/10/18,8,,8,"regular, big black holes like the ones in the center of galaxies. Here we talk about tiny primordial black holes",no,view comment
112,,[deleted],03/10/18,173,,173,"I’m completely ignorant on this topic so i’m sorry if this is a stupid question.

But how do we know that the movement is not just caused by momentum from a previous event?",no,view comment
113,,alex_snp,03/10/18,4,,4,What is a better name?,no,view comment
114,,Avery4Prez,03/10/18,19,,19,"No one has told me about a nihilistic phase in life. I would live to have someone like your dad in my life, he sounds wise.",no,view comment
115,,BraveFencerMusashi,03/10/18,3,,3,I'm going to need Matt O'Dowd and his facial hair to explain this one.,no,view comment
116,,Balhannoth,03/10/18,2,,2,"So, for 13 billion years, stars have exploded and sent immeasurable amounts of dust outward. Some of that dust clumps into planets and other stars. But could it be assumed that ""Dark matter"" might be this remnant dust that never collapsed into larger objects? Maybe all the dark areas between stars is just a soup of heavier atoms and fine particles?",no,view comment
117,,t3hjs,03/10/18,7,,7,">The short answer is some 84% of the predicted mass of our universe cannot be observed or found. 

Cannot be observed Electromagnatically. I.e. 
they dont give off light, dont absorb light and dont reflect light.

But we can observe the gravitational effects.",no,view comment
118,,Generic__Eric,03/10/18,17,,17,"Well I think op was just using it as a visual analogy, it's not going to be perfectly 1:1",no,view comment
119,,alex_snp,03/10/18,3,,3,That is absolutely not the way to interpret this article. ,no,view comment
120,,AvioNaught,03/10/18,62,,62,"I'm no expert either but my understanding is that the ""movement"" is actually acceleration, which can't be described by something like a previous impulse. ",no,view comment
121,,alex_snp,03/10/18,1,,1,dark matter is observation driven. Not theoretical,no,view comment
122,,[deleted],03/10/18,-1,,-1,"I hope the discovery and actual detection of dark energy and dark matter happens in our lifetime. It would mean extradimensional travel for humanity, finally.",no,view comment
123,,TET901,03/10/18,,,0,I think it’s quite obvious why would the thing that causes the most gravity make negative gravity can somebody explain why they thought this to begin with?,no,view comment
124,,alex_snp,03/10/18,9,,9,"No we call it ""matter"" because it has mass and ""dark"" because it doesnt interact electromagnetically ",no,view comment
125,,TheCrazedTank,03/10/18,238,,238,"Honestly, the only thing that scares me more than my own death is the eventual death of the universe. I can come to peace that I have a finite amount of time, my ego isn't big enough to overestimate my own importance, but that one day there'll be no life, no stars or even time... This sometimes keeps me up.",no,view comment
126,,[deleted],03/10/18,461,,461,"TL;DR It’s not that the stars are traveling fast, it’s that, given how fast they are traveling, they should be flung out into intergalactic space, but that’s not what we see happening.

It’s not about where the stars got the movement speed, it’s about gravity stuff. 

The earth has to rotate around the sun at a specific speed in order to go around it in a circle. If it were going faster, it might fly off far away from the sun. If it were going slower, it’s orbit might drop down much nearer to the sun.

The speed the earth must travel at is directly correlated with 1) the mass of the sun and 2) the distance from the sun. If we know both these things, we could figure out exactly what speed the earth needs to be going so it keeps going around the sun in the circle.

But wait! The earth is actually traveling much faster than the math says it should! It should be flying into space! Why might this be? The answer is that we don’t really know, but there must be something out there other than the sun causing gravity to be *much* higher than we think, so we attribute this unknown mass to “dark matter.”

This is the same situation astronomers are seeing, except it’s on galactic scales. Everything within our solar system is actually quite normal.",no,view comment
127,,theorangey,03/10/18,10,,10,We keep testing and then we test some more.,no,view comment
128,,[deleted],03/10/18,6,,6,"Why can't dark matter be billions or trillions of rogue planets?   It seems like there would be a ton of them as space is full of matter and dust.  


Edit can to can't.
",no,view comment
129,,jumpedupjesusmose,03/10/18,-1,,-1,CMV: dark matter is really gravity leaking in from parallel universes. ,no,view comment
130,,[deleted],03/10/18,79,,79,[deleted],no,view comment
131,,[deleted],03/10/18,28,,28,[removed],no,view comment
132,,eLemonnader,03/10/18,23,,23,"I legit expected that to end with ""... and I'm just making this all up.""",no,view comment
133,,NH-PC-Builder,03/10/18,16,,16,Fuck dude. This video summarizes what I've come to realize these past few months. It's so fucking scary knowing that someday  we will close our eyes and never wake up.,no,view comment
134,,[deleted],03/10/18,103,,103,I've gotta go get more beer. ,no,view comment
135,,KingHavana,03/10/18,24,,24,Me too.  Though I really wish that I could live a lot longer than a normal human lifespan just to see what happens to earth for the next several centuries.,no,view comment
136,,[deleted],03/10/18,20,,20,Makes me think that were almost impossibly early in the universes life cycle ,no,view comment
137,,Slammernanners,03/10/18,17,,17,"If this makes you feel better, just remember that at the pace technology is going at right now, age extension will become a while lot better than it was before.",no,view comment
138,,Aarondhp24,03/10/18,,,0,"My understanding is that dark matter/dark energy is the term we give the expansion of space. 

Not the expansion between two defined points, but all space, everywhere. 

It's all expanding, all at the same time, at the same rate. The centers of atoms, the space between planets and stars, between solar systems, between galaxies, and so on. 

We want to give this ""energy"" a name and maybe even measure it, but there's a real chance that it's just space itself, doing what it do. The void of space or the TSC is just doing what it does, expanding infinitely. 

Am I close?

Also, has the expansion grown or slowed exponentially? Is it constant? Do we need billions of years of observations to know? ",no,view comment
139,,pontoumporcento,03/10/18,-2,,-2,"This is kinda obvious if you know a bit about both dark matter and black holes, but it's not obvious if you really think about the ramifications and causes of such statement.

",no,view comment
