,,"Unique ID","Name ",Date,Likes,Comment,"Profile ID","Author URL","Comment URL"
91,,wheaties012,Dan,"2023-01-16 01:30:28",5,"If we don't know what either of them are then how do we know they they make up 97% of the universe?",6829741403821540358,https://www.tiktok.com/share/user/6829741403821540358,https://www.tiktok.com/@wheaties012/video/7187771038221028651?comment_id=7189056343885415214
92,,ah16466,"77 78 81 84 05 19","2023-01-16 12:09:56",0,😂😂😂😂😂😂😂😂😂,7106781178921501701,https://www.tiktok.com/share/user/7106781178921501701,https://www.tiktok.com/@ah16466/video/7187771038221028651?comment_id=7189221073085596422
93,,hparks0912,"hparks 912","2023-01-21 11:17:38",1,"it's a source of ""gravity"" also still a theory",6711369409221477382,https://www.tiktok.com/share/user/6711369409221477382,https://www.tiktok.com/@hparks0912/video/7187771038221028651?comment_id=7191062769076765486
94,,nicky6017,"Nick y","2023-01-23 08:00:28",0,"who cares about the origin of the universe when we can watch the WNBA?",6645070101311668230,https://www.tiktok.com/share/user/6645070101311668230,https://www.tiktok.com/@nicky6017/video/7187771038221028651?comment_id=7191754223834415915
95,,stevedangmusic,stevedangmusic,"2023-01-23 10:20:10",0,"I imagine our universe is spinning like a hammer throw… unknown forces on a bigger scale",6832028624846423045,https://www.tiktok.com/share/user/6832028624846423045,https://www.tiktok.com/@stevedangmusic/video/7187771038221028651?comment_id=7191790083741205290
96,,jon_the_revelator,"Jon Carr Th","2023-01-23 21:10:12",2,"dark matter is simply sound you could imagine it's a type of smoke that holds things together but that's basically what it is dark light which is soun",6914012221561046021,https://www.tiktok.com/share/user/6914012221561046021,https://www.tiktok.com/@jon_the_revelator/video/7187771038221028651?comment_id=7191957941300904747
97,,burninhel,burninhel,"2023-01-23 22:17:42",0,"It’s miticlorines or whatever like had…",6652849788441116677,https://www.tiktok.com/share/user/6652849788441116677,https://www.tiktok.com/@burninhel/video/7187771038221028651?comment_id=7191975342948827950
98,,colie.tooits,"Colie beauty","2023-01-24 04:40:16",8,"as a telepather wait until they disclose ""thoughts"" or ""thinking"" passes thru all states of matter.",6885837581771506693,https://www.tiktok.com/share/user/6885837581771506693,https://www.tiktok.com/@colie.tooits/video/7187771038221028651?comment_id=7192073905745183530
99,,fernandojohnson03,"Fernando Johnson","2023-02-02 02:31:06",0,"This guy is full of “IT.” !",7163904275159303214,https://www.tiktok.com/share/user/7163904275159303214,https://www.tiktok.com/@fernandojohnson03/video/7187771038221028651?comment_id=7195380422951174958
100,,harvesterofsorrow007,harvesterofsorrow007,"2023-02-09 20:40:59",117,"😂😂😂 I love how frustrated he is about not knowing. Brilliant man.",6984398833845388293,https://www.tiktok.com/share/user/6984398833845388293,https://www.tiktok.com/@harvesterofsorrow007/video/7187771038221028651?comment_id=7198258817969668910
101,,elpumamex,"Jose L Rodriguez","2023-04-15 13:56:00",2,"Dark Matter sounds very much like the Ether light propagation theory of the 19th century, that was proved wrong by Einstein. Science ! 😁",6822372387976283142,https://www.tiktok.com/share/user/6822372387976283142,https://www.tiktok.com/@elpumamex/video/7187771038221028651?comment_id=7222274991927886635
102,,iansmithhhh,Ian,"2023-05-22 15:57:15",0,"Like 2k",7076652352175227950,https://www.tiktok.com/share/user/7076652352175227950,https://www.tiktok.com/@iansmithhhh/video/7187771038221028651?comment_id=7236036416323978030
103,,juliansowards2,j,"2023-07-30 07:16:31",0,"I can. The dark energy is coming from the suns UV rays hitting nero melonin brings, and sending energy back.",7225053724803712043,https://www.tiktok.com/share/user/7225053724803712043,https://www.tiktok.com/@juliansowards2/video/7187771038221028651?comment_id=7261507016543486766
104,,it5justme23,justme23,"2023-11-09 10:05:26",0,"been saying this for years no one knows what's going on 😂",7139575331857548293,https://www.tiktok.com/share/user/7139575331857548293,https://www.tiktok.com/@it5justme23/video/7187771038221028651?comment_id=7299401273752126241
105,,sonyalopez837,Sonyalopez837,"2024-01-07 05:49:07",0,Ether,6902898756825252870,https://www.tiktok.com/share/user/6902898756825252870,https://www.tiktok.com/@sonyalopez837/video/7187771038221028651?comment_id=7321229234638258987
106,,ancientmessenger,"Ancient Messenger","2024-01-15 16:44:57",0,"So if we don't know what 97% of the universe is comprised of, then what else are we yet to learn...",7230284554576970794,https://www.tiktok.com/share/user/7230284554576970794,https://www.tiktok.com/@ancientmessenger/video/7187771038221028651?comment_id=7324366976829801259
107,,kinzie.ward4,ᴋɪɴᴢɪᴇ,"2024-01-18 00:07:14",8,"what if what if.. we were in another time or universe and then we die we don't remember and just do the life cycle again..",7297713763531981866,https://www.tiktok.com/share/user/7297713763531981866,https://www.tiktok.com/@kinzie.ward4/video/7187771038221028651?comment_id=7325223143466943278
108,,beepboopboop98,Jake❤️‍🔥,"2024-03-27 00:57:28",0,"i love the theory that dark energy is spacetime surface tension, and dark matter is matter that has pierced it, like the part of the iceberg above water",6639594708979466246,https://www.tiktok.com/share/user/6639594708979466246,https://www.tiktok.com/@beepboopboop98/video/7187771038221028651?comment_id=7350840921263932191
109,,christapher192,christapher192,"2024-03-28 02:12:39",0,"There’s a dark star scientist thought it was a black hole but there a moon just orbiting around that area",7037007832977835013,https://www.tiktok.com/share/user/7037007832977835013,https://www.tiktok.com/@christapher192/video/7187771038221028651?comment_id=7351231407468036894
110,,user3326871387131,"Apple User636629","2024-04-03 00:11:28",0,"We don’t know! We have no clue 😏🙌🏽",6883529289821094917,https://www.tiktok.com/share/user/6883529289821094917,https://www.tiktok.com/@user3326871387131/video/7187771038221028651?comment_id=7353426688146195230
111,,misscourtneee,Courtneee,"2024-04-04 20:19:06",0,"I love science so much it points to God in every way😩😩",6808412256189367301,https://www.tiktok.com/share/user/6808412256189367301,https://www.tiktok.com/@misscourtneee/video/7187771038221028651?comment_id=7354108960562348830
112,,xgoxaway,"Go Away","2024-04-06 01:15:00",0,"How do people not believer in Allah(God)? Knowing that your just floating in the middle of some part of space and u dont believe wow",6790608482367931398,https://www.tiktok.com/share/user/6790608482367931398,https://www.tiktok.com/@xgoxaway/video/7187771038221028651?comment_id=7354556337429349127
113,,callhercyn,"Cyn ❤️","2024-04-10 04:52:26",0,😭😭😭,6810982554818282502,https://www.tiktok.com/share/user/6810982554818282502,https://www.tiktok.com/@callhercyn/video/7187771038221028651?comment_id=7356096636646720298
