,,"Unique ID","Name ",Date,Likes,Comment,"Profile ID","Author URL","Comment URL"
1,,uptownsnail,Isabella,"2021-02-11 21:02:33",14,"Lemme just take a seat and watch while this goes viral",6740458381600162822,https://www.tiktok.com/share/user/6740458381600162822,https://www.tiktok.com/@uptownsnail/video/6928113689274977542?comment_id=6928114468136222726
2,,blakep270,"Blake Proctor","2021-02-11 21:03:32",1,"Isaac Arthur just put up a great video on this concept on YouTube. Great for people who only casually understand science!",6884633106080023557,https://www.tiktok.com/share/user/6884633106080023557,https://www.tiktok.com/@blakep270/video/6928113689274977542?comment_id=6928114720629784582
3,,_ohboyitstara,(Ohboyitstara),"2021-02-11 21:03:41",9,"so in scientific terms, is this still hypothesis then, due to the testing limitations? or is there enough evidence to raise to the level of theory? 😳",6701527559143916550,https://www.tiktok.com/share/user/6701527559143916550,https://www.tiktok.com/@_ohboyitstara/video/6928113689274977542?comment_id=6928114759946878981
4,,thesaggitarianlibrarian,"Morgan Gray","2021-02-11 21:07:56",4,"Well according to queen. Nothing really. .....Matters.....(I’m so sorry for this pun)",6893935911168623621,https://www.tiktok.com/share/user/6893935911168623621,https://www.tiktok.com/@thesaggitarianlibrarian/video/6928113689274977542?comment_id=6928115856295837702
5,,uptownsnail,Isabella,"2021-02-11 21:13:11",6,"I elect you to be non-binary Hank Green",6740458381600162822,https://www.tiktok.com/share/user/6740458381600162822,https://www.tiktok.com/@uptownsnail/video/6928113689274977542?comment_id=6928117207277223942
6,,ueberseezungen,"kelly 🌝","2021-02-11 21:14:41",7,"jamie how do you know so much stuff",6853382959212463110,https://www.tiktok.com/share/user/6853382959212463110,https://www.tiktok.com/@ueberseezungen/video/6928113689274977542?comment_id=6928117597388996613
7,,grouchling,grace,"2021-02-11 21:40:02",1,"thank u",6810862003508364294,https://www.tiktok.com/share/user/6810862003508364294,https://www.tiktok.com/@grouchling/video/6928113689274977542?comment_id=6928124127001788422
8,,merry._sky,Sky,"2021-02-11 21:44:22",155,"... a game theory",6626190800148299781,https://www.tiktok.com/share/user/6626190800148299781,https://www.tiktok.com/@merry._sky/video/6928113689274977542?comment_id=6928125243408465926
9,,jackross949,"Jack Ross","2021-02-11 21:55:43",3,"I love how you first get into physics and you’re like “ah everything makes sense now” and then you get deeper and realize we can’t explain shit",6777947004016018438,https://www.tiktok.com/share/user/6777947004016018438,https://www.tiktok.com/@jackross949/video/6928113689274977542?comment_id=6928128169669230597
10,,ryanmutton,"Ryan Mutton","2021-02-11 21:59:34",1,"How big? Like the 100km CERN wants to do in 2038 or bigger?",6704417924842849286,https://www.tiktok.com/share/user/6704417924842849286,https://www.tiktok.com/@ryanmutton/video/6928113689274977542?comment_id=6928129158803800070
11,,phoebeee.t,phoebe,"2021-02-11 22:18:10",15,"I JUST LEARNED ABOUT DARK MATTER",6688005541278663685,https://www.tiktok.com/share/user/6688005541278663685,https://www.tiktok.com/@phoebeee.t/video/6928113689274977542?comment_id=6928133950947328006
12,,normiewednesday,emily,"2021-02-11 22:19:15",9,"What do you mean according to gravity? Like in interacts with objects but not light?",6892885658316096517,https://www.tiktok.com/share/user/6892885658316096517,https://www.tiktok.com/@normiewednesday/video/6928113689274977542?comment_id=6928134230878994437
13,,labcoatcat,"✧*。me ✧*。","2021-02-11 22:26:05",6,"I followed for the gender content, staying for the 🔥premium🔥 content",6810046347232773126,https://www.tiktok.com/share/user/6810046347232773126,https://www.tiktok.com/@labcoatcat/video/6928113689274977542?comment_id=6928135989274312709
14,,gloomywasp,glumi,"2021-02-11 22:31:07",36,"sorry guys i accidentally took it home i’ll bring it back next weekend",6676913424234447878,https://www.tiktok.com/share/user/6676913424234447878,https://www.tiktok.com/@gloomywasp/video/6928113689274977542?comment_id=6928137292385271814
15,,makingwavesreiki,MakingWavesReiki,"2021-02-11 22:43:52",4,"I think I see the root of the confusion. This is the dawning of the age of Aquarius 😅♒️(the 5th dimension is the band who sang this song) 😌 yw",6872931270230279174,https://www.tiktok.com/share/user/6872931270230279174,https://www.tiktok.com/@makingwavesreiki/video/6928113689274977542?comment_id=6928140575552733189
16,,precipitation_trophy,"uncanny devito","2021-02-11 23:39:06",81,"So, scientifically speaking, dark matter is definitely ghosts.",6918511267511043077,https://www.tiktok.com/share/user/6918511267511043077,https://www.tiktok.com/@precipitation_trophy/video/6928113689274977542?comment_id=6928154808776032262
17,,ellebellyjellybean_,El,"2021-02-12 00:19:52",1,"dark matter are ghosts and spirits? hmm I am gonna say yes",6734822527962661893,https://www.tiktok.com/share/user/6734822527962661893,https://www.tiktok.com/@ellebellyjellybean_/video/6928113689274977542?comment_id=6928165308536782853
18,,mark.wares,Mark.Wares,"2021-02-12 00:59:00",1,"But my zodiac said I’m a space goddess",6786286645886567429,https://www.tiktok.com/share/user/6786286645886567429,https://www.tiktok.com/@mark.wares/video/6928113689274977542?comment_id=6928175394478882822
19,,twobeansjr,"Bean dip","2021-02-12 01:09:05",1,"A game theory- I’ll see myself out",6860313228879987717,https://www.tiktok.com/share/user/6860313228879987717,https://www.tiktok.com/@twobeansjr/video/6928113689274977542?comment_id=6928177994712743942
20,,mr.tooth.man,"Tooth Man","2021-02-12 01:32:44",0,"What’s the fourth dimension?",6739127765306491910,https://www.tiktok.com/share/user/6739127765306491910,https://www.tiktok.com/@mr.tooth.man/video/6928113689274977542?comment_id=6928184090512736261
21,,neon.lucis,"Akosh Wilder","2021-02-12 01:40:51",26,"its all because that one guy that screams about everything and people just run with it",6816530360362288134,https://www.tiktok.com/share/user/6816530360362288134,https://www.tiktok.com/@neon.lucis/video/6928113689274977542?comment_id=6928186183008944134
22,,hijoprodigo,"Bananas Foster","2021-02-12 01:41:35",7,"Seems like it’s more of hypothesis 😉",6721546030402487302,https://www.tiktok.com/share/user/6721546030402487302,https://www.tiktok.com/@hijoprodigo/video/6928113689274977542?comment_id=6928186367801884677
23,,stateofemergency999,"⠀ ⠀ ⠀ ⠀ ⠀ ⠀","2021-02-12 01:44:14",0,"waiting for dark matter bong rip 🥱🥱🥱",6700683994935264262,https://www.tiktok.com/share/user/6700683994935264262,https://www.tiktok.com/@stateofemergency999/video/6928113689274977542?comment_id=6928187050378838021
24,,mxspite,"𝕄𝕩. 𝕊𝕡𝕚𝕥𝕖","2021-02-12 02:00:57",0,Subspace?,6897308352931988485,https://www.tiktok.com/share/user/6897308352931988485,https://www.tiktok.com/@mxspite/video/6928113689274977542?comment_id=6928191359849709573
25,,debeby,debeby,"2021-02-12 02:04:51",0,"I'm kinda confused... how would it be possible to prove that by accelerating a particle?",6789367469436355590,https://www.tiktok.com/share/user/6789367469436355590,https://www.tiktok.com/@debeby/video/6928113689274977542?comment_id=6928192366796881925
26,,babbysatan,Jakob☭,"2021-02-12 02:06:02",0,"so like in theory we could be flying through space one day and just smack into a whole lot of nothing? is it like physically there or just supposed to",190060379006226432,https://www.tiktok.com/share/user/190060379006226432,https://www.tiktok.com/@babbysatan/video/6928113689274977542?comment_id=6928192668992749573
27,,birdbrainmischief,"Vega North","2021-02-12 02:16:58",0,"And THAT’S why they were bringing up the CERN lab in all those articles.... They were lamenting that the biggest collider we have IS NOT ENOUGH.",6908869186141029382,https://www.tiktok.com/share/user/6908869186141029382,https://www.tiktok.com/@birdbrainmischief/video/6928113689274977542?comment_id=6928195483173502981
28,,matt_201120,Matt,"2021-02-12 02:20:09",0,"what kind of information would that particle accelerator provide?",6693590239292277766,https://www.tiktok.com/share/user/6693590239292277766,https://www.tiktok.com/@matt_201120/video/6928113689274977542?comment_id=6928196308360822789
29,,kuyinnaku,Demi,"2021-02-12 02:20:36",0,"how big of an accelerator would we need?",6703276117632386053,https://www.tiktok.com/share/user/6703276117632386053,https://www.tiktok.com/@kuyinnaku/video/6928113689274977542?comment_id=6928196419686285317
30,,stevonnieb,"Stevonnie Brooks","2021-02-12 02:22:31",1,"finally someone is addressing this",6807560820790658054,https://www.tiktok.com/share/user/6807560820790658054,https://www.tiktok.com/@stevonnieb/video/6928113689274977542?comment_id=6928196911649013765
31,,hyperslothgg,hyperslothgg,"2021-02-12 02:25:01",0,"it's just a hypothesis*really important to draw the distinction",6848649360537437190,https://www.tiktok.com/share/user/6848649360537437190,https://www.tiktok.com/@hyperslothgg/video/6928113689274977542?comment_id=6928197557878013957
32,,chucktownterry,Spaceistheplace143,"2021-02-12 02:25:39",0,"That’s rad",6843403108795040774,https://www.tiktok.com/share/user/6843403108795040774,https://www.tiktok.com/@chucktownterry/video/6928113689274977542?comment_id=6928197722260865029
33,,not.your.avg.michael,"Michael Anthony","2021-02-12 02:26:51",0,"Thank you for the clarification!",6764555604678673413,https://www.tiktok.com/share/user/6764555604678673413,https://www.tiktok.com/@not.your.avg.michael/video/6928113689274977542?comment_id=6928198032752508933
34,,skibbyshmunkis,SkibbleShmunk,"2021-02-12 02:26:53",2,"ever since i learned abt dark matter ive always suspected it’s extradimensional or somehow related to what we would consider “divine” 😳",6731353144230036486,https://www.tiktok.com/share/user/6731353144230036486,https://www.tiktok.com/@skibbyshmunkis/video/6928113689274977542?comment_id=6928198046509580294
35,,katuhklizhm,"Michael Klizhm","2021-02-12 02:29:11",0,"Thank you",6565176160556449797,https://www.tiktok.com/share/user/6565176160556449797,https://www.tiktok.com/@katuhklizhm/video/6928113689274977542?comment_id=6928198630290210821
36,,justhandrew,"I’m the hand","2021-02-12 02:29:55",6,"I literally zoned out at the exact moment you made your point and now have to re-watch to actually hear it 😅",6703673339351745542,https://www.tiktok.com/share/user/6703673339351745542,https://www.tiktok.com/@justhandrew/video/6928113689274977542?comment_id=6928198825568026629
37,,mgrommert,mg🍉,"2021-02-12 02:30:04",0,"yes this is so cool, empty space is proven to have energy!! also you have a beautiful voice",122879981457686528,https://www.tiktok.com/share/user/122879981457686528,https://www.tiktok.com/@mgrommert/video/6928113689274977542?comment_id=6928198865787322373
38,,astralplainjane,jP,"2021-02-12 02:31:03",0,"Physically there is too much stuff",6805777161360081926,https://www.tiktok.com/share/user/6805777161360081926,https://www.tiktok.com/@astralplainjane/video/6928113689274977542?comment_id=6928199115180572677
39,,valiant.__a,Adrian,"2021-02-12 02:36:28",17,"Your voice 😊💐💕💫. Your words 🤯💀👽🧠🪢",6653989442758901765,https://www.tiktok.com/share/user/6653989442758901765,https://www.tiktok.com/@valiant.__a/video/6928113689274977542?comment_id=6928200511410126853
40,,timbowman101,"Tim Bowman","2021-02-12 02:46:48",0,"So just how big a supercollider do you need? 😳",6890705685115323397,https://www.tiktok.com/share/user/6890705685115323397,https://www.tiktok.com/@timbowman101/video/6928113689274977542?comment_id=6928203178588520454
41,,catlikemeow1,"Cat 🐾","2021-02-12 02:51:17",0,Thisssss,6884058599544865798,https://www.tiktok.com/share/user/6884058599544865798,https://www.tiktok.com/@catlikemeow1/video/6928113689274977542?comment_id=6928204330504372230
42,,cockunist,Commie,"2021-02-12 02:52:36",0,@marcus.dipaola,6574344281402146825,https://www.tiktok.com/share/user/6574344281402146825,https://www.tiktok.com/@cockunist/video/6928113689274977542?comment_id=6928204672679313413
43,,palalalalaloma,Paloma,"2021-02-12 03:05:27",23,"as a physicist i say heavy ghosts (lol really tho thanks for putting pop science in its place it’s rough out there trying to explain things)",6736545803769185286,https://www.tiktok.com/share/user/6736545803769185286,https://www.tiktok.com/@palalalalaloma/video/6928113689274977542?comment_id=6928207976117731334
44,,highfemmeghost,"🥀 Madeline 🥀","2021-02-12 03:09:12",17,"Wow I haven’t been able to fully wrap my head around this until this video ty 👍🏻",6807522466291909637,https://www.tiktok.com/share/user/6807522466291909637,https://www.tiktok.com/@highfemmeghost/video/6928113689274977542?comment_id=6928208947673628678
45,,dubberz45,"Screaming mayonnaise eagle","2021-02-12 03:35:16",0,"We just need to redo the math. We messed up along the way. We need to go back to the beginning and start over. Some one was wrong.",6811203253024932869,https://www.tiktok.com/share/user/6811203253024932869,https://www.tiktok.com/@dubberz45/video/6928113689274977542?comment_id=6928215660099534853
46,,itscaitlee,"Cait Earnest","2021-02-12 03:38:22",2,"I am obsessed with all of your chaotic/random content!!! 💜",6838695105735918597,https://www.tiktok.com/share/user/6838695105735918597,https://www.tiktok.com/@itscaitlee/video/6928113689274977542?comment_id=6928216463669395461
47,,enbygenius,Jamie,"2021-02-12 03:39:37",371,"and why do I say “too much stuff” like a bad Bernie Sanders impression? I can’t explain that one",6653991404438011910,https://www.tiktok.com/share/user/6653991404438011910,https://www.tiktok.com/@enbygenius/video/6928113689274977542?comment_id=6928216780427378694
48,,itsparam001,Param,"2021-02-12 04:21:48",0,"A game theo... god dammit someone else beat me too it",6654254968504598534,https://www.tiktok.com/share/user/6654254968504598534,https://www.tiktok.com/@itsparam001/video/6928113689274977542?comment_id=6928227652188946438
49,,grforshort,"Whet that fak","2021-02-12 04:23:33",0,"Seems we stray further from freedom of gravity on our own terms",6796847586550170630,https://www.tiktok.com/share/user/6796847586550170630,https://www.tiktok.com/@grforshort/video/6928113689274977542?comment_id=6928228105941549061
50,,somedude2223,"Some dude","2021-02-12 04:28:38",0,"wait can we realistically build that particle accelerator",6836942634842801158,https://www.tiktok.com/share/user/6836942634842801158,https://www.tiktok.com/@somedude2223/video/6928113689274977542?comment_id=6928229409791492102
51,,coolfoolmoon,"Nikki / Darrius / Abhi / Staq","2021-02-12 04:42:38",0,"thank you for explaining dark matter bc i've never seen a good explanation for it thank youuuuuu",6758665010324440069,https://www.tiktok.com/share/user/6758665010324440069,https://www.tiktok.com/@coolfoolmoon/video/6928113689274977542?comment_id=6928233020583395334
52,,christianscorner,"Christians Corner","2021-02-12 04:42:53",1,"Okay but what about music theory",6843512082270290949,https://www.tiktok.com/share/user/6843512082270290949,https://www.tiktok.com/@christianscorner/video/6928113689274977542?comment_id=6928233083002945541
53,,valhayla_,Valhayla,"2021-02-12 05:03:51",0,"what if it's all the lost socks.",6823810577154245637,https://www.tiktok.com/share/user/6823810577154245637,https://www.tiktok.com/@valhayla_/video/6928113689274977542?comment_id=6928238482268094470
54,,monteggue,user8376836235334,"2021-02-12 05:27:26",0,"ok but I'm still freaked out. ok?",6890026500192519174,https://www.tiktok.com/share/user/6890026500192519174,https://www.tiktok.com/@monteggue/video/6928113689274977542?comment_id=6928244561794351110
55,,thevirgoarose,TheVirgo'Rose,"2021-02-12 05:29:20",0,"I don't know what it is, but I could listen to you talk about anything. 🥰",6695908770290238469,https://www.tiktok.com/share/user/6695908770290238469,https://www.tiktok.com/@thevirgoarose/video/6928113689274977542?comment_id=6928245053680779269
56,,physicsnick,nick,"2021-02-12 05:33:43",1,"I may be biased because I study WIMP dark matter, but the fifth dimensional extra geometric approach is hella cap",6821367390728012806,https://www.tiktok.com/share/user/6821367390728012806,https://www.tiktok.com/@physicsnick/video/6928113689274977542?comment_id=6928246176378716165
57,,442x705,442x705,"2021-02-12 05:39:43",1,"@_.vanitas._ first time I seen someone actually explain it",109786873673265152,https://www.tiktok.com/share/user/109786873673265152,https://www.tiktok.com/@442x705/video/6928113689274977542?comment_id=6928247732331151366
58,,youreprojectingnoyouare,"fraudian slop","2021-02-12 05:55:49",19,"the problem w people who try to make physics accessible on tiktok is that the popular ones all deepak-chopra it and make it “~spiritual~”",6872193498502906886,https://www.tiktok.com/share/user/6872193498502906886,https://www.tiktok.com/@youreprojectingnoyouare/video/6928113689274977542?comment_id=6928251868066545670
59,,yikestryhard,yikestryhard,"2021-02-12 05:59:52",0,"It exists in a lower dimension, not a higher one",6683260300986991621,https://www.tiktok.com/share/user/6683260300986991621,https://www.tiktok.com/@yikestryhard/video/6928113689274977542?comment_id=6928252925152182277
60,,chaoticsunsets,chaoticsunsets,"2021-02-12 06:19:34",0,"Okay so now I understand your username because every video you’re blowing my mind with something smart 😳 @enbygenius",6628904922090635270,https://www.tiktok.com/share/user/6628904922090635270,https://www.tiktok.com/@chaoticsunsets/video/6928113689274977542?comment_id=6928257998653734918
61,,user820450088636,user820450088636,"2021-02-12 06:45:56",0,"have you seen the paper that said that the arrangement of galaxies could be predicted by the galaxies surrounding them?",6704056191059067909,https://www.tiktok.com/share/user/6704056191059067909,https://www.tiktok.com/@user820450088636/video/6928113689274977542?comment_id=6928264795451883525
62,,savageperson777,john,"2021-02-12 06:46:45",0,"Theory or hypothesis?",6680763039019566086,https://www.tiktok.com/share/user/6680763039019566086,https://www.tiktok.com/@savageperson777/video/6928113689274977542?comment_id=6928265004924010502
63,,bradganley,"Bland Gourdbean","2021-02-12 06:48:01",3,"I think it’s more of a hypothesis. Academically, theories are usually about as proven as an idea can get.",6970941,https://www.tiktok.com/share/user/6970941,https://www.tiktok.com/@bradganley/video/6928113689274977542?comment_id=6928265311624495106
64,,x23manifold,x23manifold,"2021-02-12 06:53:45",0,"Pet peeve: It's just a hypothesis, not a scientific theory. It could be termed a mathematical theory, but should not be called ""just a theory"".",6902487131018363909,https://www.tiktok.com/share/user/6902487131018363909,https://www.tiktok.com/@x23manifold/video/6928113689274977542?comment_id=6928266807954554885
65,,hootenannyboy,nc,"2021-02-12 07:03:20",0,"Larger tha CERN? 😳",6873909659221263365,https://www.tiktok.com/share/user/6873909659221263365,https://www.tiktok.com/@hootenannyboy/video/6928113689274977542?comment_id=6928269259903270917
66,,bellakatearts,Bella,"2021-02-12 07:06:42",8,"unrelated but i think you’d do well as a model",6862473374523884549,https://www.tiktok.com/share/user/6862473374523884549,https://www.tiktok.com/@bellakatearts/video/6928113689274977542?comment_id=6928270139444101126
67,,drewuk,🅳🆁🅴🆆,"2021-02-12 07:07:18",1271,"Scientists: ""We have a hypothesis about dark matter ..."" - Media: ""SCIENTISTS FIND PORTAL TO 5TH DIMENSION!!!""",6773929276070953990,https://www.tiktok.com/share/user/6773929276070953990,https://www.tiktok.com/@drewuk/video/6928113689274977542?comment_id=6928270299658207238
68,,kalliboop,"smol 🍉","2021-02-12 07:07:22",0,"do you have a link for the paper?",6745697968710779909,https://www.tiktok.com/share/user/6745697968710779909,https://www.tiktok.com/@kalliboop/video/6928113689274977542?comment_id=6928270311796506629
69,,israeliberry,Arabinurabi,"2021-02-12 07:09:41",3,"a film theory",6654331184548560901,https://www.tiktok.com/share/user/6654331184548560901,https://www.tiktok.com/@israeliberry/video/6928113689274977542?comment_id=6928270908763291654
70,,ghoul4ghoul,Jace,"2021-02-12 07:11:56",2,"I think I tripped and fell into physics tiktok idk how I got here but now I'm invested and don't want to leave",6659928111075377157,https://www.tiktok.com/share/user/6659928111075377157,https://www.tiktok.com/@ghoul4ghoul/video/6928113689274977542?comment_id=6928271479218503685
71,,slimeguillotine,nicole,"2021-02-12 07:26:41",1,"this is the type of explanation he thinks he’s giving lol. this is so easily digestible w/o science knowledge while still being informative! thanks",6633584021279866885,https://www.tiktok.com/share/user/6633584021279866885,https://www.tiktok.com/@slimeguillotine/video/6928113689274977542?comment_id=6928275286186557441
72,,glammango,Stacy,"2021-02-12 07:28:55",240,"Omg this needs to be explained to spiritual TikTok because they took the 5D and ran with it it’s wild out there",6815752336280257541,https://www.tiktok.com/share/user/6815752336280257541,https://www.tiktok.com/@glammango/video/6928113689274977542?comment_id=6928275856679501829
73,,glynadugan,vertibraeker,"2021-02-12 07:31:15",0,"ghost land",6775568872923923462,https://www.tiktok.com/share/user/6775568872923923462,https://www.tiktok.com/@glynadugan/video/6928113689274977542?comment_id=6928276457454682117
74,,literallyohmygod,"My name 😀","2021-02-12 07:34:48",0,"Thank you for clearing this up 😌",6718177979106608134,https://www.tiktok.com/share/user/6718177979106608134,https://www.tiktok.com/@literallyohmygod/video/6928113689274977542?comment_id=6928277376145620997
75,,.alfi_,ALFI,"2021-02-12 07:36:15",0,"So we know that we know nothing ... got it 😁",6806839956100793349,https://www.tiktok.com/share/user/6806839956100793349,https://www.tiktok.com/@.alfi_/video/6928113689274977542?comment_id=6928277754827800581
76,,idontfeelreal,Len,"2021-02-12 07:59:56",2,"plz go viral",6718429439930352645,https://www.tiktok.com/share/user/6718429439930352645,https://www.tiktok.com/@idontfeelreal/video/6928113689274977542?comment_id=6928283853773766661
77,,tobii.the.hammy,🐹,"2021-02-12 08:17:25",0,"please explain everything to me forever. this might’ve been the first physics subject i’ve semi understood",6784144378014647301,https://www.tiktok.com/share/user/6784144378014647301,https://www.tiktok.com/@tobii.the.hammy/video/6928113689274977542?comment_id=6928288361757523973
78,,peaceout_is_in,Pam,"2021-02-12 08:19:43",0,ty,6810513690534888453,https://www.tiktok.com/share/user/6810513690534888453,https://www.tiktok.com/@peaceout_is_in/video/6928113689274977542?comment_id=6928288949811789829
79,,opticallusion,Opticallusion,"2021-02-12 08:23:38",0,"cybermen. or daleks",6674753972740817926,https://www.tiktok.com/share/user/6674753972740817926,https://www.tiktok.com/@opticallusion/video/6928113689274977542?comment_id=6928289951406948358
80,,olekries,Ole,"2021-02-12 08:38:39",0,"Wait is it a hypothesis or a theory?",6905411727534851073,https://www.tiktok.com/share/user/6905411727534851073,https://www.tiktok.com/@olekries/video/6928113689274977542?comment_id=6928293828881743878
81,,savage1rosa,"Savage AF","2021-02-12 08:51:01",1,@gapteef420,6891898109115499525,https://www.tiktok.com/share/user/6891898109115499525,https://www.tiktok.com/@savage1rosa/video/6928113689274977542?comment_id=6928297013797388294
82,,combyzconsulting,"Truston Sempf","2021-02-12 09:10:39",0,"theory or hypothesis?",6547271595142943744,https://www.tiktok.com/share/user/6547271595142943744,https://www.tiktok.com/@combyzconsulting/video/6928113689274977542?comment_id=6928302084437606405
83,,nanabahisenough,Nanabahisenough,"2021-02-12 09:38:03",0,"not saying it is wrong but in any other field, if you have to ‘discover’ extra dimensions to make your math work... you do not get the degree.",6852930813043885062,https://www.tiktok.com/share/user/6852930813043885062,https://www.tiktok.com/@nanabahisenough/video/6928113689274977542?comment_id=6928309140351860741
84,,jarih69,Jordan,"2021-02-12 10:34:53",0,"What needs to be built to prove it?",6899283275061347333,https://www.tiktok.com/share/user/6899283275061347333,https://www.tiktok.com/@jarih69/video/6928113689274977542?comment_id=6928323788706873350
85,,joeyazurian,"Joey Jean Ambrose","2021-02-12 10:43:31",0,"Dark matter",6628876671163662341,https://www.tiktok.com/share/user/6628876671163662341,https://www.tiktok.com/@joeyazurian/video/6928113689274977542?comment_id=6928326006466674694
86,,mkdrose,MaryKayla,"2021-02-12 13:45:15",0,"What if dark matter is the stuff we feel..?",6807340381510321157,https://www.tiktok.com/share/user/6807340381510321157,https://www.tiktok.com/@mkdrose/video/6928113689274977542?comment_id=6928372856300830726
87,,alrightysmallest,Vania,"2021-02-12 14:09:34",1,"THANK U",6695499084474352646,https://www.tiktok.com/share/user/6695499084474352646,https://www.tiktok.com/@alrightysmallest/video/6928113689274977542?comment_id=6928379123471712262
88,,oxycl33n,Onyx,"2021-02-12 14:14:08",0,"It’s just a theory.... a game theory.....",6678079166568662021,https://www.tiktok.com/share/user/6678079166568662021,https://www.tiktok.com/@oxycl33n/video/6928113689274977542?comment_id=6928380301320486917
89,,marissa2020,Marissa,"2021-02-12 14:29:21",0,"yet.. CERN sure is trying 😳",6772683656692745222,https://www.tiktok.com/share/user/6772683656692745222,https://www.tiktok.com/@marissa2020/video/6928113689274977542?comment_id=6928384222331912198
