comment_author,comment_time,comment_text,post_url
disgruntled_gorilla,2024-03-16 19:41:44,"I like how you speak with such confidence. Go ahead, tell us how you think you know any of this.",https://www.instagram.com/p/C4lhoFwvvy0
ex_awesome,2024-03-16 19:31:01,They are getting warmer.,https://www.instagram.com/p/C4lhoFwvvy0
docdavedt,2024-03-16 19:24:09,"Which so called scientists are these?  Dark matter does clump and holds regular matter. Without dark matter doing this galaxies would fall apart. Also, thereâs more dark matter than regular matter. ð",https://www.instagram.com/p/C4lhoFwvvy0
smumarbashir,2024-03-16 19:21:18,Dark Matter : still a mystery for scientists ð,https://www.instagram.com/p/C4lhoFwvvy0
paperbackraita,2023-11-20 08:52:39,Gravitational lensing! Discovered all about that in an audiobook I directed....it was a theory on the destruction of dinosaurs being a result of an increase in dark matter.....,https://www.instagram.com/p/CzFAy0ptaMl
narzyyf,2023-11-14 17:02:28,"I mean, is it arrogant to call ourselves âmatterâ, and the other âantimatterâ? ð",https://www.instagram.com/p/CzFAy0ptaMl
_seth_kolias_,2023-11-11 00:59:11,"@odufaighconn the universe is theorized to be equal parts matter to antimatter at the beginning of creation, and by pure random chance that matter left as the universes predominant form of matter, that being said there is evidence for planetary and stellar bodies in our universe to be made of antimatter. so it's put there, space just really big and we can't go get it yet :(",https://www.instagram.com/p/CzFAy0ptaMl
simon.wheal,2023-11-09 23:12:29,I saw a post saying that dark matter made up circa 60% of the universe and antimatter another 25% leaving 15% of matter - sounds like thereâs more antimatter than matter! And how can you tell whatâs what!!,https://www.instagram.com/p/CzFAy0ptaMl
rujihakure,2023-11-03 15:11:13,"If antimatter and matter both annihilate each other, by law of preservation of mass, what will they turn into?",https://www.instagram.com/p/CzFAy0ptaMl
joeyvanlanduyt,2023-11-03 13:03:10,@particleclara what is the clock app?,https://www.instagram.com/p/CzFAy0ptaMl
joeyvanlanduyt,2023-11-03 13:00:53,Real questionâ¦ could there be life that cannot penetrate quarks or light in general (much like you and I cannot pass freely through a brick wall) and have to live in dark matter recesses in the universe?,https://www.instagram.com/p/CzFAy0ptaMl
yeriwo_tosabano,2023-11-03 08:22:56,Im confused. How can dark matter affect the gravitational pull if it is only the absence of light?,https://www.instagram.com/p/CzFAy0ptaMl
bennjamin80,2023-11-03 07:02:56,"The antimatter became the wavelength of the echoing sound matter creates by being. All on the wave of sound. Still there exactly as regular matter. But itâs equational mirror image. But because this universe has a sort of calm consciousness. It couldnât just be the opposite and deconstruct everything back to before big bang. It politely asked all the other dimensions if anyone has a problem with it being. Only with permission it became. And that juxtaposition happened all at once. Well, thatâs actually it. We understand time from a collective perspective. But in truth. Time only exists in consciousness. But matter and antimatter both exist outside of time. The ability for them both to be organized enough they donât destroy each other, needed time. Because we all need to take a breath. Because no one has it all figured out.",https://www.instagram.com/p/CzFAy0ptaMl
justylusti,2023-11-03 05:23:03,@odufaighconn pretty recently scientists were able to synthesize atoms of antimatter! Look up antimatter produced at cern.,https://www.instagram.com/p/CzFAy0ptaMl
rockykoast,2023-11-02 20:43:19,"I'd love to live long enough to know tat science has found the full explanations for dark matter and antimatter (and magnetism- still much missing here I think!), but at 67 with a slow & treatable but presently incurable cancer (Waldenstroms), I'm running out of time...(space-time is a peculiar thing too!)",https://www.instagram.com/p/CzFAy0ptaMl
jbencomo379,2023-11-02 15:06:41,Youâre amazing! And those green eyes are beautiful.  No disrespect.,https://www.instagram.com/p/CzFAy0ptaMl
thireldalof,2023-11-02 11:52:52,Maybe the missing antimatter became dark matter.,https://www.instagram.com/p/CzFAy0ptaMl
sjhollist,2023-11-02 07:23:27,Dark matter is spiritual matter. Anti-matter is going backwards in time.,https://www.instagram.com/p/CzFAy0ptaMl
nicreed9,2023-11-02 04:21:46,Any chance that dark matter is the byproduct of matter-antimatter annihilation?,https://www.instagram.com/p/CzFAy0ptaMl
yo_adido_tu_adidas,2023-11-02 01:29:05,"@reallyflygreg afaik we donât know, because weâre not sure how dark matter interacts with itself. If it has its own version of electromagnetism, then maybe",https://www.instagram.com/p/CzFAy0ptaMl
hairyplug,2023-11-02 00:42:30,Thank you. I think?,https://www.instagram.com/p/CzFAy0ptaMl
kevin.laber,2023-11-01 17:58:33,"I was a Quark for Halloween.  I think Quantum principles have really lead me to believe in something more than our 80ish years here on the planet.  There really could not be such a precise design without a designer.  In 64 we theorized the existence of all of these new discoveries, so that knowledge obviously has existed as psychics and quantum principles from day one. Itâs pretty amazing when you think about that.",https://www.instagram.com/p/CzFAy0ptaMl
flatroundrockhound,2023-11-01 16:46:23,But if we were made of antimatter in an antimatter universe weâd probably just call it âmatterâ and what we now call âmatterâ would be the âantimatterâ ð¤,https://www.instagram.com/p/CzFAy0ptaMl
just.bovaly,2023-11-01 16:39:17,if you high-fived an antimatter twin you wouldn't just eliminate each other each gram of you would be like a nuclear bomb the mass of the anti you would probably destroy the planet or throw it out of orbit.,https://www.instagram.com/p/CzFAy0ptaMl
just.bovaly,2023-11-01 16:16:38,Dark matter may not even exist you may have your maths wrong,https://www.instagram.com/p/CzFAy0ptaMl
odufaighconn,2023-11-01 15:44:41,@nu.terry explain your looking for something that is nothing in a universe full of stuff the only way I can see it being found is you travel to the edge of the universe and out but that is impossible you would need to travel at the speed of light +1 for the age of rhe universe to reach it.,https://www.instagram.com/p/CzFAy0ptaMl
guilherme_paulino_jr,2023-11-01 15:44:15,@titoballs they who??,https://www.instagram.com/p/CzFAy0ptaMl
servet_kurcer,2023-11-01 13:36:22,Things no one fully understands yet you explained it very well for me. Thank you young  lady...,https://www.instagram.com/p/CzFAy0ptaMl
instakitch,2023-11-01 13:07:35,but srsly whatâs a âmatterâ?,https://www.instagram.com/p/CzFAy0ptaMl
manitake5,2023-11-01 11:54:54,"Reminds of Feynman's musing on 'particle-wave duality': that physicists decided that ""on Mondays and Wednesdays light behaved as a particle, on Tuesday, Thursday and Friday it behaves as a wave, and on the weekends we sit around and think about it!""",https://www.instagram.com/p/CzFAy0ptaMl
b.a.newby,2023-11-01 11:48:00,How confident are physicists that antimatter is responsible for the galaxy and light behavior you referenced? Could it be something else completely that we have yet to understand or discover?,https://www.instagram.com/p/CzFAy0ptaMl
particleclara,2023-11-01 10:11:24,@ishan666deb thank you! ð,https://www.instagram.com/p/CzFAy0ptaMl
charlesdeese,2023-11-01 10:01:36,I know what dark matter is. Can you recommend a good place to publish this information?,https://www.instagram.com/p/CzFAy0ptaMl
ishan666deb,2023-11-01 09:59:50,That was beautifully explained. Happy Halloween & Dark Matter day Clara. ð,https://www.instagram.com/p/CzFAy0ptaMl
r.a.h.u.l___s.i.n.g.h,2023-11-01 07:55:28,Matter-antimatter sounds analogous to cathode-anode.,https://www.instagram.com/p/CzFAy0ptaMl
sveny_cakes,2023-11-01 06:22:32,Well stated,https://www.instagram.com/p/CzFAy0ptaMl
ronaldguyrichards,2023-11-01 05:19:31,Brilliance is beautiful!,https://www.instagram.com/p/CzFAy0ptaMl
sidd_blistering_barnacles,2023-11-01 04:18:31,Suoer helpful! Can you please shed light on what is dark energy and how it is different from dark matter? :),https://www.instagram.com/p/CzFAy0ptaMl
zogg_from_betelgeuse,2023-11-01 02:12:12,"When you have an evil twin, they usually consider you their evil twin.",https://www.instagram.com/p/CzFAy0ptaMl
not_in_new_york_blues,2023-11-01 01:51:07,This was a great teaser can you explain how we know there is dark matter? Does it have a size that we could define? Where can we find it?,https://www.instagram.com/p/CzFAy0ptaMl
iamthegorf,2023-11-01 01:45:52,"Many things in mathematics, physics, astronomy, etc are non-observed for long periods of time existing only in the form of calculated expectation. That doesn't make them not real. Case in point, the Highs Boson. We knew for a long time that it should exist. The physics was very confident. But even up until it was discovered there were some that argued other options were more likely. The same goes for dark matter. There are individuals that argue that a modification to general relativity should be made but even those options still require something like dark matter.  It's completely possible that we may discover something that will fundamentally alter what we believe, as is the way the scientific process works. But for now a very large body of evidence and physics points to dark matter.",https://www.instagram.com/p/CzFAy0ptaMl
duanem.yyj,2023-11-01 01:25:25,Welcome to science. There something going on that cannot be explained with our current understanding of the universe around us. Einsteinâs General Theory of Relativity has so far passed every test when it comes to dealing with space-time problems. I wouldnât be surprised if the solution is a mix of new maths and discovering ways we can observe how dark matter interacts with regular matter. As scientists figure things out theyâll adjust their theories and move forward.. thatâs the scientific process.,https://www.instagram.com/p/CzFAy0ptaMl
odufaighconn,2023-11-01 00:39:03,Would it not be impossible to find anti matter in the matter universe,https://www.instagram.com/p/CzFAy0ptaMl
capezyo,2023-10-31 23:56:52,"Thank you, a bit Fisics-cologic but nice... advancing in the misterys of God...",https://www.instagram.com/p/CzFAy0ptaMl
reallyflygreg,2023-10-31 23:37:17,Is there dark antimatter?,https://www.instagram.com/p/CzFAy0ptaMl
jezzabythesea,2023-10-31 23:22:14,"You donât know itâs there, you just know there isnât enough mass in the universe to make the calculated expansion correct. So itâs an assumption that there must be some invisible mass, but perhaps thereâs a different solution, like the maths is wrong!?",https://www.instagram.com/p/CzFAy0ptaMl
azuphlas21,2023-10-31 23:18:35,"What if antimatter is more likely to make black holes for some unknown reason. This would explain why the biggest black holes are from the early universe, when there was more antimatter.",https://www.instagram.com/p/CzFAy0ptaMl
gerardw82,2023-10-31 22:15:28,Has there been any additional evidence of dark matter since Vera Rubin's work in 1970? Seeing as how she didn't think it existed: https://blogs.scientificamerican.com/guest-blog/vera-rubin-didnt-discover-dark-matter/,https://www.instagram.com/p/CzFAy0ptaMl
asea_redox_08,2023-10-31 22:14:03,TRY FEEL THE VIBE...EVIL AF,https://www.instagram.com/p/CzFAy0ptaMl
asea_redox_08,2023-10-31 22:13:33,These people are trying making demons coming to real life.... everybody can see in movies a little example.this is real...,https://www.instagram.com/p/CzFAy0ptaMl
massimodulisse,2023-10-31 21:52:57,"Or maybe we need modified gravity theories, given that after decades nobody has found what dark matter is...",https://www.instagram.com/p/CzFAy0ptaMl
ellieinstem,2023-10-31 21:50:03,"Dark matter ð¤ Halloween 
Loved this!! ð",https://www.instagram.com/p/CzFAy0ptaMl
therealaelabassi97,2023-10-31 21:47:54,Dark matter day in coincidence with the Halloween is pretty dope!!.,https://www.instagram.com/p/CzFAy0ptaMl
thethinker1958,2023-10-31 21:42:27,Does it really matter? ðâ¤ï¸. I wonder if energy can be extracted from dark matter even if we canât see itâ¦ if Aliens reach Earth probably is because they can use black matter as energy.â¤ï¸,https://www.instagram.com/p/CzFAy0ptaMl
particleclara,2023-10-31 21:31:57,This was a question I received on the clock app â°,https://www.instagram.com/p/CzFAy0ptaMl
philipreagles1,2023-06-09 19:07:25,@claranellist ðI'd forgotten about that question. I wonder if the answer to the antimatter question might be elusive like the fusion reactor which is always about twenty years off. ð¤£,https://www.instagram.com/p/CrwQD3aJTlj
particleclara,2023-06-09 18:54:03,@philipreagles1 good question that we're still working on!,https://www.instagram.com/p/CrwQD3aJTlj
iowander,2023-05-30 16:07:12,What is the distribution of dark matter in the universe? Where is it? How is it detected/located?,https://www.instagram.com/p/CrwQD3aJTlj
melisizwezuma,2023-05-21 20:02:50,How do physicists tell dark matter and dark energy apart?,https://www.instagram.com/p/CrwQD3aJTlj
golfercmo77,2023-05-14 04:12:02,Of that 15% that's 'normal matter' most of that is hydrogen in stars ð¤ªð¤·ââï¸,https://www.instagram.com/p/CrwQD3aJTlj
jonathangriffith68,2023-05-05 02:38:23,Dark Matter as I understand it is a way of explaining why galaxies are accelerating away from each otherâ¦It certainly sounds sexy â Dark Matterâ and so distracts from the fact that we simply cannot explain everything we observeâ¦.I wonder if itâs Astronomyâs WMD to inspire a crusade,https://www.instagram.com/p/CrwQD3aJTlj
mark.carpenter.14268,2023-05-05 02:36:08,So how is dark matter different from the rest of it all?,https://www.instagram.com/p/CrwQD3aJTlj
rockykoast,2023-05-04 21:58:35,"Though we know its properties, we  still dont fully understand magnetism yet..same for gravity I think...",https://www.instagram.com/p/CrwQD3aJTlj
rich_pickwick,2023-05-04 20:11:52,"Engineer who can mostly pretend he lives in a strictly Newtonian universe here. Could it be that what is missing is part of âourâ understanding of how matter interacts with Space-Time, and not some massive but invisible form of matter? I donât know enough to know if my question is even meaningful.",https://www.instagram.com/p/CrwQD3aJTlj
cheftom8571,2023-05-04 10:05:27,What about the universal web? The chains of hydrogen gas that connects all the cosmos? Would like to know you thoughts,https://www.instagram.com/p/CrwQD3aJTlj
weltschmerz_rocket,2023-05-04 03:40:22,but you probably are just a satanist since you work at cern. pieces of shit who think they are fooling everyone. you might fooling a lot of people but whoever put u there is fooling you even more. trash,https://www.instagram.com/p/CrwQD3aJTlj
weltschmerz_rocket,2023-05-04 03:39:13,brainwashed victim of modern scientism which is pseudoscience. a 21 century scientist does not even know that science is observable measurable repeatable. nothing that you are talking about was proven it's Based on theories that are based on theories that are based on hypothesis. there is not 1 single empirical experiment that proves anything you are talking about or anything it's based on. you have wasted your life on delusions and fantasies and you can't understand it because your life depends on not understanding that you have been fooled. Globetard.,https://www.instagram.com/p/CrwQD3aJTlj
jimbarlin,2023-05-04 02:36:52,"Look at an atomic structure, mostly empty space, look at a solar system, mostly empty space, look at the universe mostly empty space, but it's not empty at all, it's dark matter, an immeasurable wavelength.",https://www.instagram.com/p/CrwQD3aJTlj
harleydoss,2023-05-03 19:02:59,"I would like for better things for all people,  but the more is learned, the more is used to belittle us",https://www.instagram.com/p/CrwQD3aJTlj
grandpadabbins,2023-05-03 13:42:54,Have you noticed any space/time discrepancies from your research or as an affect of your research? Do you experience dejavue?,https://www.instagram.com/p/CrwQD3aJTlj
fastmover44,2023-05-03 08:47:41,It's my wife ð«£ð«£ð«£ð«£ð«£,https://www.instagram.com/p/CrwQD3aJTlj
wagnerkevin47,2023-05-03 08:43:34,"Just like cold, is the absence of heat, dark matter is the absence of matter. However, I believe it's entangled, witch makes it possibly matter, depending on observations. It ""reservers the right"" to be matter, if it's observed to be.",https://www.instagram.com/p/CrwQD3aJTlj
drloneranger,2023-05-03 07:14:25,Even sheldon cooper dint tell so clearly what dark matter is!!!,https://www.instagram.com/p/CrwQD3aJTlj
_entropy_07,2023-05-03 03:29:37,"@race_car_me sir my simple question is that , at CERN great minds like mam are working tirelessly for finding the answers and also correct questions which we need to raise , but is there any body you will be protecting the knowledge, data and information they generate not to be used for purpose of weapons making and etc ???ð¤",https://www.instagram.com/p/CrwQD3aJTlj
satish_happier_than_ever,2023-05-03 02:32:41,We see only below 0.5%in the universe. We have to learn more about to unknown things...,https://www.instagram.com/p/CrwQD3aJTlj
mnottothepi,2023-05-02 23:10:38,ð You Rock... ð¯,https://www.instagram.com/p/CrwQD3aJTlj
hilton3rd,2023-05-02 22:37:40,What do you think of the Skordis/Zlosnik alternative theory of a scalar field? https://arxiv.org/pdf/2007.00082v1.pdf,https://www.instagram.com/p/CrwQD3aJTlj
odufaighconn,2023-05-02 22:22:07,I wonder if dark matter is to large in scale to measure,https://www.instagram.com/p/CrwQD3aJTlj
jasonguysmiley,2023-05-02 21:23:38,It just won't play with electromagnetism ð,https://www.instagram.com/p/CrwQD3aJTlj
jasonguysmiley,2023-05-02 21:23:20,I like to imagine there's a very active and beautiful and FULL dark universe on the edges of everything we see,https://www.instagram.com/p/CrwQD3aJTlj
philipreagles1,2023-05-02 21:11:43,And then..how has antimatter become separated from matter? And where is it?,https://www.instagram.com/p/CrwQD3aJTlj
thethinker1958,2023-05-02 21:10:16,"Is it matter if it can pass through our bodies without touching them? Are they really tiny? Even if tiny, the amount should be affecting us. Is energy from the dark matter being deposited on all of us? â¤ï¸",https://www.instagram.com/p/CrwQD3aJTlj
_entropy_07,2023-05-02 21:00:23,"Don't You Think mam , upon knowing how to harness dark matter energy in a useful way , we as a society has always built weapons out of it first and then upon releasing the true devastating power of it, made those power plants or etc , which should not be the case for a growing society. We make bombs first then electricity, we make more nuclear bombs first then nuclear power plants, we make hydrogen bombs first then hydrogen fueled power plants... ???ð¤ð¤",https://www.instagram.com/p/CrwQD3aJTlj
lucidimaging,2023-05-02 20:58:01,"It's cool. We know so little, even with all of the advancements.",https://www.instagram.com/p/CrwQD3aJTlj
nu.terry,2023-05-02 20:42:27,"Perhaps itâs reversed. Suppose we are the dark matter and the other 85% is normal ð«£ð. Seriously though, the topic of dark matter and energy is fascinating and is indicative of how very little we actually know.",https://www.instagram.com/p/CrwQD3aJTlj
charlie_stevens13,2023-05-02 20:33:40,Lol You mean the more we can manipulate it !? Ma haha ha !!,https://www.instagram.com/p/CrwQD3aJTlj
winslm1972,2023-05-02 20:32:58,Or is it Dark Energy..... Or do we not understand gravity properly... Or do the strengths of the various fields vary?  Many things to explore.,https://www.instagram.com/p/CrwQD3aJTlj
scarface_de_rothschild,2023-05-02 20:32:51,You and all of your hard working colleagues make me human and aware of everything that really matters is your hard working spirit within yourself you release your spirit in all we see and have matter thank you for making CERN a reality for everyone to Matter,https://www.instagram.com/p/CrwQD3aJTlj
unimelb,2022-08-20 11:09:17,@fogwvr You can follow @arc_dmpp for updates ð,https://www.instagram.com/p/Chay3a-hET5
fogwvr,2022-08-20 06:08:56,Does the laboratory have an instagram page?,https://www.instagram.com/p/Chay3a-hET5
oddjoberik,2022-08-20 04:21:56,Talks about dark matter then says it will be amazing if they can discover it ð,https://www.instagram.com/p/Chay3a-hET5
hunaink,2022-08-19 01:12:57,Saw this one on Veritasium.,https://www.instagram.com/p/Chay3a-hET5
heshimuk2022,2022-06-30 23:48:59,"Isn't ""Space"" itself a fluid with a measurable viscosity akin to oil ð¤...gravity being the electromagnetic force that binds solid objects within the fluid of space ..?",https://www.instagram.com/p/CG4jFz8HzZf
ofeks.zav__guru,2022-06-17 06:28:55,Like democracy ð,https://www.instagram.com/p/CG4jFz8HzZf
313_bfree,2022-01-13 18:06:05,"Horton hears a hoot when they zoom out to our reality from a lamp shade  and was a universe within a universe within a universe lol planet in a solar system ,solar system in a galaxy, a galaxy in a universe ,  galaxy within ??? This all could be the universes eye, in all.... if  nothing can exist unless there is an eye of an observer.. and if we could see the dimensions  beyond on a microbial level under  the space between our brain waves  maybe it continues and is infinite beyond atoms and each atom is a universe ð¤¯",https://www.instagram.com/p/CG4jFz8HzZf
marthaokiya,2021-12-22 10:16:18,"âThe strange unknown matter, is called DARK MATTER.â ððð Iâm a huge fan of CERN!!!",https://www.instagram.com/p/CG4jFz8HzZf
michelleglobetrotter,2021-11-10 12:50:41,The creator who created this entire planet.,https://www.instagram.com/p/CG4jFz8HzZf
niidhii_07,2021-04-05 15:08:42,Is there a crack in the space time continuum? @cern can you please explain ð,https://www.instagram.com/p/CG4jFz8HzZf
magdahoibian,2020-12-02 09:23:46,"Of course, many questions, this is fascinating ðððï¸ðï¸â¨â¨â¨â¨",https://www.instagram.com/p/CG4jFz8HzZf
anasdarwish10,2020-12-01 19:27:08,"Melanin................ is pure Dark matter from outer space, encoded in DNA, the âXâ Gene.. NOTHING IS BY COINCIDENCE. NOTHING!!ð¯",https://www.instagram.com/p/CG4jFz8HzZf
anaticharaposa,2020-11-23 17:23:08,Thanks,https://www.instagram.com/p/CG4jFz8HzZf
jagdishkaur81,2020-11-17 16:26:00,@cern Pls check your dm,https://www.instagram.com/p/CG4jFz8HzZf
reverie_lluvia,2020-11-11 10:26:53,How dark matter is formed?,https://www.instagram.com/p/CG4jFz8HzZf
yahawahchild,2020-11-07 20:28:29,"Anti - Matter from deep space  conjoin with Anti matter  in humans...EQUALS DEMONIC  ENERGY ...THE MOST  HIGH'S  2ND COMING....YOU EDOMITES (WHITE  NATION) WILL SOON  BE EXTINCT...BY ð¥ð¥ð¥ð¥ð¥ð¥Obadiah 15,18
15 For the day of the Lord is near upon all the heathen: as thou hast done, it shall be done unto thee: thy reward shall return upon thine own head.
18 And the house of Jacob shall be a fire, and the house of Joseph a flame, and the house of Esau for stubble, and they shall kindle in them, and devour them; and there shall not be any remaining of the house of Esau; for the Lord hath spoken it.",https://www.instagram.com/p/CG4jFz8HzZf
burbachprincess,2020-11-02 01:33:31,"@flop_snail wow. I'm no physicist, so I don't ever work with those tiny magnitudes. The only term that comes to my mind is ""femtoseconds""",https://www.instagram.com/p/CG4jFz8HzZf
flop_snail,2020-11-02 01:07:55,@burbachprincess milliseconds would be a huge black hole. The ones they produce last at most 10^-83 seconds. But I know what you mean.,https://www.instagram.com/p/CG4jFz8HzZf
andresvallve,2020-10-29 18:05:11,Hi from ð»ðªð»ðªððð,https://www.instagram.com/p/CG4jFz8HzZf
hmkolps456j,2020-10-29 12:05:02,"cern We ask young physicists and researchers to explore dark matter particles (axions)
What is the percentage of the presence of axons?
We ask them to do new research
Please send the request to the experimental physicists",https://www.instagram.com/p/CG4jFz8HzZf
sarimansarim,2020-10-29 03:17:38,I think you should do an in depth research in this matter. Any explanation in the comments section wouldnt be enough.,https://www.instagram.com/p/CG4jFz8HzZf
best_by_nature,2020-10-29 03:09:24,What if dark matter functions as a wave form within the particle itself. As the wave form moves the particles would reaction to it surround environment.  Just A Thought.,https://www.instagram.com/p/CG4jFz8HzZf
keenondean,2020-10-29 02:56:22,I enjoyed it very much but would like to have it explained. Has the elusive boson been found.,https://www.instagram.com/p/CG4jFz8HzZf
fredbrowning3,2020-10-29 02:36:02,You mean Outer Darkness and cern is the Key!!,https://www.instagram.com/p/CG4jFz8HzZf
kaylaippoliti,2020-10-28 23:55:57,@the_doctor_11d ðð¼,https://www.instagram.com/p/CG4jFz8HzZf
kaylaippoliti,2020-10-28 23:55:48,@the18thdoctor ð,https://www.instagram.com/p/CG4jFz8HzZf
ready_steady_rock,2020-10-28 21:14:10,"Good it's a secret, man will only destroy the universe if he knows how.",https://www.instagram.com/p/CG4jFz8HzZf
embodied_seer,2020-10-28 19:33:37,Open a freaking portal already ffs.,https://www.instagram.com/p/CG4jFz8HzZf
