comment_author,comment_time,comment_text,post_url
andre_gomes_sci,2023-12-11 21:01:08,"Why people keep saying that Dark Matter is matter? There are alternative hypothesis such as MOND that doesn't requires matter. They say it's matter as they knew it, which is not true!",https://www.instagram.com/reel/CvFRyO7gA-1/?igsh=MWo0YzlsOXgwMGs0Nw==
mercuriimors,2023-11-19 17:52:52,@higgs_boson666 wonderful! I hope your research takes you to big places and answers to some questions of the universe we live in:) ??,https://www.instagram.com/reel/CvFRyO7gA-1/?igsh=MWo0YzlsOXgwMGs0Nw==
higgs_boson666,2023-11-19 17:38:23,@tristis_mercurii  thanks  for all that knowledge  and after this conversation  I will start my new research  paper on it,https://www.instagram.com/reel/CvFRyO7gA-1/?igsh=MWo0YzlsOXgwMGs0Nw==
mercuriimors,2023-11-19 17:36:11,"@higgs_boson666  it is not dum, and you are smart to ask such questions. It is incredibly interesting subject most people dont even think about. I enjoy our conversation very much:)",https://www.instagram.com/reel/CvFRyO7gA-1/?igsh=MWo0YzlsOXgwMGs0Nw==
higgs_boson666,2023-11-19 17:12:36,@tristis_mercurii great  sorry  for my Dum question  I am  16 year old kid,https://www.instagram.com/reel/CvFRyO7gA-1/?igsh=MWo0YzlsOXgwMGs0Nw==
mercuriimors,2023-11-19 14:26:16,"@higgs_boson666 yes, but not completely necessary. Gravity is a powerful form of energy, but to move through time you can use gravity but really all you need is energy. Light is energy too and sound for example there are more complex forms of energy that I am in no way an expert on, but if we could find the right type of energy particles we could possibly explore time and dark matter further. Or maybe we could create a gravity engine and use that to conquer time? :)",https://www.instagram.com/reel/CvFRyO7gA-1/?igsh=MWo0YzlsOXgwMGs0Nw==
higgs_boson666,2023-11-19 05:58:23,@tristis_mercurii but don't you think  to change  in time field we need gravity  and gravity cause  due to mass and if there is mass we should  know  that  right,https://www.instagram.com/reel/CvFRyO7gA-1/?igsh=MWo0YzlsOXgwMGs0Nw==
higgs_boson666,2023-11-19 05:53:34,@tristis_mercurii got it totally  understood,https://www.instagram.com/reel/CvFRyO7gA-1/?igsh=MWo0YzlsOXgwMGs0Nw==
mercuriimors,2023-11-19 04:04:50,"@higgs_boson666 I would like to think dark matter is in the faster time field relative to us because if it does not absorb or reflect light then it could be because it is outside of the effects of light particles, and anything beyond the speed or effect of light is usually because it is outside of what we perceive as time itself. Which is why I think we cant observe dark matter. :)",https://www.instagram.com/reel/CvFRyO7gA-1/?igsh=MWo0YzlsOXgwMGs0Nw==
mercuriimors,2023-11-19 03:56:59,"@higgs_boson666 Ill do my best, do you understand the theory of relativity? If so think of it as an extension of relativity, the dark matter is there because we can understand that its energetic effects are there, but we cannot observe it because it is beyond our relative perspective if that makes sense. Therefore we are in a slower or faster time field than dark matter. Just as we cannot physically see the past or future we cannot see dark matter but understand it is there.",https://www.instagram.com/reel/CvFRyO7gA-1/?igsh=MWo0YzlsOXgwMGs0Nw==
higgs_boson666,2023-11-18 20:10:49,"I totally disagree that we know 20% of the universe because for knowing 20% of the universe. We shouldn't know what is the 100% of our universe. We don't know what are the limits of the universe. And big Bang is just a hypothesis.
So, according to me we don't even 10×10-?? percent of the universe is Because we don't even know the limits of the universe. So a thing which is a limitless show. We can't like say what our knowledge is a twenty percent The universe",https://www.instagram.com/reel/CvFRyO7gA-1/?igsh=MWo0YzlsOXgwMGs0Nw==
higgs_boson666,2023-11-18 20:07:34,@tristis_mercurii  sir/mam I am very interested  if you mind explain  it to me,https://www.instagram.com/reel/CvFRyO7gA-1/?igsh=MWo0YzlsOXgwMGs0Nw==
greatnessbaby805,2023-11-14 19:19:40,"I know of Dark Matter and it Particles,,., lifes biggest question ?????",https://www.instagram.com/reel/CvFRyO7gA-1/?igsh=MWo0YzlsOXgwMGs0Nw==
everestjumper,2023-10-19 14:24:50,"one word, WOW, AMAZING I AM AT A LOST FOR WORDS, I wanna know just what is out there.
Thank for all your help",https://www.instagram.com/reel/CvFRyO7gA-1/?igsh=MWo0YzlsOXgwMGs0Nw==
achromicboy,2023-10-17 00:36:20,There is NO proof and NO evidence about the properties of dark matter,https://www.instagram.com/reel/CvFRyO7gA-1/?igsh=MWo0YzlsOXgwMGs0Nw==
edmacieje,2023-09-30 11:42:53,No. Dark matter is a fudge factor to hide the fact that general relativity has a flaw which morons have elevated to a religion.,https://www.instagram.com/reel/CvFRyO7gA-1/?igsh=MWo0YzlsOXgwMGs0Nw==
noooon.12.11,2023-09-30 09:16:17,"So why is  light absorbed by black holes, if dark matter doesn't absorb light?",https://www.instagram.com/reel/CvFRyO7gA-1/?igsh=MWo0YzlsOXgwMGs0Nw==
frank_lo_strano,2023-09-27 11:17:30,"@caroline_pal.mer we don't know much about dark stuff in general, even tho there are some theories both for dark energy and for dark matter. They're still not convincing nor proven",https://www.instagram.com/reel/CvFRyO7gA-1/?igsh=MWo0YzlsOXgwMGs0Nw==
caroline_pal.mer,2023-09-27 07:43:46,@frank_lo_strano so basically dark matter is the stuff we dont know?,https://www.instagram.com/reel/CvFRyO7gA-1/?igsh=MWo0YzlsOXgwMGs0Nw==
dockamalnabha,2023-09-22 16:36:09,"Wrong, dark matter makes up 95.1% of the universe. Everything we have ever studied makes up only 4.9%",https://www.instagram.com/reel/CvFRyO7gA-1/?igsh=MWo0YzlsOXgwMGs0Nw==
coldwindofdecember,2023-09-21 04:46:09,Actually that 20% might be just 1%,https://www.instagram.com/reel/CvFRyO7gA-1/?igsh=MWo0YzlsOXgwMGs0Nw==
albertsongman,2023-08-29 22:09:06,Dark matter & energy is probably inter dimensional substance that we dont have the equipment to truly observe.,https://www.instagram.com/reel/CvFRyO7gA-1/?igsh=MWo0YzlsOXgwMGs0Nw==
harshgodara84,2023-08-29 20:24:46,"How do you know it's only 20% when you dont know what 100% is , maybe its just 1%",https://www.instagram.com/reel/CvFRyO7gA-1/?igsh=MWo0YzlsOXgwMGs0Nw==
croissants.and.coffee,2023-08-29 01:06:44,"I hate this whole link tree trend. It actually turns me off of subscribing. It's fine for onlyfans models, nit for a science channel. Step-1 watch the reel, step-2 read the description ; description says watch the whole video link in bio, Step-3 Go to bio, Step-4 Bio has link tree link, Step-5 open browser and go to collection of links Step-6 Go to website that has the video Step-7 Finally watch it.  NO THANKS!!",https://www.instagram.com/reel/CvFRyO7gA-1/?igsh=MWo0YzlsOXgwMGs0Nw==
lionelkrupka,2023-08-28 04:52:59,@paul17.98 let us know if you find it !,https://www.instagram.com/reel/CvFRyO7gA-1/?igsh=MWo0YzlsOXgwMGs0Nw==
paul17.98,2023-08-28 00:53:08,Where's the full video?,https://www.instagram.com/reel/CvFRyO7gA-1/?igsh=MWo0YzlsOXgwMGs0Nw==
davinuzza,2023-08-27 15:08:47,"I know maybe this is wrong but In my opinion ( if i can speak ) let's think dark matter is gravity it self and you can imagine it like atmosphere, more further you from the surface the thin-er ( less-er ) the effect on you. So you can explain why some area in our universe have a unknown field of gravitation force but not attached in regular mater whatsoever cause it doesn't absorb photon",https://www.instagram.com/reel/CvFRyO7gA-1/?igsh=MWo0YzlsOXgwMGs0Nw==
dillon_perfectmyself1111,2023-08-27 05:09:31,Great,https://www.instagram.com/reel/CvFRyO7gA-1/?igsh=MWo0YzlsOXgwMGs0Nw==
mercuriimors,2023-08-25 17:17:56,I would like to hypothesize that dark matter is in a completely different time field or zone or reality than us so beyond us in a way that we cannot observe it.,https://www.instagram.com/reel/CvFRyO7gA-1/?igsh=MWo0YzlsOXgwMGs0Nw==
jamesgluz,2023-08-25 12:19:41,"and know how you define ""creates gravity"" 1. dark matter has a gravitation field. 2. dark matter is what allows  matter to generate a gravitational field.",https://www.instagram.com/reel/CvFRyO7gA-1/?igsh=MWo0YzlsOXgwMGs0Nw==
hellotan90,2023-08-25 09:22:29,This is so interesting! The universe is truly full of @mit .,https://www.instagram.com/reel/CvFRyO7gA-1/?igsh=MWo0YzlsOXgwMGs0Nw==
switchxhands,2023-08-24 05:18:05,How did you know that it is dark?  Or it is a matter?,https://www.instagram.com/reel/CvFRyO7gA-1/?igsh=MWo0YzlsOXgwMGs0Nw==
pryajn_malhotra,2023-08-23 08:07:20,Dark matter is a matter that is dark ??,https://www.instagram.com/reel/CvFRyO7gA-1/?igsh=MWo0YzlsOXgwMGs0Nw==
iam_hmkd,2023-08-22 01:23:18,So weve discovered 20% of the universe but only 5% of our own oceans? ??,https://www.instagram.com/reel/CvFRyO7gA-1/?igsh=MWo0YzlsOXgwMGs0Nw==
herrphysiker,2023-08-21 11:33:30,"""Dark matter"" is so a misleading term, it should be named ""invisible matter""",https://www.instagram.com/reel/CvFRyO7gA-1/?igsh=MWo0YzlsOXgwMGs0Nw==
haseebkhan6402,2023-08-19 19:37:17,Does it really matter?,https://www.instagram.com/reel/CvFRyO7gA-1/?igsh=MWo0YzlsOXgwMGs0Nw==
aliumarr.3,2023-08-19 06:44:55,"But isn't the massive mass of an object causing rip in space and time fabric, creating gravity?",https://www.instagram.com/reel/CvFRyO7gA-1/?igsh=MWo0YzlsOXgwMGs0Nw==
s1mply.nimish._.0,2023-08-19 05:18:59,"It would take billions of years to travel the whole universe even if we travel with the speed of light. So, pretty sure that we are nowhere close to studying even 10% of the observable universe. We've studied 20% of our solar system. Not even our galaxy.",https://www.instagram.com/reel/CvFRyO7gA-1/?igsh=MWo0YzlsOXgwMGs0Nw==
mundu_ni_waweru,2023-08-19 05:18:41,"@gabriel.grndjn  when gravity is, it bends the curvature of space, when applied in excess as is the case of black holes, it tears a hole in space, is this direction of curvature formation between different bodies in a similar direction and is the existence of gravity the attraction of this existing bodies to the curvature of space by an unknown mass on the other side of the curvature. Could this be where objects pulled by black holes end up and if it makes 80% of the universe could we be orbiting it as a universe.",https://www.instagram.com/reel/CvFRyO7gA-1/?igsh=MWo0YzlsOXgwMGs0Nw==
gabriel.grndjn,2023-08-19 00:46:11,"@living_dead_repeat Blackholes are made of matter. They're black because their gravity is so strong it pulls light away from our eyes. Dark matter is a concept that has not been proven, which could explain why our equations don't work with spinning galaxy. To be simple, galaxies need a specific mass in order to be stable, but our equations say that they're only 20% of what they should be. Some people say our equations don't work on galaxies, and others say our equations works, but we need to add something we don't know it exists to make them works",https://www.instagram.com/reel/CvFRyO7gA-1/?igsh=MWo0YzlsOXgwMGs0Nw==
ridings02,2023-08-18 21:52:03,@tkost0 Im married to the grind,https://www.instagram.com/reel/CvFRyO7gA-1/?igsh=MWo0YzlsOXgwMGs0Nw==
hp_1__,2023-08-18 13:46:33,@1420_caperzap wow thats awesome!! All my knowledge is based on my A level physics so Ill try get a better understanding. Thanks??,https://www.instagram.com/reel/CvFRyO7gA-1/?igsh=MWo0YzlsOXgwMGs0Nw==
1420_caperzap,2023-08-18 13:42:38,"@hp_1__ I think we can calculate it by the gravitational lensing. if the universe enough mass then gravitational lensing equation should satisfy ,but if not then we can calculate the missing mass. Same for the acceleration of the universe and the gravitational equation.",https://www.instagram.com/reel/CvFRyO7gA-1/?igsh=MWo0YzlsOXgwMGs0Nw==
ucefkh,2023-08-17 23:31:14,I think it's 79% not 80%,https://www.instagram.com/reel/CvFRyO7gA-1/?igsh=MWo0YzlsOXgwMGs0Nw==
francesco.bondini,2023-08-17 16:14:16,"@hp_1__ no, wait. In science the word theory doesn't refer to something that hasn't been proven. The word theory is something that describes WHY something happens (big bang theory explaining why of the expansion, relativity theory explaining why gravity), as opposed to LAW which is something that describes HOW something happens (Newton's gravitational law only described how gravity happens under some limitations, not why there is gravity). So in science the world THEORY still referees to something that has been proven multiple times. It is NOT something that has no proof.",https://www.instagram.com/reel/CvFRyO7gA-1/?igsh=MWo0YzlsOXgwMGs0Nw==
ademkhalil13,2023-08-16 14:23:43,"And fun fact Einstein ""mistakenly"" discovered it",https://www.instagram.com/reel/CvFRyO7gA-1/?igsh=MWo0YzlsOXgwMGs0Nw==
hp_1__,2023-08-16 11:57:07,@3tmn yeah its called theory for a reason,https://www.instagram.com/reel/CvFRyO7gA-1/?igsh=MWo0YzlsOXgwMGs0Nw==
hp_1__,2023-08-16 11:53:51,"@mandinga37 we can see the affect dark matter has on the universe due to gravity even though we cannot see it. We came up with dark matter because the mass in the universe that we can observe shouldnt produce enough gravity for galaxies to stay together, so there must be a form of non observable matter holding the universe together.",https://www.instagram.com/reel/CvFRyO7gA-1/?igsh=MWo0YzlsOXgwMGs0Nw==
ridings02,2023-07-30 21:53:56,This is just what big dark matter wants you to think so they can sell more dark matter,https://www.instagram.com/reel/CvFRyO7gA-1/?igsh=MWo0YzlsOXgwMGs0Nw==
forhnii_m_kamara,2023-07-26 15:24:06,Even the Universe using the 80/20 rule????,https://www.instagram.com/reel/CvFRyO7gA-1/?igsh=MWo0YzlsOXgwMGs0Nw==
st3212312,2023-07-25 12:21:07,Dark matter is a matter with Butt ??,https://www.instagram.com/reel/CvFRyO7gA-1/?igsh=MWo0YzlsOXgwMGs0Nw==
savagelante,2023-07-24 20:28:12,"How can I apply, please?",https://www.instagram.com/reel/CvFRyO7gA-1/?igsh=MWo0YzlsOXgwMGs0Nw==
frank_lo_strano,2023-07-24 19:37:31,"@pranavmahapatra no, she said that when talking about matter (not energy) 20% is baryonic and 80% is dark matter",https://www.instagram.com/reel/CvFRyO7gA-1/?igsh=MWo0YzlsOXgwMGs0Nw==
pranavmahapatra,2023-07-24 19:29:51,"@frank_lo_strano all good, but she basically said that the visible matter is 20% and 80% is (dark matter + dark energy) or we don't know what it is",https://www.instagram.com/reel/CvFRyO7gA-1/?igsh=MWo0YzlsOXgwMGs0Nw==
vhduuwvisjsjsjdo47e8e8s7hsjwvw,2023-07-24 19:13:46,"I really don't understand why you don't answer my direct message. I asked you a thousand times to say yes or no, that's enough.",https://www.instagram.com/reel/CvFRyO7gA-1/?igsh=MWo0YzlsOXgwMGs0Nw==
vhduuwvisjsjsjdo47e8e8s7hsjwvw,2023-07-24 19:13:43,"I really don't understand why you don't answer my direct message. I asked you a thousand times to say yes or no, that's enough.????????",https://www.instagram.com/reel/CvFRyO7gA-1/?igsh=MWo0YzlsOXgwMGs0Nw==
frank_lo_strano,2023-07-24 18:57:25,@pranavmahapatra that's the energy of visible matter. Then there is a 26% of dark matter energy and 69% of dark energy,https://www.instagram.com/reel/CvFRyO7gA-1/?igsh=MWo0YzlsOXgwMGs0Nw==
chriszell.design,2023-07-24 17:26:36,oh now we gittin somewhere! (stop it donkey!),https://www.instagram.com/reel/CvFRyO7gA-1/?igsh=MWo0YzlsOXgwMGs0Nw==
mandinga37,2023-07-24 16:24:32,"If you dont know what it is, how do you know its 80%? ??",https://www.instagram.com/reel/CvFRyO7gA-1/?igsh=MWo0YzlsOXgwMGs0Nw==
masihkabiri33,2023-07-24 16:13:41,"But God knows. Thats the reason why we mostly arise our gratitude to god, expressing the motto in God we trust. ????",https://www.instagram.com/reel/CvFRyO7gA-1/?igsh=MWo0YzlsOXgwMGs0Nw==
01_azizbek02,2023-07-24 15:01:43,Where is the link of full video??,https://www.instagram.com/reel/CvFRyO7gA-1/?igsh=MWo0YzlsOXgwMGs0Nw==
3tmn,2023-07-24 14:13:41,"Fictional, fabricated, and not proven 100%",https://www.instagram.com/reel/CvFRyO7gA-1/?igsh=MWo0YzlsOXgwMGs0Nw==
seyedshahabmehdinia,2023-07-24 14:00:09,Fascinating! The pursuit of understanding dark matter is like solving an intergalactic puzzle.,https://www.instagram.com/reel/CvFRyO7gA-1/?igsh=MWo0YzlsOXgwMGs0Nw==
simon.wheal,2023-07-09 07:39:12,"@masihkabiri1 why would you trust a god that created cancer? Nope, never used that phrase, never will",https://www.instagram.com/reel/CvFRyO7gA-1/?igsh=MWo0YzlsOXgwMGs0Nw==
dreissman1,2023-02-09 07:11:41,Sorry but you think you know 20%? Is this a joke?,https://www.instagram.com/reel/CvFRyO7gA-1/?igsh=MWo0YzlsOXgwMGs0Nw==
sattar9356,2023-02-08 11:31:46,"Amazing dark matter n equally amazing is the effort to explain, explore and investigate it, for which a big hand for mit n its students",https://www.instagram.com/reel/CvFRyO7gA-1/?igsh=MWo0YzlsOXgwMGs0Nw==
vincent_h_chamberlain,2024-12-04 15:45:34,"@ke_yhw it can. Coincidences are just that, coincidences. Something that just so happens to happen, no further meaning behind it. You think theres a god because you ran into your friend from kindergarten at the store yesterday? You need to find your brain, its lost",https://www.instagram.com/reel/C5i-ludtRUa/?igsh=b3A3Ynd5YTN1bDI1
mazennoor1,2024-12-04 09:01:08,@dd_davidd  the rest is hydrogen gas clouds and dust and there is no dark energy but there is a  cosmic sphere cover around intire universe,https://www.instagram.com/reel/C5i-ludtRUa/?igsh=b3A3Ynd5YTN1bDI1
dd_davidd,2024-12-04 08:50:33,@shortye30 ??,https://www.instagram.com/reel/C5i-ludtRUa/?igsh=b3A3Ynd5YTN1bDI1
dd_davidd,2024-12-04 08:49:54,"Everything we know about in the Universe, all the galaxies etc., adds up to only around 3% of everything there is. The rest is totally unknown to us and is therefore ""dark"" to us (i.e. is unknown).",https://www.instagram.com/reel/C5i-ludtRUa/?igsh=b3A3Ynd5YTN1bDI1
mazennoor1,2024-11-04 13:16:33,@emersonmcz74 God the creator of everything with his hand,https://www.instagram.com/reel/C5i-ludtRUa/?igsh=b3A3Ynd5YTN1bDI1
mazennoor1,2024-11-04 13:13:57,"90% of the matter in the universe is hydrogen gas , 10% dust which we call it a  new particles",https://www.instagram.com/reel/C5i-ludtRUa/?igsh=b3A3Ynd5YTN1bDI1
centenarianbound,2024-11-04 04:26:57,"Guesses , theories, ??. Admit it, God created the universe period. Thank you my loving God. ????",https://www.instagram.com/reel/C5i-ludtRUa/?igsh=b3A3Ynd5YTN1bDI1
tessgretten,2024-11-04 03:13:55,@talkciscity what lie?,https://www.instagram.com/reel/C5i-ludtRUa/?igsh=b3A3Ynd5YTN1bDI1
tessgretten,2024-11-04 03:13:42,"@emersonmcz74 that is entirely possible, but also ?? opinion.",https://www.instagram.com/reel/C5i-ludtRUa/?igsh=b3A3Ynd5YTN1bDI1
swavydre20,2024-10-04 20:26:24,"@ke_yhw religion doesnt equal knowledge because nothing backs up anything yall say about it, yall just look at something and say oh god did it lol.",https://www.instagram.com/reel/C5i-ludtRUa/?igsh=b3A3Ynd5YTN1bDI1
ke_yhw,2024-10-04 20:19:16,"@swavydre20 ,religion=knowledge,logically acknowledged pre knowledge THAT you can not KNOW=Heb.11:1=SCIENCE.. .WHO KNOWS ?",https://www.instagram.com/reel/C5i-ludtRUa/?igsh=b3A3Ynd5YTN1bDI1
swavydre20,2024-10-04 19:39:59,@ke_yhw thats the biggest problem with religion these days it allows yall to be less educated,https://www.instagram.com/reel/C5i-ludtRUa/?igsh=b3A3Ynd5YTN1bDI1
alexander.the.mediocre,2024-10-04 19:28:36,"@shortye30 Right, people's consciousnesses create gravitational effects all across the universe. Right...",https://www.instagram.com/reel/C5i-ludtRUa/?igsh=b3A3Ynd5YTN1bDI1
alexander.the.mediocre,2024-10-04 19:28:00,*when a Marvel movie tries to sound like they're being scientific*,https://www.instagram.com/reel/C5i-ludtRUa/?igsh=b3A3Ynd5YTN1bDI1
alexander.the.mediocre,2024-10-04 19:27:14,@ke_yhw You have to be a troll. He wasn't even talking about that kind of evolution,https://www.instagram.com/reel/C5i-ludtRUa/?igsh=b3A3Ynd5YTN1bDI1
alexander.the.mediocre,2024-10-04 19:26:44,@talkciscity Where's the lie?,https://www.instagram.com/reel/C5i-ludtRUa/?igsh=b3A3Ynd5YTN1bDI1
ke_yhw,2024-10-04 19:23:19,"@ke_yh,correct means what ?.. !.. .",https://www.instagram.com/reel/C5i-ludtRUa/?igsh=b3A3Ynd5YTN1bDI1
ke_yhw,2024-10-04 19:20:46,"@swavydre20 ,science can not deal with coincidences.. =is strictly correct= .. !.. .?",https://www.instagram.com/reel/C5i-ludtRUa/?igsh=b3A3Ynd5YTN1bDI1
abrahamparambath,2024-10-04 18:36:49,"Where do we fix, particle or a string. Science is so limited to explain anything in full",https://www.instagram.com/reel/C5i-ludtRUa/?igsh=b3A3Ynd5YTN1bDI1
emersonmcz74,2024-10-04 18:07:53,The more our science evolves the closer we get to the Creator of all this. Something beyond our current understanding and comprehension,https://www.instagram.com/reel/C5i-ludtRUa/?igsh=b3A3Ynd5YTN1bDI1
swavydre20,2024-10-04 17:49:21,@ke_yhw I dont even care that people dont believe in evolution but if you dont and believe god its just pathetic to me because science at least tries to give you correct information religion is just ignorant and somewhat arrogant in a sense for believing higher life forms care about you but not others that see your way and other life forms humans step on daily.,https://www.instagram.com/reel/C5i-ludtRUa/?igsh=b3A3Ynd5YTN1bDI1
ke_yhw,2024-10-04 17:18:32,"@swavydre20 ,no thing has changed.. coincidence never possible.. monkey remains monkey .. .",https://www.instagram.com/reel/C5i-ludtRUa/?igsh=b3A3Ynd5YTN1bDI1
swavydre20,2024-10-04 14:57:40,@ke_yhw how do you explain how all different life forms change over all the years life has been present on earth ?? And if you say god you wont ever be taken seriously because that is nothing but a lazy theory with nothing to even back it one percent.,https://www.instagram.com/reel/C5i-ludtRUa/?igsh=b3A3Ynd5YTN1bDI1
talkciscity,2024-10-04 12:11:27,You have to admire his confidence when he lies with such enthusiasm,https://www.instagram.com/reel/C5i-ludtRUa/?igsh=b3A3Ynd5YTN1bDI1
sanoconamor,2024-10-04 00:55:39,"What if... Those particles exist and dont exist at the same time, what if those particles are creating constantly parallel universes and at the same time disassociating of this one there for moving between existence and no existence. We cant see them because we are not turned to that vibration, bit if you make it vibrate in these dimension you will be able to perceive it.",https://www.instagram.com/reel/C5i-ludtRUa/?igsh=b3A3Ynd5YTN1bDI1
thanosmik,2024-09-04 17:36:56,ether,https://www.instagram.com/reel/C5i-ludtRUa/?igsh=b3A3Ynd5YTN1bDI1
shortye30,2024-09-04 17:17:55,Its consciousness,https://www.instagram.com/reel/C5i-ludtRUa/?igsh=b3A3Ynd5YTN1bDI1
scihum,2024-04-16 05:27:58,"@hill.song12345 I am the result of billions of years of evolution. So are you. There was no first man. We evolved as a species from earlier species. The idea that we are made in the image of some imaginary deity is ludicrous. In my opinion, just accepting the beliefs of ignorant men who lived thousands of years ago is silly. I will never do that. The only way to understand reality is through evidence and rational thought tempered by humility and kindness.",https://www.instagram.com/reel/C5i-ludtRUa/?igsh=b3A3Ynd5YTN1bDI1
hill.song12345,2024-04-15 11:34:10,"@alexander.the.mediocre no he means consciousness . If you are asleep or on drugs  none of it exists. The sky and land is only real in your mind. Wow- life is a mental alertness . If we dont get to be  born human, nothing else will know that planets are really there. Its just us that know and can have ability to see it. Us- who are made in  a super spirits  image. We are the alpha of the world.",https://www.instagram.com/reel/C5i-ludtRUa/?igsh=b3A3Ynd5YTN1bDI1
hill.song12345,2024-04-15 11:23:44,@scihum where did you as a sperm come from? The dna of man. Man made in gods image. If you want to know where god came from then tell me where you came from?  Where did the first man come from?? God is real and way too intricate for mans calculations and mental understanding- just accept.,https://www.instagram.com/reel/C5i-ludtRUa/?igsh=b3A3Ynd5YTN1bDI1
shawnf_71,2024-04-15 04:23:11,What's odd is that we can see galaxies that appear to be devoid of dark matter,https://www.instagram.com/reel/C5i-ludtRUa/?igsh=b3A3Ynd5YTN1bDI1
itsjudemydude_,2024-04-13 19:52:59,@talkciscity he ADMITS its conjecture. what are you yappin about lmao,https://www.instagram.com/reel/C5i-ludtRUa/?igsh=b3A3Ynd5YTN1bDI1
itsjudemydude_,2024-04-13 19:51:58,"@ke_yhw this isnt even ABOUT biological evolution, but since you brought it up, evolution by natural selection is indeed a fact",https://www.instagram.com/reel/C5i-ludtRUa/?igsh=b3A3Ynd5YTN1bDI1
reush,2024-04-13 14:17:19,"Lmao you cant be serious. Loving? Also, you clearly dont under what a scientific theory is. Theres zero evidence for a god (of the thousands that have been created by the human imagination). There is however, plenty of evidence to back up what this man is saying. Youre part of a cult",https://www.instagram.com/reel/C5i-ludtRUa/?igsh=b3A3Ynd5YTN1bDI1
scihum,2024-04-13 03:10:54,And where did your god come from?,https://www.instagram.com/reel/C5i-ludtRUa/?igsh=b3A3Ynd5YTN1bDI1
manedfrmda80,2024-12-04 12:09:00,Wtf is he saying how can he take percentage of something infinite,https://www.instagram.com/reel/C4Ba8XUqkuO/?igsh=cmh0b2g0NGVuZGxi
entahla170,2024-12-04 08:57:54,@will_ow_the_wisp_ hes physicists,https://www.instagram.com/reel/C4Ba8XUqkuO/?igsh=cmh0b2g0NGVuZGxi
asjustas_simple,2024-11-04 15:16:23,thanks lord...my teacher said us everything is made up of matter,https://www.instagram.com/reel/C4Ba8XUqkuO/?igsh=cmh0b2g0NGVuZGxi
spacy_astro,2024-11-04 12:37:52,@the_rahul_kumaran9624_ ok I'll give it a try,https://www.instagram.com/reel/C4Ba8XUqkuO/?igsh=cmh0b2g0NGVuZGxi
helixsoraisham,2024-11-04 12:07:51,What is dark matter,https://www.instagram.com/reel/C4Ba8XUqkuO/?igsh=cmh0b2g0NGVuZGxi
