Exported by,ExportComments.com,,,,,,,
75,,@voiceofkanaan2572,06/03/24 20:58:48,0,no,no,"Dark matter is basically what the Allah described in the Quran in verse (25:45). We constantly describe reality around us according to our own eyes, but this is flawed understanding because God was, is the only eternal entity there is and anything else including the darkness of space, and shadows are created  from nothing, which is what creating means. Meaning the shadows we see, the darkness that is in space were not originally there and ""not eternal"" to begin with. Therefore we cannot say the space and darkness is nothing and we cannot say it is being created ""by"" nothing rather ""from"" nothing.

This verse about the reality of shadows God exactly mentioned after talking about how people depend solely on their minds to be guided about the meaning of life to tell you that, just like the empirically untouchable shadows, your thought process is also invisible to you but it is still a non-eternal thing that was created and unless you follow the word of God which is revealed to humans by prophets completely as is and unchanged ""the pure word of the lord"", you cannot be guided. 

Bottom line is, you cannot depend on a created thing to be guided to the uncreated ""God"" because you will constantly fall victim to the whims of the relativity of the human mind. (just like they though that the shadow is the absence of light when darkness is really a created thing that covers everything and expands and contracts in synchrony with light). Come to God and read the Quran, the only true book left unchanged from all the previous messages.",view comment
76,,@ChaakarKhosa,06/03/24 21:13:59,0,no,no,Dark matter are our thoughts.,view comment
77,,@Healing556,07/03/24 11:52:08,0,no,no,"Out there ?
Could reach here ?",view comment
78,,@InfamousX1000,07/03/24 20:48:36,1,no,no,"My guess is that our universe exists in multi dimensional space and dark matter is simply entire universes we cannot interact with, existing in an interdimensional plane that is both inside and outside our universe",view comment
79,,@alisoncleeton877,18/03/24 22:33:32,0,no,no,"Maybe the dark matter and energy is the other dimensions that we can't see; like other pages in a book. When you look at the book you can see that there is no such thing as time as all the pages in the book are happening at once. The end is linear but what if it also exists on the x ,y and z or more axies?",view comment
80,,@epiphany-bk4yg,20/03/24 19:31:10,0,no,no,??,view comment
81,,@dylanx9327,20/03/24 21:44:17,0,no,no,"dark mater hoax? ....look for article: Standard model debunked? Scientists say dark matter is impossible, never existed - study",view comment
82,,@kermitthefrogkermy5988,21/03/24 22:39:41,0,no,no,Hopefully I can be one of the first people to see it’s true discovery,view comment
83,,@joannawhite1841,24/03/24 00:32:13,0,no,no,And there a lot of apes with smartphones.,view comment
84,,@geekynewz,28/03/24 04:40:20,0,no,no,"""Apes with smartphones"" - you got yourself a new subscriber! lmao",view comment
85,,@grigorovnikola7757,28/03/24 15:52:07,0,no,no,"""Black matter"" only exists in someone's brain.  Therefore, only ""genius"" people receive awards for claims in which they openly claim to know nothing.  It is known by Mr. ""E"".",view comment
86,,@dusandusoleil,28/03/24 22:51:20,0,no,no,"The measurements taken are totally wrong. The properties of the space trapped in galaxies and the space outside them are significantly different. How naive do you have to be to attribute a property you don't know to a property of ""something"" you know in order to balance the equation.",view comment
87,,@jamsedkhan,29/03/24 08:54:34,1,no,no,Let the mystery be mystery ??,view comment
88,,@manuthperera2893,29/03/24 10:57:53,0,no,no,there's a lot that we don't know we don't know,view comment
89,,@ZoraXire,29/03/24 21:57:11,3,no,no,"some people get scared about the concept of these forces, but I find it extremely exciting! To know something is out there but we don't know what yet, yet we know its the most powerful energy yet known and is causing the universe to expand more and more is just amazing! Truly as close to the power of gods we might have found yet!",view comment
90,,@WeWillRockYou-vw2xk,29/03/24 23:35:03,0,no,no,"There's dark energy, dark matter and doesnt matter.",view comment
91,,@RyouShi98,30/03/24 13:36:34,0,no,no,"Upon closer inspection, scientists have determined that all dark matter is emitted from a giant bloody eyeball",view comment
92,,@kennyc3670,02/04/24 09:05:59,0,no,no,They are just phenomena dreamed up by physicists because they don't know what's really happening - they're in the dark.,view comment
93,,@GamerBhoid,02/04/24 11:43:03,2,no,no,Uhh No comments from 2024 is famous here.. So make this the one..,view comment
94,,@Dabble_D,02/04/24 19:05:58,0,no,no,It‘s definitely the 4D-Trolls that interact with our universe und cause space-time-curvature wich leads to gravitation.,view comment
95,,@TheDanBidondiShow,04/04/24 03:32:33,0,no,no,The numbers are off being no one knows how big the universe is and everything in it.,view comment
96,,@TheDanBidondiShow,04/04/24 03:38:18,0,no,no,"5:45 ""we're apes with smartphones"".  Speak for yourself, I'm a child of God not from an animal.",view comment
97,,@JustMe-ob3nw,08/04/24 17:28:53,0,no,no,"Most of those are, like he said,  just ‘ideas’ we have no clue about most of it…",view comment
98,,@ShaharLevy,10/04/24 20:16:22,0,no,no,1:37 did you say energy instead of matter?,view comment
99,,@mencken8,14/04/24 11:51:02,0,no,no,"This video is best understood by reviewing the confusion in the 19th century that had physicists positing a “luminiferous ether,” which required waiting for Einstein to come along and clarify matters. Well, here we are again, contemplating intellectual placeholders that signify we are once again confused about what the universe is up to.",view comment
100,,@amitchauhan7144,17/04/24 08:07:59,0,no,no,Ca student is also watching,view comment
,,,,,,,,
