Exported by,ExportComments.com,,,,,,,
Source URL,https://www.youtube.com/watch?v=GFxPMMkhHuA&pp=ygULZGFyayBtYXR0ZXI%3D,,,,,,,
Timezone,,,,,,,,
,,,,,,,,
Some Comments may not appear here because of their privacy settings,,,,,,,,
,,,,,,,,
,,Name (click to view profile),Date,Likes,isHearted,isPinned,Comment,(view source)
1,,@74wrighty,31/03/21 02:45:10,0,no,no,Light can not pull light or bend it.,view comment
2,,@mohamedselim6547,07/04/21 12:25:35,0,no,no,"Thank you for the video, 
I was trying to prove how the measurement of time is inaccurate, then the second's duration ""value"", human created, is the unit for time, and creating a 24 hours for a day, haven't humanity created those, then why do we have a leap year?!; what does it mean?; is the day 24 hours?, is the year 365?, is it not?, not always!; Then the calculations are not right... whether not to combine date and time or to come up with a more rigid scheme, I think the solution should be.
but to stick to what we came up with, and insist it's correct, and try to find the workarounds to keep the system we created earlier running.
I don't get it, yes we had some knowledge and it's really great. 
But... we know more/better now, We can create a better application to what we experience, time wise, I suppose.
How many calendars do we have in the world?, and why?
One is based on the moon, and one is based on the sun.
is there one that uses/based on both?
sun for the days, and the moon for months? for example
I am not saying what we came up with is not good, but the application of this scheme has some problems, I see are not few, and yes, there were workarounds for finding solutions, but why to have problems in the first place.
We can create a bitter way in measuring time.",view comment
3,,@paulwolf3302,09/04/21 12:52:46,0,no,no,"It's because the strong equivalence principle, one of Einstein's assumptions in GR, just doesn't match the measurements.  The gravitational pull of other galaxies explains their shapes, and can't be ignored.  See Chae's paper on Testing the Strong Equivalence Principle, widely available on the web.",view comment
4,,@jameso1447,11/05/21 14:58:50,0,no,no,"Dark matter moving? That's really funny. Dark matter theory doesn't work so very much that it has to be moving, too. Matter that doesn't react to anything is moving... This religion doesn't make much sense.",view comment
5,,@Sophiedorian0535,12/05/21 02:28:06,4,no,no,“You can see why this is my favourite experiment: it’s pretty exciting.” What a teacher!,view comment
6,,@ronaldsanchez1341,14/05/21 01:03:30,0,no,no,"We have learned and deciphered everything we always wanted to know about the beginning of our universe and now we are looking for dark matter which , I clearly have discovered,  resides within our skulls or within our ears as cerumen! E=God+mc^2...",view comment
7,,@jeremymiller9582,16/05/21 06:50:25,0,no,no,Wow. He really went after that French. :),view comment
8,,@Yxzjvc,28/05/21 23:53:49,0,no,no,We only need one force to explain pretty much everything what dark matter is doing: electromagnetism,view comment
9,,@manjsher3094,30/05/21 02:39:51,0,no,no,He's no Brian Cox,view comment
10,,@onderozenc4470,07/06/21 01:32:48,0,no,no,"Sir, what you are referring as the particles coming in from one direction must be the neutrinos whereas the dark matter form the fundamental blocks of the elementary particles such as quarks undergoing vacuum decays inside black holes.",view comment
11,,@tanjanichole5593,22/06/21 08:32:32,0,no,no,"The psychedelic flare dimensionally hook because interactive aditionally share notwithstanding a illegal flood. dramatic, awful larch",view comment
12,,@FalkFlak,04/07/21 21:56:45,0,no,no,"the example of modeling economics was an eye opener. You can have a solution/approximation without knowing whats actually going on.
That was very humble. In contrast, when listening to other science presenters talking about dark matter and ""stuff"" you sometimes get the impression they want you to think they figured it all out.",view comment
13,,@StephensEFRC,10/07/21 16:51:37,0,no,no,"SUSY ""scientists"" claim experiments are no longer needed. Math is all that's needed. Right.",view comment
14,,@StephensEFRC,10/07/21 16:54:21,0,no,no,"He should have been a comedian. Oh, wait ...",view comment
15,,@TheKrazyLobster,10/07/21 23:18:09,0,no,no,Where's the Q&A section?,view comment
16,,@karlamay_,13/08/21 04:33:33,2,no,no,"I enjoyed it so much that I didn't realize he spoke for 54 minutes. He delivers well and his jokes amazing! I feel like I understand but know nothing at all! I could listen to him all day and still not get bored. Most teachers should be like him, I mean, there are still wonderful teachers but most of them don't know how to teach and are only there for your grades. Lessons should be fun and interesting just like this, not boring reiteration of the books. Wish I could see him lecture in person. More power to you Professor!",view comment
17,,@Robin-vz1ib,21/08/21 21:10:49,0,no,no,Samsung calculator can do that,view comment
18,,@bothewolf3466,29/08/21 22:33:17,0,no,no,"Is he on coke?  Calm down, address your ENTIRE audiance, not just children.  I could not get through minute 12.",view comment
19,,@susanhawkins5914,01/09/21 15:47:32,0,no,no,"?????? thanks for making a vague, mystifying subject (to me) just that little bit clearer. Terrific delivery - I was totally engaged throughout. And yes, the English accent and well versed, animated  delivery made it all the more enjoyable. Back in my day during school physics lessons half of this subject matter wasn’t even a consideration!",view comment
20,,@robertflynn6686,11/09/21 06:49:03,0,no,no,Whats really strange is that ?? we don't know where we are in the universe or where were going??? Like the double periodic pendulum..an elliptic function. In this model no center of this functional motion is a hole of no gravity. A black hole. So dark matter does this to elliptically oscillate between matter and antimatter its quarks that is.,view comment
21,,@James.M.S,19/09/21 08:23:52,0,no,no,Sounds alot like David tong,view comment
22,,@terrymcnee3568,19/09/21 22:20:42,1,no,no,A man who is such a good teacher for children is a brilliant teacher for us adults too    Thanks,view comment
23,,@debasishraychawdhuri,29/09/21 17:39:52,0,no,no,"Asks the audience: Do you believe in fairies? 
The audience: Yes.
Shows why scientists believe in dark matter and then
Asks the audience: Do you believe in dark matter? 
The audience: Yes.
Well, that was unexpected.",view comment
24,,@debasishraychawdhuri,29/09/21 18:12:41,0,no,no,I think what the last graph really tells us is that the physicists can be really really wrong about the dark matter thing and can still make a prediction of the formation of the galaxy that looks correct.,view comment
25,,@edgeeffect,03/10/21 11:06:36,0,no,no,I didn't expect a cod french accent from the RI.... but unpredictability is the topic here.,view comment
26,,@edgeeffect,03/10/21 11:11:46,0,no,no,"I love all the trolls in the audience yelling ""yeeeees"". :)",view comment
27,,@Geezerrrrrr,04/10/21 07:57:46,1,no,no,I would love to hear this spoken by anyone else,view comment
28,,@tedburke8187,10/10/21 12:54:13,0,no,no,The Universe is electric. It follows giant Birkeland current and magnetic fields,view comment
29,,@timothy8426,24/10/21 19:06:37,0,no,no,"Stability is unpredictable. Frequencies are the scale of everything. Vibrate it, into where it fits, till you have substance. Matter/energy are forge from frequencies.",view comment
30,,@jamesbailey5008,02/11/21 09:52:36,0,no,no,Almost switched off at the French accent.. but he grew on me..  haha,view comment
31,,@butter5144,04/11/21 23:33:40,0,no,no,????????,view comment
32,,@vgrof2315,13/11/21 14:09:02,0,no,no,Thank you.,view comment
33,,@wailinburnin,17/11/21 17:42:34,1,no,no,"Comments on the presentation - seemed silly to some - but his delivery was totally chaotic, it was brilliant to his point.  Bravo. Even ended with a jab at injustice with the economy bit (like a super clever anarchist, right there on Faraday’s desk!) subtlety indoctrinating your kids.  Brilliant performance, guy’s a total genius!",view comment
34,,@barbaraspangenberg6400,19/11/21 13:51:04,0,no,no,"If (only hypothetically) the gravity of an object without any neighbors was stronger in the infinity than stated by Newtons law (""Newtonian limit"", asymptotically flat space in General Relativity)
wouldn't we then experience nevertheless Newton's law (lim A = lim B = 1, asymptotically flat spacetime) in the solar system as we are moving in free fall around the center of the galaxy like a child on a trampoline experiences Minkowski space (without any forces) shortly?",view comment
35,,@gilbertozuniga8063,29/11/21 14:21:09,0,no,no,He spoke a lot but didn’t say much,view comment
36,,@robertkemper8835,29/11/21 18:06:17,0,no,no,What does modified gravity tell us about the nature of spacetime to which gravity is intimately linked?,view comment
37,,@drizer4real,24/12/21 11:43:40,0,no,no,Okay great talk but the way he portrayed the French Henry Poincare was boarderline racist. For the same reason Apu no longer appears in the Simpsons. He watched a little bit too much Allo Allo??,view comment
38,,@you8164tube,26/12/21 04:20:37,0,no,no,"Confucius said, there are critical theories behind trivial things.  ??? ??????",view comment
39,,@JackJColl,11/01/22 09:46:05,0,no,no,bad comedian and its distracting,view comment
40,,@BGTats144,25/01/22 20:14:21,0,no,no,Yeah if dark matter causes gravity flat earthers don't think it's real FML,view comment
41,,@zoozolplexOne,26/01/22 23:31:13,0,no,no,cool!!!,view comment
42,,@JD_Mortal,28/01/22 23:07:22,0,no,no,"For every ""solar system"", there is, through logical modeling... about 9-10 non-solar systems. Planets that are in orbit around giant sun-like masses that have no highly radioactive atmospheres. They may not even have hydrogen in them. You can't see them, because they have no emissions we can see and nothing is close enough to reflect on them and they are so relatively small that any light behind them would not be cast-out by them. (It may even be bending light around them, making them even harder to detect, as other massive bodies do.)

I do with they would stop using the word ""gravity"" and start using the correct term ""mass attraction"". Gravity is specific to earth and ONLY earth, as an average. It is then applied, horribly, to other bodies of unknown masses, to estimate masses, to estimate mass attractions, which is, as he stated, off by a factor of about 5x. (So we make-up ""dark matter"", to compensate for our horrible miscalculations.) A theory of a theory of a theory of a theory is 100% science-fiction, or just fiction, for short. Any relation to reality is purely coincidence or an inevitable product of fiction, created from non-fiction.",view comment
43,,@lachezarkrastev7123,03/02/22 09:52:46,0,no,no,The light does not get pulled you idiot - it is traveling in the curved space ... ahhh,view comment
44,,@MichaelMonterey,13/02/22 01:48:12,0,no,no,"Right! ""Dark"" matter/energy is an excuse for ignoring reality. It's not 'dark' empty, impossible space, nothingness. It's transparent & invisible because it's hyper-luminal hyper-frequency energy we may as well call hyper-plasma, because its fluidic nature is self-evident (via radio-astronomy, etc.).",view comment
45,,@wardelllindsay8677,14/02/22 04:12:15,0,no,no,"Dark Matter is fiction!  The rotation is    rotation is torque F×R is magnitude.
This torque is about 3 times Gravity
Two, rotation is Motor rotation due to electric rotation! Faraday made the first motor,This Black Matter !
Black Matter is the electron flows into Galaxies!
Cosmologists seem to ignore electron flows throughout the Universe!",view comment
46,,@zweisteinya,21/02/22 18:34:04,0,no,no,Too bad darkmatter is only an artifact of bad physics--such a sensational way to monetize your fascist 'education',view comment
47,,@koori3085,05/03/22 05:59:25,0,no,no,"Considering a gamma ray burst could come from ot of nowhere, obliterate us, and keep on going for nearly eternity, we can't really predict anything in the future with absolute certainty, except that death is inevitable.",view comment
48,,@peterdziuk5662,08/03/22 01:30:16,0,no,no,There seems to be a big limitation in knowledge of what is beyond the edge of our known Universe - if we knew that...,view comment
49,,@Jmiyamae1,24/03/22 14:50:34,0,no,no,I entered the numbers into my calculator and the numbers came up correctly...,view comment
50,,@bigcountry5520,08/04/22 04:27:49,1,no,no,"it would be difficult to say whether we can feel dark matter, or not, because we've always been subjected to it, so the true experiment would be to figure out how to block dark matter, and then ask that question.",view comment
51,,@bigcountry5520,08/04/22 04:42:59,0,no,no,"Dark energy is micro-conservation of energy.  Frictionless particles, will keep moving.",view comment
52,,@albertswift1490,19/04/22 02:07:29,0,no,no,where is the phone cabin ?,view comment
53,,@Gizemci77,19/04/22 14:04:41,0,no,no,"dark matter is 4 element
earth water air fire",view comment
54,,@fluentpiffle,03/05/22 11:21:00,0,no,no,"""History abundantly shows that people's views of the universe are bound up with their views of themselves and of their society. The debate in cosmology has implications far beyond the realm of science, for it is a question of how truth is known. How these questions are answered will shape not only the history of science, but the history of humanity."" (Eric Lerner, 1992)

spaceandmotion",view comment
55,,@oliverwashbrook8834,22/05/22 18:10:40,0,no,no,Awesome,view comment
56,,@julianbassk,21/07/22 15:31:18,0,no,no,"Great lecture. Sometimes with the kid-geared RI lectures, it doesnt hold my interest. But this weaved together dark matter, chaos theory, and even economics in ways i never expected. Kudos! Also i thought it was pretty hilarious",view comment
57,,@Tysto,04/08/22 02:22:11,0,no,no,"We figured put how to get good wireless audio decades ago, but people keep inventing new ways to get bad audio.",view comment
58,,@johnmanno2052,05/08/22 03:51:37,0,no,no,"Pity. There's a good lecture somewhere in there. Alas 

Oh well. Maybe Sabine Hossenfelder will have a better summary.",view comment
59,,@sharonmarsh3728,06/08/22 04:37:58,0,no,no,Dark Energy: God's Finger pulling on the blind string ring.  Exodus 8:19 and Exodus 31:18.,view comment
60,,@sharonmarsh3728,06/08/22 04:52:53,0,no,no,What is the difference between Dark Matter Particles and Nuetrinos?,view comment
61,,@dasuniversum5875,26/08/22 22:04:56,0,no,no,meddl loide,view comment
62,,@skronked,23/09/22 02:49:52,0,no,no,This dude is a fop. A first class Louisianian major league fop!,view comment
63,,@dgnash,27/11/22 19:27:45,0,no,no,Or you've got it all completely wrong.,view comment
64,,@Fhabdhxi,15/12/22 21:20:12,0,no,no,this guys funny and smart,view comment
65,,@jefferyforkum380,03/01/23 00:47:12,0,no,no,"If the space is curved and gravity as we observe is only matter moving in the direction that offers least resistance, then gravity has two factors. Like water leaving a funnel, the water exits into the unconfined space past the spout opening, but also is pushed by the pressure of water behind it. Matter will move in the direction of greater space, (least resistance) but also is pushed by the less space it is exiting from. Stars at the furthest distance in the spiral arm of a galaxy are moving into a greater space at the black hole equator, but also pushed from the less space they are moving away from. There is no need for dark matter if gravity can be understood better.",view comment
66,,@violentinstincts,07/01/23 13:31:32,0,no,no,"ah yes, middle-school physics.",view comment
67,,@pavelsmith2267,11/01/23 14:55:22,0,no,no,"As we look into progress; we are heading forward. To where? A specific point in the horizon is commonly used as a failsafe.
Why the Universe appears simple before our technological gaze. Oil,the fuel for all technology (or most). So now; oil extracts are widely used also as in pairs with rudimentary oil functions. Extraction is an extension, a reduction and a precise method  of testing. We are paired with our lives and our technology. The Universe is and always will be totally strange. Not enough for you? Too bad, really.",view comment
68,,@pavelsmith2267,11/01/23 14:59:31,0,no,no,"Economics, politics and technological advances. The fixed, or specific, point on our geopolitical rhythm is out of view. No line of sight for us. With the sole exception of ""space travel"". The problem is circular. With no fixes point of reference we are taking the risk of traveling in circles, rather endlessly.",view comment
69,,@pavelsmith2267,11/01/23 15:02:15,0,no,no,"The term social media is translatable, in the physical world, to the border of an Old World sextant. Our New World (new age) compass is currently in the Off Position. With a functional new age compass, technological advances may be allowed to continue. However without the compass in working order; technological failure is doomed to repeat.",view comment
70,,@pavelsmith2267,11/01/23 15:03:42,0,no,no,In other words; the new age is an extinction level event. Without proper social media utilities; climate change turns into Global Warming.,view comment
71,,@pavelsmith2267,11/01/23 15:07:34,0,no,no,"So, without complaint; feasible galactic exploration as compared to feasible global economy. We are failing at both. Pity the humans. So sad, it's truly pathetic. We don't have a working knowledge of global market. Same as we do not have a functional world wide economy.
Any series of fiscal reports will do however. That's my global economy, my worldly marketplace.",view comment
72,,@pavelsmith2267,11/01/23 15:10:41,0,no,no,"Investment in galactic exploration.
Investment in marketplace.
Both devoid of realistic approach to success.
People lose money on the market all the time. People lose energy on galactic exploration all the time. Why? Due to erstwhile investment, of course!",view comment
73,,@pavelsmith2267,11/01/23 15:13:42,0,no,no,"i-phones and market awareness, an unsafe combination.
However. Android platforms and market awareness is safe. The cyber system contains many hazards. So let the hazardous path alone. The droid systems is a suit, basically complete. Comparably the i-phone once open cannot be closed. Only turned into off position. This a requirement.",view comment
74,,@pavelsmith2267,11/01/23 15:16:58,0,no,no,"Or we could openly discuss the hypersonic element, Francium. Denoted as having a worth of one billion dollar per gram. Albeit none has ever been gathered.",view comment
75,,@pavelsmith2267,11/01/23 15:21:50,0,no,no,"***
The computational process requires and utilizes a single 10,0000th of our brain power. Per every 100 computers the exponential decimal begins to revolve around the computational core.",view comment
76,,@pavelsmith2267,11/01/23 15:23:08,0,no,no,That's ten thousandth power you see there,view comment
77,,@pavelsmith2267,11/01/23 15:24:44,0,no,no,"Roughly put into real time profile.
Artificial Intelligence requires double the power draw. Considering, anywhere between ten thousandth and one  thousandth per usage.",view comment
78,,@pavelsmith2267,11/01/23 15:25:48,0,no,no,"Again:
iPhone opened Pandora Box.
Droid is casement system.
Power usage applies , hopefully, only outside casement setting.",view comment
79,,@CheatOnlyDeath,21/01/23 21:55:59,0,no,no,I didn't get far enough into that to decide if there was any science involved. On to something else.,view comment
80,,@peterbroderson6080,01/02/23 04:12:25,0,no,no,"The moment a particle is a wave; it has to be a conscious wave!  Gravity is the conscious attraction among waves to create the illusion of particles, and our experience-able Universe.      Max Planck states ""Consciousness is fundamental and matter is derived from Consciousness"". Life is the Infinite Consciousness, experiencing the Infinite Possibilities, Infinitely.           We are ""It"", experiencing our infinite possibilities in our finite moment. Our job is to make it interesting!",view comment
81,,@peterbroderson6080,01/02/23 04:22:30,0,no,no,"The interaction between non-particle now ""waves"" could be thought of as ""Dark-Matter""",view comment
82,,@martinwilliams9866,04/02/23 21:34:59,0,no,no,"I have come up with three alternative hypothesis to dark matter, which should rightly be called Dark Gravity, as matter causing the increase in gravity is presupposed.
1.Nested Gravity Wells, the Gravity well of our Galaxy exists within those of the Galactic cluster, supercluster, super super cluster, maybe more, as a singularity shows curved space-time can ""attract"" curved space-time.
2.Tufted Space-Time, the space-time within a Galaxy is negativity distorted as with a gravity well, the intergalactic space-time is positively distorted, because of Dark Energy, the curvature differential means that the effect of the negative gravity well is increased just as the differential of positive pressure below & negative pressure above an aeroplane wing increases the effect.
3.Relative Mass, because of Dark Energy the Galaxies are accelerating away from each other, they have an increase in their RELATIVE mass.",view comment
83,,@FrederickTheGrt,07/02/23 12:43:19,1,no,no,?? ?? ??,view comment
84,,@jameshughes7670,02/03/23 17:30:27,0,no,no,"I like this dude, he is astute and intelligent, he explains things well for a layman like me, but he needs to lay off the lame jokes (I liked the offended computer tho).",view comment
85,,@shodan6401,13/03/23 12:01:22,0,no,no,"Well, thankfully in the intervening years, we've learned that Dark Matter doesn't exist, so problem solved. It was made up anyway, so it should be easy to chuck it in the bin. Made up, just like Cosmic Inflation, Dark Energy, the Hubble Constant, Super Symmetry - and by the time we're done throwing away all of these completely made up, fanciful concepts, we all finally realize that the LCDM is not even a remotely accurate model that is incapable of making any predictions. Once we come to terms with this reality, we can build a model that describes what we see in observations. Won't that be a refreshing change?",view comment
86,,@Kyliebobbyisla,24/03/23 20:48:18,0,no,no,"I have just watched the Mass lecture by John Baggot and he wasn’t able to get any kind of response from the audience at all because he was just so …. ?????? … so to follow straight on to this guy teaching in such a fun, exciting and engaging way has had me taking in every word presented in a very understandable way. Thoroughly enjoyed this video. Some people in the comments need to try laughing therapy, it is very beneficial ??",view comment
87,,@Kyliebobbyisla,24/03/23 21:02:06,0,no,no,"Everyone throwing hate over his explanation of dark matter … this was 8 years ago and science is always changing based on new technology, findings, theories etc. This was true AT THE TIME, didn’t realise there were so many REAL LIFE SCIENTISTS in the comment’s section ????",view comment
88,,@bryandraughn9830,27/04/23 21:11:22,0,no,no,"You can't just not try to figure things out.
Cheers to the great thinkers!",view comment
89,,@papipapi8680,29/04/23 21:41:45,0,no,no,"So predictable.
And it's not even close to impossible.",view comment
90,,@victorvalar4656,05/06/23 20:32:36,0,no,no,"Bad cringy jokes, but keep trying eventually you'll get there",view comment
91,,@darwinlaluna3677,05/08/23 06:23:27,0,no,no,Hi,view comment
92,,@darwinlaluna3677,05/08/23 06:23:51,0,no,no,I see u,view comment
93,,@darwinlaluna3677,05/08/23 06:24:48,0,no,no,Hi kids,view comment
94,,@yanikkunitsin1466,15/08/23 01:42:03,0,no,no,"So imitating Chinese accent while making narrow eyes is deplorable, but trying to imitate French with all the usual stereotypes is O.K. with Royal Society? Hypocrites.",view comment
95,,@tayyabir5873,12/10/23 16:58:42,0,no,no,I like this scientist ?? give him a raise he's on the right side of that chart,view comment
96,,@lordphullautosear,02/11/23 20:40:51,0,no,no,"If Einstein showed that matter and energy are forms of the same thing, shouldn't dark matter and dark energy also be forms of the same thing?",view comment
97,,@ansfridaeyowulfsdottir8095,13/11/23 03:22:04,0,no,no,"The guy's an idiot.

{:o:O:}",view comment
98,,@andreasfehlau4965,03/12/23 20:00:08,0,no,no,I find it a bit peculiar that my five-dimensional physics has been around for over 30 years and no one is allowed to talk about it.,view comment
99,,@moogfooger,17/02/24 15:10:11,0,no,no,what a terrific lecture! Thank you so much. Cheers,view comment
