Exported by,ExportComments.com,,,,,,,
82,,@MrConstitutionDay,22/02/24 19:16:30,1,no,no,"Dark matter in small quantities starts the production of planets and stars. Entire stars made only of dark matter are rare. Nearly every star has a lot of dark matter at its center. Discovery of dark matter will be soon. 
It depends on the speed of space exploration and development.

The evidence of dark matter is overwhelming. Sadly the evidence for the standard model particle of dark matter is completely lacking. Here's the problem. Dark Matter has been around for far longer than standard model particles. Since they are so old and slow moving and neutral and massive they are not found just anywhere. In fact they tend to be found only at the centers of large massive objects like stars and planets and moons and the like. Otherwise, they are found in the halos of galaxies. The exception would seem to be large massive yet fragmented objects, such as the asteroid belt protoplanet between Mars and Jupiter. The masses of dark matter particles may well have several varieties from the least massive and youngest to the most massive and oldest. The least massive and youngest may well fall into the logarithmic scale proportional to that between Gravity and Electromagnetism. This is the hierarchical scale with Hadronic and Leptonic quarks at one end, the bottom end of this scale. This spans 10^36 in a scale proportional to the relative number of dimensions applying to this scale. Clearly there must be several dimensions in this scale. Approximately 7 dimensions seems to be the least massive divisision of this logarithmic scale that makes any sense. Applying a natural scale suggests that at minimum 1/18 of 36 or about 10^2 times as massive as quarks for the least massive initial stages or types of forms of dark matter, while 1/7 of 36 or about 10^5 or more times as massive as quarks for the most massive forms of the initial stages or types of dark matter. Consequentially, small quantities of this novel form of dark matter should be able to be detected, then found, isolated, formally discovered, transported, refined and manufactured. Obviously research and developments  in the asteroid  belt are going to be instrumental in this discovery. The slow pace of space exploration seems to mean that it's going to be a while before we get this discovery at long last. Of course, the future of dark matter doesn't really begin until its formal discovery, so we'll have to wait till then, whenever that may be.

part 2
Ok. So the Chrysanthemum or Mum, sometimes called the Mon when depicted in art,  can now be understood in terms of highly temporary but sometimes long lived quark models.
It is sometimes well established that early versions of the mum were constricted within 2 dimensions. They were strongly limited, apparently limited to about 21 petals, as predicted by Fibonnacci. However, in later Mon depictions, full blown 3 dimensional mums have been depicted and are apparently grown and are flourishing. These are much larger than previous 2 dimensional models.
In counterpart, quark models in the standard model have far exceeded the dark matter models contemplated. For instance, Charm quarks are over 600 times larger than standard Up quarks, and Bottom quarks are over 400 times bigger than standard Strange quarks.
In previous models of the Fibonacci model of quark expansion, the numbers (10^2 to 10^5) are well known and within the known potential of this dimension of dark matter.
We can expect this dimension of dark matter stable components within isolated dark matter, such as within isolated galactic halos. However, trapped dark matter components such as within stars, planets and moons may be decaying quickly, as exhibited by our own Moon, which has shut down and become locked in its gravitationally stabilized orbit, and the planets Mercury and perhaps even Mars, which apparently have also slowed down, and headed for stopping. This energetic model is shocking, and further dark matter and similar quark models, may be decaying or already gone, so the Mum/Mon model will be an important strategic exploration and investigation. 
I like the Chrysanthemum model for quarks anyway. It depicts the exponential growth of standard model quarks that we have already seen. However, I think we will see a plateauing of such quark expansions, I think the upper limit of further discoveries such as within the Cern Large Hadron Collider may be reached at about 10,000 times the mass of standard model Up quarks.
Spoiler Alert: There may be some new quarks within this range. However, some dimensions or ranges of dark matter quarks may already have expired and would only be available at galactic scales of discovery and investigation.
So dark matter research may still have local frontiers to discover, but may stall at this range. 
The good news is that we have an extremely long time to do this  research and discovery of standard model quarks before dark energy expansion catches up with us. 
Relax. It's cool.
I hope that you have enjoyed this Fibonacci mathematical Chrysanthemum experiment in both quarks and dark matter. 
Thank you for reading.
 

part 3

Ok. So we are now assuming the Fibonnacci based Chrysanthemum model of hyperdimensional dark matter and quarks. 
Or we still have sluggards or Luddites who can't keep up.
In this assumptive model, this structure suggests that such matter would be in the range of 10^5 to 10^8 times the mass of standard model quarks. For regular folks this is from 10,000 times to 100,000,000 times this mass.
That is really close to the neutron star category of matter.
While this may be amusing consider where this is going, the next phase of dark matter and as yet undiscovered quark masses would have to be in the range of 10^13 to 10^21, or 1,000,000,000,000 to 1,000,000,000,000,000,000,000 quark masses. Is this in the range of black holes yet? Or are we still stalled at very large neutron stars? Again we must pause and consider where we are.
The first stages of dark matter is from 10^2 to 10^3 masses, the 2nd stage would be from 10^3 to 10^5 masses, the 3rd stage would be from 10^5 to 10^8 masses, and the 4th stage would be from 10^8 masses to 10^13 masses. Whew. Theoretically the 5th stage of dark matter would be 10^13 to 10^21 masses. That still leaves us with the 6th stage of the mass of dark matter and quarks. This is the staggering number of 10^21 to 10^34 masses for quarks and dark matter. Wow. This is clearly the end of our Chrysanthemum dark matter models. It is also the end of our hierarchical mass models. What comes after the end of our Electromagnetism model? I dare not postulate. But I suspect outer space models of dark energy. This is the incredible range of from 10^34 to 10^55 masses, a gut wrenching number
 times the mass of standard  model quarks. 
This is the amount of masses that represents the beginning or the ending of the universe.
It's not just a black hole.
It's the end.
Sorry - not sorry.",view comment
83,,@kylebushnell2601,26/02/24 04:48:13,0,no,no,and seven months later more and more data has shown that this was nonsense,view comment
84,,@pgiando,27/02/24 22:20:46,1,no,no,There is no such thing as dark matter. There is fluctuations in the density of the  fabric of space time,view comment
85,,@oneukum,28/02/24 08:44:04,0,no,no,"Shouldn't we see whatever light is produced when Dark Matter annihilates? If Dark Matter does not block light, it cannot go into thermal equilibrium, can it? That would be more or less one frequency.",view comment
86,,@Brian-pz3wh,02/03/24 18:57:42,0,no,no,"Oh my...desperately clinging to your idiotic 'dark matter"" nonsense. Desperate to maintain your ego centric views. sad. Science really isn't science when your ego drives the ""results"".",view comment
87,,@gabebrauer8299,02/03/24 19:28:22,0,no,no,So these dark stars are a kind of alternate quasi stars?,view comment
88,,@VegaHawk769,10/03/24 15:29:28,0,no,no,My thought not saying that it is a thing my thought is that dark matter is normal gravitational matter coming from other dimensional spaces on the idea that there are more than just the 3 space dimensions that we experience 17:58,view comment
89,,@zpetar,10/03/24 20:20:11,0,no,no,Only 100 years ago humans were thinking Milky way is only galaxy. Before Hubble telescope we had no idea there is so many galaxies in universe. That's less than 50 years ago.,view comment
90,,@Khannea,17/03/24 21:05:09,0,no,no,"Question - two black holes merge, and emit an insane amount of  gravitational energy. 
Not far away orbits a Neutron star not that far removed in mass from becoming a black hole. 
How likely is that gravitational energy as a blob of mass is absorbed (???) into the neutron star and in effect is pushed into becoming a black hole.
How the heck would this work????",view comment
91,,@leeg8461,06/04/24 05:09:11,0,no,no,"Well, if you can see them, they aren't dark, are they.",view comment
92,,@spamfilter32,07/04/24 22:53:42,0,no,no,"If these are Dark Stars, could the massive gravity of them allow us to see galaxies beyond the limit of the observable universe through gravitational lensing?",view comment
93,,@aaronmicalowe,08/04/24 14:43:48,0,no,no,"The detection of distant constellations,
Has generated considerable consternations.
Cause the star we thought was dark matter,
Was just a phenomenon accreting space glitter.",view comment
94,,@josephcowley1045,12/04/24 07:51:40,0,no,no,"A week ago we kept hearing that JWST was getting scientists to rethink their thoughts about the existence of Dark matter. Now ya trying to say it might have indirect evidence for dark matter.
I still don't believe in dark matter. The equations didn't balance they found a figures that balances the equation and called them dark matter and dark energy. Make a better equation..",view comment
95,,@tsmith906,13/04/24 04:55:30,0,no,no,"This is far too many assumptions than im comfortable with, and I'm a bit of an ancient astronaut theorist lol",view comment
96,,@derrick211000,13/04/24 17:45:28,0,no,no,"makes sense the early universe was hot and more dense. Perhaps the perfect environment for dark matter to form stars, but the universe may be too spread out now for us to see this ever again.",view comment
97,,@TheJediRyguy,14/04/24 01:49:00,0,no,no,I love love love this channel! The way complex information is explained and presented as brilliant. Also Dr O'Dowd's accent makes it sound like you sang the James Wood telescope? makes me smile everytime. On top of the fact that he'd brilliant.,view comment
98,,@SeanParker-qs3ys,15/04/24 01:56:35,0,no,no,Is this live comments?,view comment
99,,@vilehans9665,15/04/24 08:48:48,0,no,no,I can’t imagine any AI with better narrative skills as those of Matt. Always exiting explanations about everything what science doesn’t know yet but maybe some day it will be the truth,view comment
100,,@JustNow42,15/04/24 09:04:06,0,no,no,"When they say that stars and galaxies  have grown too fast, they miscalculated the  material density in the early univers.  Our univers is say 10 times larger ( linear measure) than the early univers so that make the material density 10x10x10 =1000 times denser in the early  univers than it is now.",view comment
,,,,,,,,
