Exported by,ExportComments.com,,,,,,,
Source URL,https://www.youtube.com/watch?v=zUhOL38346Y&pp=ygULZGFyayBtYXR0ZXI%3D,,,,,,,
Timezone,,,,,,,,
,,,,,,,,
Some Comments may not appear here because of their privacy settings,,,,,,,,
,,,,,,,,
,,Name (click to view profile),Date,Likes,isHearted,isPinned,Comment,(view source)
1,,@michaelmichael2879,27/10/23 20:20:20,0,no,no,"Dark stars are the centers of galaxies clouds... 
see Jacob Lorber... 
first were the prophets... only later the science men...
It is said that dark stars are the centers of all centers... 
Everything goes around them...",view comment
2,,@ocoolwow,28/10/23 17:22:43,0,no,no,"Lol no, no they didnt jesus this channel is going more and more down the pop science route. Sad to see a channel that was once truly devoted to science is now even entertaining garbage science. Disappointing.",view comment
3,,@klosnj11,30/10/23 16:57:55,0,no,no,"Quick question; if dark matter particles annihilate, and those particles dont interact with te electromagnetic spectrum, is the engery emitted light? Or some other form of energy?",view comment
4,,@joshuabradshaw5270,01/11/23 05:48:50,0,no,no,"What if dark matter generation is a function of time. Since gravity is an acceleration, and dark matter is derived from a concentration of mass, the function of time is the only variable.",view comment
5,,@NoIdeaBrother,07/11/23 11:27:34,0,no,no,Does gravitational lensing accelerates or decelerates the photons from distant stars?,view comment
6,,@matthewrosenthal4688,07/11/23 23:25:22,0,no,no,"It seems like this is what the center of galaxies is, not black holes.",view comment
7,,@Tyler-2839,11/11/23 09:20:19,0,no,no,God guys what even is this place that we live in? All the creatures of the earth that saw these pretty dots in the sky at night could not have guessed how weird they truly were.,view comment
8,,@tiagovc139,14/11/23 03:43:37,0,no,no,"Ok astrophysicists, I need a theory of “space dragons on the far side of the universe” on my desk by december. Hurry, we have a nobel prize to claim!",view comment
9,,@Hibsclass,16/11/23 02:25:46,0,no,no,"Maybe I'm asking a silly question but.. How much hydrogen was available at the start of the universe? How was it formed? Is this hydrogen still available?

Secondly... Everytime I hear you give a new explanation for dark matter, it becomes clearer that we still really don't know too much. The amount of stretching/twisting needed to make these hypotheses makes them less and less believable.  Though I probably thought the same in the first years of quantum theories...",view comment
10,,@hudsonbakke8836,21/11/23 04:41:44,0,no,no,"In my opinion, as someone who isn't a physicist but just someone who studies and appreciates physics, what we call ""dark matter"" isn't a thing at all. It's a name we give to something that can account for the errors in our calculations based on the relativistic model of the universe. It could be a real, physical substance, however I personally think it's far more likely that ""dark matter"" simply arises in our calculations due to a fundamental incompleteness in our mathematical model of gravity. This is exactly what lead to the development of general relativity in the first place—for centuries people used Newton's law of gravitation because it was perfect at describing gravitation at a small scale, however as people began peering more and more into the cosmos, and trying to use Newton's law to predict the motion of celestial bodies, they began to realize that there was always a small but significant error in their calculations, and that's when Einstein created general relativity as a mathematical framework to correct for that error and make better predictions about the motion of planets and stars. I think what we are discovering with ""dark matter"" is the same thing that Einstein discovered when analyzing the orbit of Mercury. The current mathematical model we have is really really good, practically indistinguishable from perfect for predictions on the scale of solar systems, however when you scale up to an entire galaxy, that model becomes more and more inaccurate and we will need a new model to correct for that error. Importantly, Einstein did not ""disprove"" Newton when he invented general relativity. Newton's law of gravitation becomes more and more accurate the smaller and smaller scale you measure across. All Einstein did was show that Newton's law, while correct in a way, was just incomplete, and generalized it to a much larger context. In the same way, I don't think dark matter disproves relativity. Rather, relativity is a model that becomes more and more accurate on smaller and smaller scales, and it's not that it's *wrong* on larger scales per se; it's just incomplete. Maybe some future mathematician and physicist will come up with a new model to generalize relativity to the scale of entire galaxies, thus obsoleting the concept of dark matter entirely.",view comment
11,,@perfectomprg,22/11/23 10:51:31,0,no,no,I feel we’re missing the elephant in the room that Dark Star was an awesome movie ??,view comment
12,,@JKDVIPER,23/11/23 14:06:05,0,no,no,"We don’t need DARK MATTER. I’ve got it. Galaxy’s stay together not from gravity alone. First off, we still cannot point to a wave, a vibe, a particle, anything to ascribe something substantive to what gravity is. I’ve heard theories, Einstein was probably the closest to reality of anybody. But even if we understand gravity, who says that’s the only thing holding it together? A SPACE STORM. Think about it. If atoms in gas here on earth can be so highly energized, as to cause a hurricane, a tornado, and that’s just hot and cold gas. Not very dense. Not much power when compared to higher pressure higher temperature matter in deep space. A cold dense center like a supermassive black hole surrounded by a gaseous star matter swirling around it sounds like a SPACE STORM to me. Our missing matter (MASS) hypothesized is really and truly ENERGY. Still equivalent. A storm produces FORCE. That galaxy holds together by thermodynamics.  That’s my idea. We don’t need EXTRA MASS when we have tons of uncounted ENERGY. That’s the missing link. A galaxy is a SPACE HURRICANE bud.”",view comment
13,,@JKDVIPER,23/11/23 14:14:08,0,no,no,"My second idea is this. Matter is probably causing the expansion. Displacement of empty space, (the cosmological constant) means space has to curve around objects. If we sink a beach ball or hundreds of them in a pool. It will raise the volume by displacement. Stars, especially black holes lock out empty space and stop time, if we freeze a piece of steak it saves it longer. TIME. Black holes cores are absolute zero. Time stops. That’s a cancer, a growth to space. A beach ball sunken in a pool. That would blow out our edge with trillions of galaxies possible.",view comment
14,,@JKDVIPER,23/11/23 14:19:26,0,no,no,"Gravity is problematic for us. It probably comes from the movements of our planet sun and galaxy. Those corkscrew actions we take. Even though we move around locally we are booking it way faster as a whole in our galaxy. That thing is flying at 1.3 million MPH. That means when we do a local movement like a circle around the sun? In actuality we’re covering WAY MORE GROUND than we think. So our little circular motions are stretched out over giant lengths of empty space.” Thats gravity. You’re in a car that’s going 70,000 MPH around a FLYING NUKE. ??so even if you manage to get off the planet with force from oxygen and hydrogen, you are still flying the same speed as the car. (EARTH) ????trying to understand gravity which might not even exist, is because we aren’t realizing, you can’t jump out a window on top of a couch, and then hop off at the last second. You’ll only kick the couch away. ??see my point? A big rig on the highway next to a Volkswagen bug will pull it in to itself from motion and displacement. Space does the same thing.",view comment
15,,@Kelly77784,23/11/23 20:33:10,0,no,no,"Dark Matter
the atom
the smallest particle
I believe the atom is mostly comprised of Dark Matter",view comment
16,,@frankkolmann4801,24/11/23 05:47:57,0,no,no,"Weeeell  According to Dr Neil Turoks theory dark matter is a Right Handed Neutrino. 
So no the Dark Matter theory proposed is false.
The light the JWST is seeing could well be from the Antiuniverse.
Photons are Photons in both the Universe and the Mirror Universe.",view comment
17,,@aldawgd,25/11/23 14:57:04,1,no,no,"Soooo dark matter does not interact with regular mark as stated beginning of video.  But to make a dark star the matter helps dark matter collapse into itself???   

We really need some better ideas for gravity, dark matter, and dark energy…",view comment
18,,@PlanetBuster552,25/11/23 15:09:50,0,no,no,"@pbsspacetime Can we use a “dark star”, if they are found, to finally determine what dark matter model is most likely to be correct? Maybe a dark star powered by the more massive WIMPs would be brighter than one powered by axions, for example.",view comment
19,,@amberj8827,26/11/23 19:46:01,0,no,no,Why do emission lines suggest a galaxy and absorption lines suggest a star? It seems like emission and absorption spectra could be observed from both. Isn't a galaxy filled with stars? Does it have something to so with the absorption of clouds and dust in a galaxy?,view comment
20,,@the40thstep,26/11/23 20:30:42,0,no,no,This sort of science is akin to a fantasy book writer. I'm surprised people get paid for making stuff up like these when the existence of dark matter or dark energy is still far from certain not to mention understood...,view comment
21,,@dougadams9419,27/11/23 01:40:16,0,no,no,NO!,view comment
22,,@csabaradi,29/11/23 20:16:10,0,no,no,"I don't know what were you experimenting with, but I don't like how you modified Matt's voice. He may talk slower, but that helps you to understand better what he is saying. Speeding it up changed his pitch, and sounds so artificial it is an uncanny valley for me",view comment
23,,@arthurs5099,30/11/23 18:35:07,0,no,no,"Or the universe isn’t isotropic. It baffles me that you keep looking for this ether stuff instead of redoing the maths. And btw 30+ authors on the front page is ludicrous, ever heard of et al. ?",view comment
24,,@greendragon0009,06/12/23 16:33:43,0,no,no,Hope your cold gets better.,view comment
25,,@Underestimated37,10/12/23 07:33:58,0,no,no,"I’ve always wondered if we’re missing stuff because of redshifting causing the light from objects to pass beyond the measurable spectrum, especially if the light was already on that end of the spectrum to begin with. Just feels like we may be missing something.",view comment
26,,@Lobsta-kw9pb,16/12/23 11:32:44,0,no,no,@Matt O'Dowd I don't agree with the assumption that the universe after it came into being started out as prestine hydrogen. Or from simple building blocks. I also dont conject that it was a bang at all. Just more like material pouring into a membrane that just happened to open for business through a one directional Enstein-Rosen Bridge. And in areas the mebrane cant support a lot of charged items (quarks etc) it collapses in on itself where the virtual particles and vacuum energy ground state cant float all that charge and grvaity wins out and the universes prolapses like a sea slug. Wouldnt it be fun ti find out that blackholes all go to the same place through some quirk of hugher dimensiknal manifolds.,view comment
27,,@user-vq8wt4qo9g,19/12/23 03:31:10,0,no,no,Why is ur voice so high-pitched,view comment
28,,@milosinclair4002,19/12/23 09:09:12,1,no,no,I’m so thankful I watched till the last second. I spent the whole episode wondering if I was going crazy or if Matt had really gone full deepfake. Deeply impressed and also shook.,view comment
29,,@einarcgulbrandsen7177,20/12/23 16:02:14,1,no,no,"Best PBS lines ever: ""SPACE IS SO BIG THAT WE RAN OUT OF COOL NAMES YEARS AGO""",view comment
30,,@Fisherman4200,25/12/23 09:02:15,0,no,no,There is no dark matter at all.,view comment
31,,@AdamosDad,26/12/23 11:14:57,0,no,no,"This early on, could it be anti-matter?",view comment
32,,@MarkTill-vt3ku,27/12/23 09:05:07,0,no,no,wow totally speculative,view comment
33,,@joalnith,28/12/23 02:05:24,0,no,no,Doesn't it kinda make sense that massive universes are so far away from us? If we are looking that far into the past then there was probably greater material density back then allowing for larger bodies to form in less time. At least that's what I'm thinking as an amateur.,view comment
34,,@jasperlit1345,28/12/23 12:27:59,0,no,no,no,view comment
35,,@dnacannotchange,29/12/23 03:03:23,0,no,no,....dum af.... Just the next Darwinism Stupid as crap,view comment
36,,@ghostbonestv,29/12/23 03:32:07,0,no,no,Excellent.,view comment
37,,@InssiAjaton,29/12/23 19:19:50,0,no,no,A weird thought…  Maybe the missing symmetry between matter and antimatter is explained by antimatter having been shot way back there!,view comment
38,,@timothykalamaros2954,30/12/23 02:52:31,0,no,no,Ever detected any dark matter at all? Or just speculation?,view comment
39,,@handsome_man69,31/12/23 01:03:38,0,no,no,"You are a very handsome man, and a good looking educationalist. Thankyou for explaining us about black holes and things",view comment
40,,@keyboardheroism,01/01/24 03:05:26,1,no,no,"How could it be made of something you have no understanding about? 
Tell me what is dark energy?... you can't explain it because it is a hypothesis with zero substance.",view comment
41,,@44hd59,01/01/24 10:49:24,1,no,no,Is it possible that space can’t pass through close parts from space to space from the frame of reference of matter and farther away parts can pass through each other wich would allow for 4 dimensional gravity to interact with more matter?,view comment
42,,@jdrmanmusiqking,02/01/24 23:42:32,0,no,no,Why does this video sound... Off? His voice is a little different,view comment
43,,@undercoveragent9889,04/01/24 16:29:45,0,no,no,"Now, tell us how reindeer actually _do_ fly. RIP science. SMDH.",view comment
44,,@616CC,06/01/24 09:28:49,0,no,no,"An educator? He barely understands what he is saying himself, never mind breaking it down for others to understand. To just follow what this guy is saying you need a high level understanding of the topic yourself. So no he’s an awful educator but I don’t think he’s trying to be one tbf",view comment
45,,@AnimeShinigami13,06/01/24 16:14:50,0,no,no,"Robo Bevis:  Heheh, he said meat. heheheheheh...",view comment
46,,@felixmikolai7375,07/01/24 00:16:08,0,no,no,you know the red dot means the cam is off,view comment
47,,@longjiang2005,07/01/24 11:21:53,0,no,no,"Mirror, mirror",view comment
48,,@brandonfenley8247,08/01/24 13:53:10,0,no,no,The theme song for this episode should have been Beck’s “Dark Star”.,view comment
49,,@kevinfidler6287,08/01/24 22:36:48,0,no,no,Imagine that life made of regular matter is extremely rare and that life made of 'dark matter' is what is actually common.,view comment
50,,@utopia2112,09/01/24 00:23:51,0,no,no,If dark matter eliminates (when reacting with other dark matter) fires that mean some of it is dark anti-matter?,view comment
51,,@cy4782,09/01/24 09:37:30,0,no,no,"Something slightly off on the playback speed. Slightly too fast and it is annoying. My settings are for “normal” speed, so it is definitely the video…any reason for this?",view comment
52,,@Cobbido,09/01/24 15:29:07,0,no,no,"Dark matter stars, also known as black holes...",view comment
53,,@TwoFoxGibbon,10/01/24 23:32:52,0,no,no,"I love these. We have no way to even detect dark matter, at best we have evidence for the shadows of it existing, but here we are wondering if JWST has discovered literal stars of dark matter. lol.",view comment
54,,@aagashjoelawrence938,11/01/24 12:32:12,0,no,no,I have a silly and crazy doubt that why earth is near the centre of universe(from we observe)? or light travelling from edges of distant galaxies formed billions of years ago reaching us from all directions similarly as like observer seeing it homogeneous from all directions? Why time arrow and light travel mysteriously in a right way for us to see it?,view comment
55,,@Subninja2012,12/01/24 05:03:37,1,no,no,No,view comment
56,,@BisexualPlagueDoctor,12/01/24 16:14:00,0,no,no,"Considering a major trait of dark matter is that it doesn’t interact with light ne hardly interacts with anything else, it seems quite odd for it to be able to become a star",view comment
57,,@BisexualPlagueDoctor,12/01/24 16:24:16,0,no,no,"The idea of dark matter self annihilation may be what we need to explain dark energy, the amount of matter is decreasing and the repulsive force is increasing, possible releasing some unique particle that can’t be observed but acts like a photon but with a charge of some sort, possibly being a type of charge that isn’t a magnetic charge, and just generally only acts as a weak repulsive force without breaking any known laws of physics, but merely adding to it",view comment
58,,@pavelolofinsky6772,15/01/24 16:35:11,0,no,no,"The only problem i see here , the distants is so grate thet this objects long gone...Ther fore you canot proof what you saing, all the conclusions you presentet is speculative...",view comment
59,,@MeeKtheOWL,18/01/24 22:00:45,0,no,no,Is a proton star possible? Anti-proton star?,view comment
60,,@Tiggersharrk,19/01/24 13:41:43,0,no,no,"What if they are not as big as they think they are,  but are simply warped by the long distance and effect of expanding space acting like a giant lens?",view comment
61,,@6DarkSeer,21/01/24 15:43:37,1,no,no,"Wonderful! Can those dark stars be counted as the first direct observation of the dark matter? If those gigantic red-shifted objects turn out to be single stars, but not galaxies, will it prove the dark matter's existence?",view comment
62,,@TurkishKS,21/01/24 19:22:32,1,no,no,"Newton formulated a theory of gravity.  It worked for all practical applications of the time.  It was simple, elegant, stupendously accurate, and was easily shown to be consistent under a variety of experimental conditions.  At much larger scales, it ceased to predict the effects of gravity adequately.  A new theory of gravity was required.

Einstein formulated an improved theory of gravity.  It works for all practical applications of our time.  It is more complicated, but still elegant, even more stupendously accurate, and is easily shown to be consistent under a much wider variety of experimental conditions.  It also manages to account for the inconsistencies of the previous theory at those much larger scales.  But at even greater scales, unimaginable scales, it ceases to predict the effects of gravity adequately...

I wonder what might be needed.  Is there some historical precedent we might look to?

Oh, I know:  a conjured exotic particle whose characteristics are without precedent, and whose existence can neither be verified nor disproved with any conceivable experiment or observation.  Oh, and those unprecedented characteristics, they conveniently account for the inconsistencies observed with this newest gravitational theory.

Dark matter in the form of WIMPs, like string theory, is at its core, hand-wavy pseudoscience, no matter how many scientists, papers, educators, and books you throw at it.  The general acceptance of the existence of dark matter by the scientific community because ""works at the solar system level, should be exactly the same at galactic scales, must be dark invisible blobs we can't see"" is embarrassing.",view comment
63,,@Walter-uy4or,23/01/24 02:26:22,0,no,no,Seems like the cart is before the horse.  We do not know dark matter exists.  How much sense does it make to pile guesses on top of guesses?,view comment
64,,@dansmith5901,23/01/24 03:38:24,0,no,no,"Think of the subliminal messaging the lovely Matt O'Dowd is. All he is trying to do is to make us think for ourselves which we've now done. However, something tells me Matt has become more listless and feels life to be more predictable and unexciting.",view comment
65,,@jaidynjanis9771,25/01/24 07:55:31,0,no,no,He said a “star powered by dark matter” and I’m already skeptical. Dark matter doesn’t interact with normal matter,view comment
66,,@WolfTheMadMan,29/01/24 17:49:59,1,no,no,"I cant be the only person who sees patterns between the subatomic, and macro levels. The best way I can explain is through uncertainty. We can't currently predict the position of subatomic particles, and likewise, you can't predict the future. Say I try to do a standing back flip in my living room. I've never done that before, so it's safe to assume that I could land on my feet, or I could land on my knees, or even my head. Only time and action can tell you what is real. Maybe one of these days, if we manage to achieve absolute zero temp, we will have enough understanding to predict quantum fluctuations, predict the future, and have a solid understanding of how the universe functions from tip to butt, including gravity. Of course there very well may be universal barriers that prevent us from doing this. Ironically, this also helps with the Fermi paradox. 

TLDR: There's no free lunch in this universe, and of there is, you stole it.",view comment
67,,@iceu9987,06/02/24 00:37:50,0,no,no,This video was particularly pleasing,view comment
68,,@watchthe1369,06/02/24 08:12:21,0,no,no,Boson stars?  Wow!,view comment
69,,@robert-zj7ef,06/02/24 20:01:19,0,no,no,"What do you mean, you ran out of cool names. WHICH GALAXY IS NAMED ""BOB""???",view comment
70,,@robert-zj7ef,06/02/24 20:13:14,0,no,no,Is gravity additive in supermassive black mergers where the sum is equal to the values of each?,view comment
71,,@SiriusBooMR,08/02/24 00:27:46,0,no,no,The very moment they realize dark matter is actually the physical manifestation of time itself,view comment
72,,@user-ph9sc9dp2z,10/02/24 20:10:43,0,no,no,"When they start running out of names for stars and galaxies, they start colour coding them",view comment
73,,@timflatus,11/02/24 13:46:28,1,no,no,"It's the near impossibility of verifying or refuting dark matter / energy that bothers me. We're trying to talk about something we don't understand and can't perceive, which could be nothing more than a limitation of the general theory of relativity. It still sounds like pseudo-science to me. ""Dark"" is just a placeholder for ""Don't know"" isn't it? Let's be honest. If an object stops emitting light, is it still a star? What if galactic centres just are super-massive? Do we even need the concept of black holes? Every astronomy vid I see makes me doubt our basic assumptions about the universe, even the big bang, more (PS Dr Becky is awesome). I am not saying anyone is wrong here, I just find it confusing when people talk about hypotheses as if they were proven science.",view comment
74,,@padraiggluck2980,12/02/24 20:45:14,0,no,no,How about antimatter stars?,view comment
75,,@Sadistichippo,14/02/24 10:17:19,2,no,no,I love that one of the answers on the question time of the dark stars episode… is a TLDR on dark stars,view comment
76,,@user-kz2tn7yk9z,16/02/24 02:11:33,0,no,no,I accidently destroyed the night sky so whatever this clip says the James Webb telescope discovered is gone everything exists inside my cell core which created everything what I'm trying to learn more about is how the wave particle duality of photons with properties of darkness instead of light works,view comment
77,,@freehat2722,18/02/24 02:59:29,0,no,no,Dr. Becky sucks.,view comment
78,,@maxwellblackwell5045,19/02/24 06:57:58,0,no,no,Also know as we cant actually estimate the mass of things that are light years away from us...,view comment
79,,@VestedUTuber,20/02/24 01:16:51,1,no,no,Couldn't they be Quasi-stars? Quasi-stars are theorized to have existed in the early days of the universe and are thought to have been brighter than galaxies.,view comment
80,,@tomsawyer4776,20/02/24 11:21:46,0,no,no,"This video redefines the word ""conjecture"" , and takes it to new heights. This group of physicist drank way too much coffee before going to bed.",view comment
81,,@theostickle2604,20/02/24 20:59:12,0,no,no,Can we please call z10 Joanna?,view comment
